296,"community on involving all adults equally, regardless of gender, these taboos and reactionary or"
297,"extremist ideas have progressively been discouraged."
298,"43. Consistent with articles 2, 3 and 24 in particular, the Committee requires that all States"
299,"parties gradually progress to a stage where, by its resolute discouragement of notions of the"
300,"inequality of women in the home, each country will withdraw its reservation, in particular to"
301,"articles 9, 15 and 16 of the Convention."
302,"44. States parties should resolutely discourage any notions of inequality of women and men"
303,"which are affirmed by laws, or by religious or private law or by custom, and progress to the stage"
304,"where reservations, particularly to article 16, will be withdrawn."
305,"45. The Committee noted, on the basis of its examination of initial and subsequent periodic"
306,"reports, that in some States parties to the Convention that had ratified or acceded without"
307,"reservation, certain laws, especially those dealing with family, do not actually conform to the"
308,"provisions of the Convention."
309,"46. Their laws still contain many measures which discriminate against women based on norms,"
310,"customs and sociocultural prejudices. These States, because of their specific situation regarding"
311,"these articles, make it difficult for the Committee to evaluate and understand the status of"
312,"women."
313,"47. The Committee, in particular on the basis of articles 1 and 2 of the Convention, requests"
314,"that those States parties make the necessary efforts to examine the de facto situation relating to"
315,"the issues and to introduce the required measures in their national legislations still containing"
316,"provisions discriminatory to women."
317,"Reports"
318,"48. Assisted by the comments in the present general recommendation, in their reports States"
319,"parties should:"
320,"(a) Indicate the stage that has been reached in the country’s progress to removal of all"
321,"reservations to the Convention, in particular reservations to article 16;(b) Set out whether their laws comply with the principles of articles 9, 15 and 16 and"
322,"where, by reason of religious or private law or custom, compliance with the law or with the"
323,"Convention is impeded."
324,"Legislation"
325,"49. States parties should, where necessary to comply with the Convention, in particular in"
326,"order to comply with articles 9, 15 and 16, enact and enforce legislation."
327,"Encouraging compliance with the Convention"
328,"50. Assisted by the comments in the present general recommendation, and as required by"
329,"articles 2, 3 and 24, States parties should introduce measures directed at encouraging full"
330,"compliance with the principles of the Convention, particularly where religious or private law or"
331,"custom conflict with those principles."
