"1","HRI/GEN/1/Rev.9 (Vol. I)"
280,"32. The rights which persons belonging to minorities enjoy under article 27 of the Covenant in"
281,"respect of their language, culture and religion do not authorize any State, group or person to"
282,"violate the right to the equal enjoyment by women of any Covenant rights, including the right to"
283,"HRI/GEN/1/Rev.9 (Vol. I)"
284,"equal protection of the law. States should report on any legislation or administrative practices"
285,"related to membership in a minority community that might constitute an infringement of the"
286,"equal rights of women under the Covenant (communication No. 24/1977, Lovelace v. Canada,"
287,"Views adopted July 1981) and on measures taken or envisaged to ensure the equal right of men"
288,"and women to enjoy all civil and political rights in the Covenant. Likewise, States should report"
289,"on measures taken to discharge their responsibilities in relation to cultural or religious practices"
290,"within minority communities that affect the rights of women. In their reports, States parties"
291,"should pay attention to the contribution made by women to the cultural life of their"
292,"communities."
