312,"Nonetheless, on the basis of the information provided in the reports from some States parties, it"
313,"is clear that a variety of community-based programmes have been developed, such as community"
314,"service, supervision and guidance by for example social workers or probation officers, family"
315,"conferencing and other forms of restorative justice including restitution to and compensation of"
316,"victims. Other States parties should benefit from these experiences. As far as full respect for"
317,"human rights and legal safeguards is concerned, the Committee refers to the relevant parts of"
318,"article 40 of CRC and emphasizes the following:"
319,"− Diversion (i.e. measures for dealing with children, alleged as, accused of, or recognized"
320,"as having infringed the penal law without resorting to judicial proceedings) should be"
321,"used only when there is compelling evidence that the child committed the alleged"
322,"offence, that he/she freely and voluntarily admits responsibility, and that no intimidation"
323,"or pressure has been used to get that admission and, finally, that the admission will not"
324,"be used against him/her in any subsequent legal proceeding;"
325,"− The child must freely and voluntarily give consent in writing to the diversion, a consent"
326,"that should be based on adequate and specific information on the nature, content and"
327,"duration of the measure, and on the consequences of a failure to cooperate, carry out"
328,"and complete the measure. With a view to strengthening parental involvement, States"
329,"parties may also consider requiring the consent of parents, in particular when the child"
330,"is below the age of 16 years;"
331,"CRC/C/GC/10"
332,"page 10"
333,"− The law has to contain specific provisions indicating in which cases diversion is"
334,"possible, and the powers of the police, prosecutors and/or other agencies to make"
335,"decisions in this regard should be regulated and reviewed, in particular to protect the"
336,"child from discrimination;"
337,"− The child must be given the opportunity to seek legal or other appropriate assistance on"
338,"the appropriateness and desirability of the diversion offered by the competent"
339,"authorities, and on the possibility of review of the measure;"
340,"− The completion of the diversion by the child should result in a definite and final closure"
341,"of the case. Although confidential records can be kept of diversion for administrative"
342,"and review purposes, they should not be viewed as “criminal records” and a child who"
343,"has been previously diverted must not be seen as having a previous conviction. If any"
344,"registration takes place of this event, access to that information should be given"
345,"exclusively and for a limited period of time, e.g. for a maximum of one year, to the"
346,"competent authorities authorized to deal with children in conflict with the law."
347,"Interventions in the context of judicial proceedings"
348,"28. When judicial proceedings are initiated by the competent authority (usually the"
349,"prosecutor’s office), the principles of a fair and just trial must be applied (see section D below)."
350,"At the same time, the juvenile justice system should provide for ample opportunities to deal with"
351,"children in conflict with the law by using social and/or educational measures, and to strictly limit"
352,"the use of deprivation of liberty, and in particular pretrial detention, as a measure of last resort."
353,"In the disposition phase of the proceedings, deprivation of liberty must be used only as a measure"
354,"of last resort and for the shortest appropriate period of time (art. 37 (b)). This means that States"
355,"parties should have in place a well-trained probation service to allow for the maximum and"
356,"effective use of measures such as guidance and supervision orders, probation, community"
357,"monitoring or day report centres, and the possibility of early release from detention."
358,"29. The Committee reminds States parties that, pursuant to article 40 (1) of CRC, reintegration"
359,"requires that no action may be taken that can hamper the child’s full participation in his/her"
360,"community, such as stigmatization, social isolation, or negative publicity of the child. For a child"
361,"in conflict with the law to be dealt with in a way that promotes reintegration requires that all"
362,"actions should support the child becoming a full, constructive member of his/her society."
363,"C. Age and children in conflict with the law"
364,"The minimum age of criminal responsibility"
365,"30. The reports submitted by States parties show the existence of a wide range of minimum"
366,"ages of criminal responsibility. They range from a very low level of age 7 or 8 to the"
367,"commendable high level of age 14 or 16. Quite a few States parties use two minimum ages of"
368,"criminal responsibility. Children in conflict with the law who at the time of the commission of"
369,"the crime are at or above the lower minimum age but below the higher minimum age are"
370,"assumed to be criminally responsible only if they have the required maturity in that regard. The"
371,"assessment of this maturity is left to the court/judge, often without the requirement of involving a"
372,"psychological expert, and results in practice in the use of the lower minimum age in cases of"
373,"CRC/C/GC/10"
374,"page 11"
375,"serious crimes. The system of two minimum ages is often not only confusing, but leaves much to"
376,"the discretion of the court/judge and may result in discriminatory practices. In the light of this"
377,"wide range of minimum ages for criminal responsibility the Committee feels that there is a need"
378,"to provide the States parties with clear guidance and recommendations regarding the minimum"
379,"age of criminal responsibility."
380,"31. Article 40 (3) of CRC requires States parties to seek to promote, inter alia, the"
381,"establishment of a minimum age below which children shall be presumed not to have the"
382,"capacity to infringe the penal law, but does not mention a specific minimum age in this regard."
383,"The committee understands this provision as an obligation for States parties to set a minimum"
384,"age of criminal responsibility (MACR). This minimum age means the following:"
385,"− Children who commit an offence at an age below that minimum cannot be held"
386,"responsible in a penal law procedure. Even (very) young children do have the capacity"
387,"to infringe the penal law but if they commit an offence when below MACR the"
388,"irrefutable assumption is that they cannot be formally charged and held responsible in a"
389,"penal law procedure. For these children special protective measures can be taken if"
390,"necessary in their best interests;"
391,"− Children at or above the MACR at the time of the commission of an offence (or:"
392,"infringement of the penal law) but younger than 18 years (see also paragraphs 35-38"
393,"below) can be formally charged and subject to penal law procedures. But these"
394,"procedures, including the final outcome, must be in full compliance with the principles"
395,"and provisions of CRC as elaborated in the present general comment."
396,"32. Rule 4 of the Beijing Rules recommends that the beginning of MACR shall not be fixed at"
397,"too low an age level, bearing in mind the facts of emotional, mental and intellectual maturity. In"
398,"line with this rule the Committee has recommended States parties not to set a MACR at a too"
399,"low level and to increase the existing low MACR to an internationally acceptable level. From"
400,"these recommendations, it can be concluded that a minimum age of criminal responsibility below"
401,"the age of 12 years is considered by the Committee not to be internationally acceptable. States"
402,"parties are encouraged to increase their lower MACR to the age of 12 years as the absolute"
403,"minimum age and to continue to increase it to a higher age level."
404,"33. At the same time, the Committee urges States parties not to lower their MACR to the age"
405,"of 12. A higher MACR, for instance 14 or 16 years of age, contributes to a juvenile justice"
406,"system which, in accordance with article 40 (3) (b) of CRC, deals with children in conflict with"
407,"the law without resorting to judicial proceedings, providing that the child’s human rights and"
408,"legal safeguards are fully respected. In this regard, States parties should inform the Committee in"
409,"their reports in specific detail how children below the MACR set in their laws are treated when"
410,"they are recognized as having infringed the penal law, or are alleged as or accused of having"
411,"done so, and what kinds of legal safeguards are in place to ensure that their treatment is as fair"
412,"and just as that of children at or above MACR."
413,"34. The Committee wishes to express its concern about the practice of allowing exceptions to a"
414,"MACR which permit the use of a lower minimum age of criminal responsibility in cases where"
415,"CRC/C/GC/10"
416,"page 12"
417,"the child, for example, is accused of committing a serious offence or where the child is"
418,"considered mature enough to be held criminally responsible. The Committee strongly"
419,"recommends that States parties set a MACR that does not allow, by way of exception, the use of"
420,"a lower age."
421,"35. If there is no proof of age and it cannot be established that the child is at or above the"
422,"MACR, the child shall not be held criminally responsible (see also paragraph 39 below)."
423,"The upper age-limit for juvenile justice"
424,"36. The Committee also wishes to draw the attention of States parties to the upper age-limit for"
425,"the application of the rules of juvenile justice. These special rules - in terms both of special"
426,"procedural rules and of rules for diversion and special measures - should apply, starting at the"
427,"MACR set in the country, for all children who, at the time of their alleged commission of an"
428,"offence (or act punishable under the criminal law), have not yet reached the age of 18 years."
429,"37. The Committee wishes to remind States parties that they have recognized the right of every"
430,"child alleged as, accused of, or recognized as having infringed the penal law to be treated in"
431,"accordance with the provisions of article 40 of CRC. This means that every person under the age"
432,"of 18 years at the time of the alleged commission of an offence must be treated in accordance"
433,"with the rules of juvenile justice."
434,"38. The Committee, therefore, recommends that those States parties which limit the"
435,"applicability of their juvenile justice rules to children under the age of 16 (or lower) years, or"
436,"which allow by way of exception that 16 or 17-year-old children are treated as adult criminals,"
437,"change their laws with a view to achieving a non-discriminatory full application of their juvenile"
438,"justice rules to all persons under the age of 18 years. The Committee notes with appreciation that"
439,"some States parties allow for the application of the rules and regulations of juvenile justice to"
440,"persons aged 18 and older, usually till the age of 21, either as a general rule or by way of"
441,"exception."
442,"39. Finally, the Committee wishes to emphasize the fact that it is crucial for the full"
443,"implementation of article 7 of CRC requiring, inter alia, that every child shall be registered"
444,"immediately after birth to set age-limits one way or another, which is the case for all States"
445,"parties. A child without a provable date of birth is extremely vulnerable to all kinds of abuse and"
446,"injustice regarding the family, work, education and labour, particularly within the juvenile justice"
447,"system. Every child must be provided with a birth certificate free of charge whenever he/she"
448,"needs it to prove his/her age. If there is no proof of age, the child is entitled to a reliable medical"
449,"or social investigation that may establish his/her age and, in the case of conflict or inconclusive"
450,"evidence, the child shall have the right to the rule of the benefit of the doubt."
451,"D. The guarantees for a fair trial"
452,"40. Article 40 (2) of CRC contains an important list of rights and guarantees that are all meant"
453,"to ensure that every child alleged as or accused of having infringed the penal law receives fair"
454,"treatment and trial. Most of these guarantees can also be found in article 14 of the International"
455,"Covenant on Civil and Political Rights (ICCPR), which the Human Rights Committee elaborated"
456,"and commented on in its general comment No. 13 (1984) (Administration of justice) which is"
457,"CRC/C/GC/10"
458,"page 13"
459,"currently in the process of being reviewed. However, the implementation of these guarantees for"
460,"children does have some specific aspects which will be presented in this section. Before doing"
461,"so, the Committee wishes to emphasize that a key condition for a proper and effective"
462,"implementation of these rights or guarantees is the quality of the persons involved in the"
463,"administration of juvenile justice. The training of professionals, such as police officers,"
464,"prosecutors, legal and other representatives of the child, judges, probation officers, social"
465,"workers and others is crucial and should take place in a systematic and ongoing manner. These"
466,"professionals should be well informed about the child’s, and particularly about the adolescent’s"
467,"physical, psychological, mental and social development, as well as about the special needs of the"
468,"most vulnerable children, such as children with disabilities, displaced children, street children,"
469,"refugee and asylum-seeking children, and children belonging to racial, ethnic, religious,"
470,"linguistic or other minorities (see paragraphs 6-9 above). Since girls in the juvenile justice"
471,"system may be easily overlooked because they represent only a small group, special attention"
472,"must be paid to the particular needs of the girl child, e.g. in relation to prior abuse and special"
473,"health needs. Professionals and staff should act under all circumstances in a manner consistent"
474,"with the child’s dignity and worth, which reinforces the child’s respect for the human rights and"
475,"fundamental freedoms of others, and which promotes the child’s reintegration and his/her"
476,"assuming a constructive role in society (art. 40 (1)). All the guarantees recognized in"
477,"article 40 (2), which will be dealt with hereafter, are minimum standards, meaning that States"
478,"parties can and should try to establish and observe higher standards, e.g. in the areas of legal"
479,"assistance and the involvement of the child and her/his parents in the judicial process."
480,"No retroactive juvenile justice (art. 40 (2) (a))"
481,"41. Article 40 (2) (a) of CRC affirms that the rule that no one shall be held guilty of any"
482,"criminal offence on account of any act or omission which did not constitute a criminal offence,"
483,"under national or international law, at the time it was committed is also applicable to children"
484,"(see also article 15 of ICCPR). It means that no child can be charged with or sentenced under the"
485,"penal law for acts or omissions which at the time they were committed were not prohibited under"
486,"national or international law. In the light of the fact that many States parties have recently"
487,"strengthened and/or expanded their criminal law provisions to prevent and combat terrorism, the"
488,"Committee recommends that States parties ensure that these changes do not result in retroactive"
489,"or unintended punishment of children. The Committee also wishes to remind States parties that"
490,"the rule that no heavier penalty shall be imposed than the one that was applicable at the time"
491,"when the criminal offence was committed, as expressed in article 15 of ICCPR, is in the light of"
492,"article 41 of CRC, applicable to children in the States parties to ICCPR. No child shall be"
493,"punished with a heavier penalty than the one applicable at the time of his/her infringement of the"
494,"penal law. But if a change of law after the act provides for a lighter penalty, the child should"
495,"benefit from this change."
496,"The presumption of innocence (art. 40 (2) (b) (i))"
497,"42. The presumption of innocence is fundamental to the protection of the human rights of"
498,"children in conflict with the law. It means that the burden of proof of the charge(s) brought"
499,"against the child is on the prosecution. The child alleged as or accused of having infringed the"
500,"penal law has the benefit of doubt and is only guilty as charged if these charges have been"
501,"proven beyond reasonable doubt. The child has the right to be treated in accordance with this"
502,"presumption and it is the duty of all public authorities or others involved to refrain from"
503,"CRC/C/GC/10"
504,"page 14"
505,"prejudging the outcome of the trial. States parties should provide information about child"
506,"development to ensure that this presumption of innocence is respected in practice. Due to the"
507,"lack of understanding of the process, immaturity, fear or other reasons, the child may behave in a"
508,"suspicious manner, but the authorities must not assume that the child is guilty without proof of"
509,"guilt beyond any reasonable doubt."
510,"The right to be heard (art. 12)"
511,"43. Article 12 (2) of CRC requires that a child be provided with the opportunity to be heard in"
512,"any judicial or administrative proceedings affecting the child, either directly or through a"
513,"representative or an appropriate body in a manner consistent with the procedural rules of national"
514,"law."
515,"44. It is obvious that for a child alleged as, accused of, or recognized as having infringed the"
516,"penal law, the right to be heard is fundamental for a fair trial. It is equally obvious that the child"
517,"has the right to be heard directly and not only through a representative or an appropriate body if"
518,"it is in her/his best interests. This right must be fully observed at all stages of the process, starting"
519,"with pretrial stage when the child has the right to remain silent, as well as the right to be heard by"
520,"the police, the prosecutor and the investigating judge. But it also applies to the stages of"
521,"adjudication and of implementation of the imposed measures. In other words, the child must be"
522,"given the opportunity to express his/her views freely, and those views should be given due"
523,"weight in accordance with the age and maturity of the child (art. 12 (1)), throughout the juvenile"
524,"justice process. This means that the child, in order to effectively participate in the proceedings,"
525,"must be informed not only of the charges (see paragraphs 47-48 below), but also of the juvenile"
526,"justice process as such and of the possible measures."
527,"45. The child should be given the opportunity to express his/her views concerning the"
528,"(alternative) measures that may be imposed, and the specific wishes or preferences he/she may"
529,"have in this regard should be given due weight. Alleging that the child is criminally responsible"
530,"implies that he/she should be competent and able to effectively participate in the decisions"
531,"regarding the most appropriate response to allegations of his/her infringement of the penal law"
532,"(see paragraph 46 below). It goes without saying that the judges involved are responsible for"
533,"taking the decisions. But to treat the child as a passive object does not recognize his/her rights"
534,"nor does it contribute to an effective response to his/her behaviour. This also applies to the"
535,"implementation of the measure(s) imposed. Research shows that an active engagement of the"
536,"child in this implementation will, in most cases, contribute to a positive result."
537,"The right to effective participation in the proceedings (art 40 (2) (b) (iv))"
538,"46. A fair trial requires that the child alleged as or accused of having infringed the penal law"
539,"be able to effectively participate in the trial, and therefore needs to comprehend the charges, and"
540,"possible consequences and penalties, in order to direct the legal representative, to challenge"
541,"witnesses, to provide an account of events, and to make appropriate decisions about evidence,"
542,"testimony and the measure(s) to be imposed. Article 14 of the Beijing Rules provides that the"
543,"proceedings should be conducted in an atmosphere of understanding to allow the child to"
544,"participate and to express himself/herself freely. Taking into account the child’s age and maturity"
545,"may also require modified courtroom procedures and practices."
546,"CRC/C/GC/10"
547,"page 15"
548,"Prompt and direct information of the charge(s) (art. 40 (2) (b) (ii))"
549,"47. Every child alleged as or accused of having infringed the penal law has the right to be"
550,"informed promptly and directly of the charges brought against him/her. Prompt and direct means"
551,"as soon as possible, and that is when the prosecutor or the judge initially takes procedural steps"
552,"against the child. But also when the authorities decide to deal with the case without resorting to"
553,"judicial proceedings, the child must be informed of the charge(s) that may justify this approach."
554,"This is part of the requirement of article 40 (3) (b) of CRC that legal safeguards should be fully"
555,"respected. The child should be informed in a language he/she understands. This may require a"
556,"presentation of the information in a foreign language but also a “translation” of the formal legal"
557,"jargon often used in criminal/juvenile charges into a language that the child can understand."
558,"48. Providing the child with an official document is not enough and an oral explanation may"
559,"often be necessary. The authorities should not leave this to the parents or legal guardians or the"
560,"child’s legal or other assistance. It is the responsibility of the authorities (e.g. police, prosecutor,"
561,"judge) to make sure that the child understands each charge brought against him/her. The"
562,"Committee is of the opinion that the provision of this information to the parents or legal"
563,"guardians should not be an alternative to communicating this information to the child. It is most"
564,"appropriate if both the child and the parents or legal guardians receive the information in such a"
565,"way that they can understand the charge(s) and the possible consequences."
566,"Legal or other appropriate assistance (art. 40 (2) (b) (ii))"
567,"49. The child must be guaranteed legal or other appropriate assistance in the preparation and"
568,"presentation of his/her defence. CRC does require that the child be provided with assistance,"
569,"which is not necessarily under all circumstances legal but it must be appropriate. It is left to the"
570,"discretion of States parties to determine how this assistance is provided but it should be free of"
571,"charge. The Committee recommends the State parties provide as much as possible for adequate"
572,"trained legal assistance, such as expert lawyers or paralegal professionals. Other appropriate"
573,"assistance is possible (e.g. social worker), but that person must have sufficient knowledge and"
574,"understanding of the various legal aspects of the process of juvenile justice and must be trained"
575,"to work with children in conflict with the law."
576,"50. As required by article 14 (3) (b) of ICCPR, the child and his/her assistant must have"
577,"adequate time and facilities for the preparation of his/her defence. Communications between the"
578,"child and his/her assistance, either in writing or orally, should take place under such conditions"
579,"that the confidentiality of such communications is fully respected in accordance with the"
580,"guarantee provided for in article 40 (2) (b) (vii) of CRC, and the right of the child to be protected"
581,"against interference with his/her privacy and correspondence (art. 16 of CRC). A number of"
582,"States parties have made reservations regarding this guarantee (art. 40 (2) (b) (ii) of CRC),"
583,"apparently assuming that it requires exclusively the provision of legal assistance and therefore by"
584,"a lawyer. That is not the case and such reservations can and should be withdrawn."
585,"Decisions without delay and with involvement of parents (art. 40 (2) (b) (iii))"
586,"51. Internationally there is a consensus that for children in conflict with the law the time"
587,"between the commission of the offence and the final response to this act should be as short as"
588,"CRC/C/GC/10"
589,"page 16"
590,"possible. The longer this period, the more likely it is that the response loses its desired positive,"
591,"pedagogical impact, and the more the child will be stigmatized. In this regard, the Committee"
592,"also refers to article 37 (d) of CRC, where the child deprived of liberty has the right to a prompt"
593,"decision on his/her action to challenge the legality of the deprivation of his/her liberty. The term"
594,"“prompt” is even stronger - and justifiably so given the seriousness of deprivation of liberty -"
595,"than the term “without delay” (art. 40 (2) (b) (iii) of CRC), which is stronger than the term"
596,"“without undue delay” of article 14 (3) (c) of ICCPR."
