"1","United Nations CEDAW/C/GC/39"
2,"Convention on the Elimination"
3,"of All Forms of Discrimination"
4,"against Women"
5,"Distr.: General"
6,"31 October 2022"
7,"Original: English"
8,"22-24375 (E) 161122"
9,"*2224375*"
10,"Committee on the Elimination of Discrimination"
11,"against Women"
12,"General recommendation No. 39 (2022) on the rights of"
13,"Indigenous women and girls"
14,"Contents"
15,"Page"
16,"I. Introduction . . . . . . . . . . . . . . . . . . . . . . . . . . . . . . . . . . . . . . . . . . . . . . . . . . . . . . . . . . . . . . . . . . . 2"
17,"II. Objectives and scope . . . . . . . . . . . . . . . . . . . . . . . . . . . . . . . . . . . . . . . . . . . . . . . . . . . . . . . . . . . . 4"
18,"III. Legal framework . . . . . . . . . . . . . . . . . . . . . . . . . . . . . . . . . . . . . . . . . . . . . . . . . . . . . . . . . . . . . . . 5"
19,"IV. General obligations of States parties in relation to the rights of Indigenous women and girls"
20,"under articles 1 and 2 . . . . . . . . . . . . . . . . . . . . . . . . . . . . . . . . . . . . . . . . . . . . . . . . . . . . . . . . . . . 6"
21,"A. Equality and non-discrimination, with a focus on Indigenous women and intersecting"
22,"forms of discrimination . . . . . . . . . . . . . . . . . . . . . . . . . . . . . . . . . . . . . . . . . . . . . . . . . . . . . 6"
23,"B. Access to justice and plural legal systems . . . . . . . . . . . . . . . . . . . . . . . . . . . . . . . . . . . . . . 10"
24,"V. Obligations of States parties in relation to specific dimensions of the rights of Indigenous"
25,"women and girls . . . . . . . . . . . . . . . . . . . . . . . . . . . . . . . . . . . . . . . . . . . . . . . . . . . . . . . . . . . . . . . 13"
26,"A. Prevention of and protection from gender-based violence against Indigenous women and"
27,"girls (arts. 3, 5, 6, 10 (c), 11, 12, 14 and 16) . . . . . . . . . . . . . . . . . . . . . . . . . . . . . . . . . . . . . 13"
28,"B. Right to effective participation in political and public life (arts. 7, 8 and 14) . . . . . . . . . . 16"
29,"C. Right to education (arts. 5 and 10) . . . . . . . . . . . . . . . . . . . . . . . . . . . . . . . . . . . . . . . . . . . . 18"
30,"D. Right to work (arts. 11 and 14) . . . . . . . . . . . . . . . . . . . . . . . . . . . . . . . . . . . . . . . . . . . . . . . 19"
31,"E. Right to health (arts. 10 and 12) . . . . . . . . . . . . . . . . . . . . . . . . . . . . . . . . . . . . . . . . . . . . . . 20"
32,"F. Right to culture (arts. 3, 5, 13 and 14). . . . . . . . . . . . . . . . . . . . . . . . . . . . . . . . . . . . . . . . . . 21"
33,"G. Rights to land, territories and natural resources (arts. 13 and 14) . . . . . . . . . . . . . . . . . . . . 23"
34,"H. Rights to food, water and seeds (arts. 12 and 14) . . . . . . . . . . . . . . . . . . . . . . . . . . . . . . . . . 23"
35,"I. Right to a clean, healthy and sustainable environment (arts. 12 and 14) . . . . . . . . . . . . . . 24CEDAW/C/GC/39"
36,"22-24375"
37,"2/25"
38,"I. Introduction"
39,"1. The present general recommendation provides guidance to States parties on"
40,"legislative, policy and other relevant measures to ensure the implementation of their"
41,"obligations in relation to the rights of Indigenous women and girls under the"
42,"Convention on the Elimination of All Forms of Discrimination against Women. There"
43,"are an estimated 476.6 million Indigenous Peoples globally, of whom more than half"
44,"(238.4 million) are women.1 Discrimination and violence are recurrent phenomena in"
45,"the lives of many Indigenous women and girls living in rural, remote and urban areas."
46,"The present general recommendation applies to Indigenous women and girls both"
47,"inside and outside Indigenous territories."
48,"2. The present general recommendation takes into account the voices of"
49,"Indigenous women and girls as driving actors and leaders inside and outside their"
50,"communities. It identifies and addresses different forms of intersectional"
51,"discrimination faced by Indigenous women and girls and their key role as leaders,"
52,"knowledge-bearers and transmitters of culture among their peoples, communities and"
53,"families, as well as society as a whole. The Committee on the Elimination of"
54,"Discrimination against Women has consistently identified patterns of discrimination"
55,"faced by Indigenous women and girls in the exercise of their human rights, 2 and the"
56,"factors that continue to exacerbate discrimination against them. Such discrimination"
57,"is often intersectional and based on factors such as sex; gender; Indigenous origin,"
58,"status or identity; race; ethnicity; disability; age; language; socioeconomic status; and"
59,"HIV/AIDS status.3"
60,"3. Intersectional discrimination against Indigenous women and girls must be"
61,"understood in the context of the multifaceted nature of their identity. They face"
62,"discrimination and gender-based violence, frequently committed by State and non-"
63,"State actors. These forms of violence and discrimination are widespread and are often"
64,"treated with impunity. Indigenous women and girls often have an inextricable link"
65,"and relation to their peoples, lands, territories, natural resources and culture. To"
66,"ensure compliance with articles 1 and 2 and other relevant provisions of the"
67,"Convention, State action, legislation and policies must reflect and respect the"
68,"multifaceted identity of Indigenous women and girls. States parties should also take"
69,"into consideration the intersectional discrimination experienced by Indigenous"
70,"women and girls on the basis of factors such as sex; gender; Indigenous origin, status"
71,"or identity; race; ethnicity; disability; age; language; socioeconomic status; and"
72,"HIV/AIDS status."
73,"4. State action to prevent and address discrimination against Indigenous women"
74,"and girls throughout their lifespan must integrate a gender perspective, an"
75,"intersectional perspective, an Indigenous women and girls perspective, an"
76,"intercultural perspective and a multidisciplinary perspective. A gender perspective"
77,"takes into consideration the discriminatory norms, harmful social practices,"
78,"__________________"
79,"1 International Labour Organization (ILO), Implementing the ILO Indigenous and Tribal Peoples"
80,"Convention No. 169: Towards an Inclusive, Sustainable and Just Future (Geneva, 2019), p. 13;"
81,"and Department of Economic and Social Affairs, State of the World’s Indigenous Peoples, vol. 5,"
82,"Rights to Lands, Territories and Resources (United Nations publication, 2021), p. 119."
83,"2 See, for example, general recommendation No. 34 (2016) on the rights of rural women,"
84,"paras. 14–15. For more discussion of the work of the Committee in the area of Indigenous"
85,"women, see United Nations Entity for Gender Equality and the Empowerment of Women"
86,"(UN-Women) and Committee on the Elimination of Discrimination against Women,"
87,"“Recomendaciones Generales y Observaciones Finales del Comité para la Eliminación de la"
88,"Discriminación contra la Mujer sobre mujeres indígenas y/o afrodescendientes realizadas a"
89,"Estados de América Latina” (Clayton, Panama, 2017)."
90,"3 United Nations Declaration on the Rights of Indigenous Peoples, art. 2.CEDAW/C/GC/39"
91,"3/25"
92,"22-24375"
93,"stereotypes and inferior treatment that have affected Indigenous women and girls"
94,"historically and still affect them in the present. An intersectional perspective requires"
95,"States to consider the multitude of factors that combine to increase the exposure of"
96,"Indigenous women and girls to, and exacerbate the consequences of, unequal and"
97,"arbitrary treatment on the basis of sex; gender; Indigenous origin, status or identity;"
98,"race; ethnicity; disability; age; language; socioeconomic status; and HIV/AIDS status,"
99,"among other factors. States should take into consideration the interdependence and"
100,"interconnectedness of all these factors in their adoption of laws, policies, national"
101,"budgets and interventions related to Indigenous women and girls. Indigenous women"
102,"and girls suffer intersectional discrimination both inside and outside their territories."
103,"Intersectional discrimination against them is structural, embedded in constitutions,"
104,"laws and policies, as well as government programmes, action and services."
105,"5. An Indigenous women and girls perspective entails understanding the"
106,"distinction between their experiences, realities and needs in the area of human rights"
107,"protection and those of Indigenous men, based on their sex and gender differences. It"
108,"also involves considering the status of Indigenous girls as developing women, which"
109,"requires interventions to be appropriate to their age, development and condition. An"
110,"intercultural perspective involves considering the diversity of Indigenous Peoples,"
111,"including their cultures, languages, beliefs and values, and the social appreciation and"
112,"value of this diversity. Lastly, a multidisciplinary perspective requires an appreciation"
113,"of the multifaceted identity of Indigenous women and girls and of how law, health,"
114,"education, culture, spirituality, anthropology, economy, science and work, among"
115,"other aspects, have shaped and continue to shape the social experience of Indigenous"
116,"women and girls and to promote discrimination against them. These perspectives and"
117,"approaches are key to preventing and eradicating discrimination against Indigenous"
118,"women and girls and to achieving the goal of social justice when their human rights"
119,"are violated."
120,"6. The prohibition of discrimination under articles 1 and 2 of the Convention must"
121,"be strictly applied to ensure the rights of Indigenous women and girls, including those"
122,"living in voluntary isolation or initial contact, to self-determination and to access to"
123,"and the integrity of their lands, territories and resources, culture and environment."
124,"The prohibition of discrimination should also be implemented to ensure their rights"
125,"to effective and equal participation in decision-making and to consultation, in and"
126,"through their own representative institutions, in order to obtain their free, prior and"
127,"informed consent before the adoption and implementation of legislative or"
128,"administrative measures that may affect them. This set of rights lays the foundation"
129,"for a holistic understanding of the individual and collective rights of Indigenous"
130,"women. The violation of any of these or related rights constitutes discrimination"
131,"against Indigenous women and girls."
132,"7. In implementing the present general recommendation, the Committee calls upon"
133,"States parties to take into consideration the challenging context in which Indigenous"
134,"women and girls exercise and defend their human rights. They are heavily affected"
135,"by existential threats connected to climate change, environmental degradation, the"
136,"loss of biodiversity and barriers in gaining access to food and water security. 4"
137,"Extractive activities carried out by business enterprises and other industrial, financial,"
138,"public and private actors often have a devastating impact on the environment, air,"
139,"land, waterways, oceans, territories and natural resources of Indigenous Peoples and"
140,"may infringe the rights of Indigenous women and girls. Indigenous women and girls"
141,"are at the forefront of the local, national and international demand and action for a"
142,"clean, safe, healthy and sustainable environment. Many Indigenous women who are"
143,"__________________"
144,"4 General recommendation No. 37 (2018) on the gender-related dimensions of disaster risk"
145,"reduction in the context of climate change, paras. 1–9.CEDAW/C/GC/39"
146,"22-24375"
147,"4/25"
148,"environmental human rights defenders face killings, harassment, criminalization and"
149,"the ongoing discrediting of their work. States parties have an obligation to ensure that"
150,"State actors and business enterprises take measures without delay to guarantee a clean,"
151,"healthy and sustainable environment and planetary system, including the prevention"
152,"of foreseeable loss and damage, socioeconomic and environmental violence, and all"
153,"forms of violence against Indigenous women who are environmental human rights"
154,"defenders and their communities and territories. States parties also have an obligation"
155,"to address the effects of colonialism, racism, assimilation policies, sexism, poverty,"
156,"armed conflicts, militarization, forced displacement and the loss of territories, sexual"
157,"violence as a tool of war, and other alarming human rights abuses frequently"
158,"perpetrated against Indigenous women and girls and their communities."
159,"II. Objectives and scope"
160,"8. The Committee considers self-identification, according to international"
161,"standards,5 to be a guiding principle in international law in determining the status of"
162,"rights holders as Indigenous women and girls.6 However, the Committee recognizes"
163,"that some Indigenous women and girls may prefer not to disclose their status owing"
164,"to structural and systemic racism and discrimination, as well as colonial and"
165,"colonization policies. The present general recommendation and the rights under the"
166,"Convention are applicable to all Indigenous women and girls, inside and outside their"
167,"territories; in their countries of origin, in transit and in their countries of destination;"
168,"and as migrants, as refugees during their forced or involuntary displacement cycle"
169,"and as stateless persons."
170,"9. Gender-based violence, including psychological, physical, sexual, economic,"
171,"spiritual, political and environmental violence, is adversely affecting the lives of"
172,"many Indigenous women and girls. Indigenous women often suffer violence in the"
173,"home, in the workplace and in public and educational institutions; while receiving"
174,"health services and navigating child welfare systems; as leaders in political and"
175,"community life; as human rights defenders; when deprived of liberty; and when"
176,"confined to institutions. Indigenous women and girls are disproportionately at risk of"
177,"rape and sexual harassment; gender-based killings and femicide; disappearances and"
178,"kidnapping; trafficking in persons; 7 contemporary forms of slavery; exploitation,"
179,"including exploitation of prostitution of women; 8 sexual servitude; forced labour;"
180,"coerced pregnancies; State policies mandating forced contraception and intrauterine"
181,"devices; and domestic work that is not decent, safe or adequately remunerated. 9 The"
182,"Committee highlights, in particular, the gravity of discrimination and gender-based"
183,"violence against Indigenous women and girls with disabilities who are living in"
184,"institutions."
185,"10. The Committee calls upon States parties to promptly engage in data collection"
186,"efforts to fully assess the situation of Indigenous women and girls and the forms of"
187,"discrimination and gender-based violence that they face. States must undertake efforts"
188,"to collect data, disaggregated by a range of factors, including sex; age; Indigenous"
189,"origin, status or identity; and disability status, and collaborate with Indigenous"
190,"women and their organizations, as well as academic institutions and non-profit"
191,"__________________"
192,"5 United Nations Declaration on the Rights of Indigenous Peoples, arts. 9 and 33."
193,"6 Ibid., art. 33.1; see also ILO, Indigenous and Tribal Peoples Convention No. 169, art. 1; United"
194,"Nations Permanent Forum on Indigenous Issues, “Who are Indigenous Peoples?”"
195,", fact sheet; and"
196,"working paper on the concept of Indigenous Peoples (E/CN.4/Sub.2/AC.4/1996/2, paras. 69–70)."
197,"7 General recommendation No. 38 (2020) on trafficking in women and girls in the context of"
198,"global migration, paras. 18–35."
199,"8 Convention on the Elimination of All Forms of Discrimination against Women, art. 6."
200,"9 CEDAW/C/OP.8/CAN/1, paras. 95–99 and 111–127.CEDAW/C/GC/39"
201,"5/25"
202,"22-24375"
203,"organizations, in that regard. The Committee also underscores that Indigenous"
204,"Peoples must have control over data collection processes in their communities and"
205,"over how the data are stored, interpreted, used and shared."
206,"11. One of the root causes of discrimination against Indigenous women and girls is"
207,"the lack of effective implementation of their rights to self-determination and"
208,"autonomy and related guarantees, as manifested, inter alia, in their continued"
209,"dispossession of their lands, territories and natural resources. The Committee"
210,"acknowledges that the vital link between Indigenous women and their lands often"
211,"forms the basis of their culture, identity, spirituality, ancestral knowledge and survival."
212,"Indigenous women face a lack of legal recognition of their rights to land and"
213,"territories and wide gaps in the implementation of existing laws to protect their"
214,"collective rights. Governments and third-party actors frequently carry out activities"
215,"related to investment, infrastructure, development, conservation, climate change"
216,"adaptation and mitigation initiatives, tourism, mining, logging and extraction without"
217,"securing the effective participation and obtaining the consent of the Indigenous"
218,"Peoples affected. The Committee has a broad understanding of the right of Indigenous"
219,"women and girls to self-determination, including their ability to make autonomous,"
220,"free and informed decisions concerning their life plans and health."
221,"12. The Committee acknowledges that Indigenous women and girls have struggled"
222,"and continue to struggle against forced assimilation policies and other large -scale"
223,"human rights violations, which may in certain instances amount to genocide. 10 Some"
224,"of these assimilation policies – in particular the forced placement in residential"
225,"schools and institutions and the displacement of Indigenous Peoples from their"
226,"territories in the name of development – have resulted in killings, disappearances,"
227,"sexual violence and psychological abuse, and may amount to cultural genocide.11 It"
228,"is critical for States parties to address the consequences of historic injustices and to"
229,"provide support and reparations to the affected communities as part of the process of"
230,"ensuring justice, reconciliation and the building of societies free from discrimination"
231,"and gender-based violence against Indigenous women and girls. The Committee"
232,"highlights, in particular, the need for States to act proactively to protect the rights of"
233,"Indigenous women and girls living in urban settings, where they face racism,"
234,"discrimination, assimilation policies and gender-based violence."
235,"III. Legal framework"
236,"13. The rights of Indigenous women and girls derive from the articles of the"
237,"Convention, as further developed in the Committee’s general recommendations, and"
238,"from specific international instruments for the protection of the rights of Indigenous"
239,"Peoples, such as the United Nations Declaration on the Rights of Indigenous Peoples"
240,"and the International Labour Organization (ILO) Convention, 1989 (No. 169)"
241,"concerning Indigenous and Tribal Peoples in Independent Countries. The Committee"
242,"considers the Declaration an authoritative framework for interpreting State party and"
243,"core obligations under the Convention on the Elimination of All Forms of"
244,"Discrimination against Women. All of the rights recognized in the Declaration are"
245,"relevant to Indigenous women, both as members of their peoples and communities"
246,"and as individuals, and, ultimately, in relation to the guarantees against discrimination"
247,"__________________"
248,"10 See United Nations Declaration on the Rights of Indigenous Peoples, art. 8; Convention on the"
249,"Prevention and Punishment of the Crime of Genocide, art. II; and Rome Statute of the"
250,"International Criminal Court, art. 6."
251,"11 See United Nations Declaration on the Rights of Indigenous Peoples, art. 8.CEDAW/C/GC/39"
252,"22-24375"
253,"6/25"
254,"in the Convention itself. In addition, all core international human rights treaties"
255,"contain relevant protections for the rights of Indigenous women and girls. 12"
256,"14. In addressing the rights of Indigenous girls, the Committee also makes reference"
257,"to the Convention on the Rights of the Child and to the Committee on the Rights of"
258,"the Child general comment No. 11 (2009) on indigenous children and their rights."
259,"States parties have an obligation to protect Indigenous girls from all forms of"
260,"discrimination. The creation of an enabling and safe environment for the leadership"
261,"and effective participation of Indigenous girls is paramount to the full enjoyment of"
262,"their rights to territories, culture and a clean, healthy and sustainable environment. 13"
263,"The Committee on the Elimination of Discrimination against Women recognizes,"
264,"moreover, the status of Indigenous girls as developing women, which calls for a State"
265,"response tailored to their best interests and needs and the adaptation of government"
266,"procedures and services to the age, development, evolving capacities, and condition"
267,"of Indigenous girls."
268,"15. The Convention on the Elimination of All Forms of Discrimination against"
269,"Women should also be interpreted in a manner that takes into consideration the 2 030"
270,"Agenda for Sustainable Development, in which States agreed that the achievement of"
271,"gender equality and the empowerment of women and girls is paramount to sustainable"
272,"development and the end of poverty. 14 The Beijing Declaration and Platform for"
273,"Action is also an important reference document in the present general"
274,"recommendation. The Committee also makes reference to the resolutions adopted by"
275,"the Commission on the Status of Women related to Indigenous women.15"
276,"IV. General obligations of States parties in relation to the rights"
277,"of Indigenous women and girls under articles 1 and 2 of"
278,"the Convention"
279,"A. Equality and non-discrimination, with a focus on Indigenous"
280,"women and girls and intersecting forms of discrimination"
281,"16. The prohibition of discrimination in articles 1 and 2 of the Convention applies"
282,"to all rights of Indigenous women and girls under the Convention, including, by"
283,"extension, those set out in the Declaration, which is of fundamental importance to the"
284,"interpretation of the Convention in the current context. The prohibition of"
285,"discrimination is an important pillar and foundational principle of international"
286,"human rights law. Indigenous women and girls have the right to be free from all forms"
287,"of discrimination on the basis of their sex; gender; Indigenous origin, status or identity;"
288,"race; ethnicity; disability; age; language; socioeconomic status; and HIV/AIDS status,"
289,"among other factors.16"
290,"17. Discrimination against Indigenous women and girls and its effects should be"
291,"understood in both their individual and collective dimensions. In its individual"
292,"__________________"
293,"12 See Committee on the Elimination of Racial Discrimination, general recommendation No. 23"
294,"(1997) on the rights of indigenous peoples, paras. 3–6."
295,"13 Committee on the Rights of the Child, general comment No. 12 (2009) on the right of the child"
296,"to be heard, para. 2."
297,"14 General Assembly resolution 70/1, para. 20. See also targets 2.3 and 4.5 of the Sustainable"
298,"Development Goals, as well as Goal 5."
299,"15 See Commission on the Status of Women resolutions 49/7 and 56/4. See also the agreed"
300,"conclusions of the Commission at its sixty-sixth session (E/2022/27, chap. I, sect. A.)."
301,"16 General recommendation No. 28 (2010) on the core obligations of States parties under article 2"
302,"of the Convention, para. 9; and United Nations Declaration on the Rights of Indigenous Peoples,"
303,"para. 2.CEDAW/C/GC/39"
304,"7/25"
305,"22-24375"
306,"dimension, discrimination against Indigenous women and girls takes intersecting"
307,"forms and is carried out by both State and non-State actors, including those in the"
308,"private sphere, on the basis of sex; gender; Indigenous origin, status or identity; race;"
309,"ethnicity; disability; age; language; socioeconomic status; and HIV/AIDS status;"
310,"among other factors. Racism, discriminatory stereotypes, marginalization and gender-"
311,"based violence are interrelated violations experienced by Indigenous women and girls."
312,"Discrimination and gender-based violence threaten the individual autonomy, personal"
313,"liberty and security, privacy and integrity of all Indigenous women and girls and may"
314,"also harm the collective and its well-being. As indicated in general recommendation"
315,"No. 29 (2013) on the economic consequences of marriage, family relations and their"
316,"dissolution, Indigenous women as individuals can suffer discrimination in the name"
317,"of ideology, tradition, culture, religious and customary laws and practices. In addition,"
