"1","United Nations"
2,"International Convention on the Protection of the Rights of All Migrant Workers and Members of Their Families"
3,"Committee on the Protection of the Rights of all Migrant Workers and Members of Their Families"
4,"CMW/C/GC/1"
5,"Distr.: General 23 February 2011"
6,"Original: English"
7,"General comment No. 1 on migrant domestic workers I. Introduction"
8,"1. Domestic work is an important occupation for millions of individuals, accounting for up to 10 per cent of total employment in some countries.1 The trend over the past decades has been a growing prevalence of migrants amongst domestic workers. Women make up the overwhelming majority of these workers."
9,"2. Noting the omission of express references to either domestic work or domestic workers in a broad range of national and international frameworks of law, the Committee on the Protection of the Rights of All Migrant Workers and Members of Their Families (hereinafter referred to as the Committee), at its eleventh session in October 2009, resolved to issue a general comment in order to provide States with guidance on how to implement their obligations under the International Convention on the Protection of the Rights of All Migrant Workers and the Members of Their Families (hereinafter referred to as the Convention) with respect to migrant domestic workers. The Committee organized a Day of General Discussion on this subject on 14 October 2009, which generated strong participation by States, international organizations, non-governmental organizations (NGOs) and trade organizations, civil society and migrants, including a number of written perspectives and studies. This general comment draws upon those contributions as well as the Committee’s experience in reviewing with States parties their reports on the implementation of the Convention."
10,"3. As defined by the Convention, the term “migrant worker” refers to any person who “is to be engaged, is engaged or has been engaged in a remunerated activity in a State of which he or she is not a national”2. Accordingly, the Convention expressly provides"
11,"1  There is no accurate data on the number of domestic workers throughout the world, partly due to the high incidence of undeclared domestic work and the fact that national statistics often do not count domestic workers as a distinct category. However, such data as are available show that domestic work accounts for between 4 and 10 per cent of total employment in developing countries and between 1 and 2.5 per cent in industrialized countries. See International Labour Organization (ILO) (2009), “Decent Work for Domestic Workers”, Report IV(1), International Conference, 99th session, 2010."
12,"2  Convention, art. 2. Article 3 of the Convention excludes from its scope of application a number of categories of workers, including certain employees of international organizations and of States, investors residing outside of their State of origin, whose status are regulated by general international"
13,"GE.11–41182"
14,"CMW/C/GC/1"
15,"2"
16,"3 4 5 6"
17,"protection to migrant workers and their family members not only when the migrants are actually working, but “during the entire migration process of migrant workers and members of their families, which comprises preparation for migration, departure, transit and the entire period of stay and remunerated activity in the State of employment as well as return to the State of origin or the State of habitual residence”3."
18,"4. Depending on their administrative status under national immigration laws, some migrants are considered as documented or in a regular situation, while others are considered as non-documented or in an irregular situation. Just as the Convention delineates rights that apply to all migrant workers regardless of their status4, and then distinguishes further rights of migrants who are documented or in a regular situation5, this general comment shall refer to all migrant domestic workers, unless expressly indicated."
19,"5. The terms “domestic work” or “domestic worker” have not yet been defined in any international instruments. However, drawing on common elements found in definitions set out in national legislation6, the Committee notes that the term “domestic worker” generally refers to a person who performs work within an employment relationship in or for other people’s private homes, whether or not residing in the household."
20,"6. The Committee considers that migrant domestic workers are included in the term ""migrant worker"" as defined in article 2, paragraph 2, of the Convention and that any distinction made to exclude migrant domestic workers from protection would constitute a prima facie violation of the Convention."
21,"7. Whereas many of the human rights issues and concerns identified in this general comment are relevant to all domestic workers, several issues and concerns are specific to the situation of domestic workers who are migrants. Generally, migrant domestic workers are at heightened risk of certain forms of exploitation and abuse. At the heart of their vulnerability is isolation and dependence, which can include the following elements: the isolation of life in a foreign land and often in a foreign language, far away from family; lack of basic support systems and unfamiliarity with the culture and national labour and migration laws; and dependence on the job and employer because of migration-related debt, legal status, practices of employers restricting their freedom to leave the workplace, the simple fact that the migrants’ workplace may also be their only shelter and the reliance of family members back home on remittances sent back from the domestic work. Women migrant domestic workers face additional risks related to their gender, including gender- based violence. These risks and vulnerabilities are further aggravated for migrant domestic workers who are non-documented or in an irregular situation, not least because they often risk deportation if they contact State authorities to seek protection from an abusive employer."
22,"law or specific agreements; students and trainees; and seafarers and workers on offshore installations who have not been admitted to take up residence and engage in a remunerated activity in the States of employment. Moreover, refugees and stateless persons are only included under the Convention if such application is provided in national legislation (art. 3(d))."
23,"Convention, art. 1. Convention, Part III. Convention, Part IV."
24,"See ILO (2009), “Decent Work for Domestic Workers”, report IV(1), International Conference, 99th session 2010; José Maria Ramirez-Machado, Domestic Work, Conditions of Work and Employment: A Legal Perspective, ILO (2003)."
25,"A. Problems faced by migrant domestic workers and members of their families"
26,"8. The vulnerability of migrant domestic workers does not begin and end in the workplace. Migrant domestic workers face risk throughout the migration cycle with a number of factors exposing them to violations of their human rights including those protected under the Convention."
27,"Recruitment, pre-departure and in countries of transit"
28,"9. In many countries, recruitment agencies, labour brokers, and other intermediaries charge exorbitant fees to migrant domestic workers and do not provide accurate information, meaningful preparation for migrants before travel, or written contracts. In particular, migrants are often not provided with information on their rights and on avenues for reporting abuse. Some prospective migrant domestic workers are deceived by illegal recruitment agents and lured into paying for fraudulent visas or other documentation and non-existent jobs."
29,"10. While transiting through foreign countries, women and girls are particularly at risk of being subjected to physical and sexual abuse by agents and intermediaries."
30,"At arrival and during employment"
31,"11. Upon arrival the migrants are often left stranded with high levels of debt from their migration and without legal papers and employment, rendering them vulnerable to abuse and exploitation. Even where contracts had been signed pre-departure, many migrant domestic workers are compelled to sign new contracts upon arrival, nearly always for less pay and often for different work conditions of employment and abode than had been agreed upon or promised and often in a language they do not understand, without legal counselling, and under duress."
32,"12. The withholding of passports by the employer is widespread, reinforcing isolation and dependence and restricting the movement of the migrant worker out of the house as well as out of the country."
33,"13. In the workplace, many are subjected to abusive working conditions, including:"
34,"(a) Partial and in many cases, total, restriction on movement outside the house and on communication with individuals outside the house, including with family members left behind;"
35,"(b) Excessive and often undefined working hours. Especially for migrant live-in domestic workers, there is often an express or implied expectation of total availability, where the worker can be called on to work at any time;"
36,"(c) Insufficient rest and leisure time. Many migrant domestic workers have no agreed leave day at all; others only have one day off per month and frequently any agreed “day off” is cancelled or changed arbitrarily by the employer; when the employer is on holiday, or the worker is ill, a practice of “no work – no pay” is applied. Others experience reprimands or threats of losing their jobs even where there are legitimate reasons for absence such as illness or personal/family emergencies;"
37,"(d) Restrictions on their ability to travel even for essential family matters, such as serious illness or bereavement in the family;"
38,"(e) Low salaries and late payment or non-payment of salaries. As a result of the absence or inapplicability in most countries of minimum wage laws for domestic workers, many migrant domestic workers are paid only a fraction of what other workers in comparable sectors receive, often without any traceable payments into bank accounts, or with salaries paid in kind;"
39,"CMW/C/GC/1"
40,"3"
41,"CMW/C/GC/1"
42,"B."
43,"7"
44,"(f) Lack of social security protection, including sickness and family benefits and building pension rights;"
45,"(g) Psychological, physical and sexual abuse and harassment from their employers as well as from recruitment agents or intermediaries; and"
46,"(h) Inadequate, unsanitary and degrading living accommodations."
47,"14. The risk of abuse is heightened for child domestic workers, who make up a significant proportion of domestic workers. Their young age, isolation and separation from their families and peers, and near-total dependence on their employers exacerbate their vulnerability to violations of their rights under the Convention, including the basic right of access to education."
48,"Families left behind"
49,"15. The prolonged absence of migrant domestic workers negatively affects the family unity, and the social and psychological wellbeing of members of their families and also often results in violations of the rights of their children who have remained in the country of origin."
50,"Upon return"
51,"16. Migrant domestic workers may encounter difficulties in reintegrating into the labour market and society in their countries of origin upon their return. They may also encounter difficulties related to the portability of pension and social security benefits."
52,"17. Many migrants are unable to seek remedies for violations of their rights by employers because they are not entitled to stay in the country of employment once the employment relation has been terminated. As a result migrant domestic workers may for example return to the country of origin with less pay than they are due and with no possibility of seeking compensation and remedies. Those who return to their countries of origin in order to escape an abusive work relationship often have no access to support mechanisms and no possibility of seeking legal remedies."
53,"Gaps in protection"
54,"Protection gaps: “legal”"
55,"18. A wide body of international treaties articulate human rights, including labour rights, basic to all human beings, including all workers.7 In line with other human rights treaties, the protection against abusive and exploitative labour conditions afforded under the Convention extends to all migrant workers, irrespective of their migration status. In this regard, the Committee notes with concern that, at national level, major categories of law"
56,"The core international human rights treaties all contain standards and safeguards which are of relevance to the protection of migrant domestic workers. Several of the other human rights treaty- monitoring bodies have paid specific attention to the situation of migrants and migrant workers, including migrant domestic workers. See, in particular, Committee on the Elimination of Discrimination against Women, general recommendation No. 26 (2008) on women migrant workers; Committee on Economic and Social Rights, general comment No. 18 (2005) on the right to work; Committee on the Rights of the Child, general comment No. 6 (2005) on treatment of unaccompanied and separated children outside their country of origin; Committee on the Elimination of Racial Discrimination, general recommendation No. 30 (2004) on discrimination against non citizens; Human Rights Committee, general comment No. 15 (1986) on the position of aliens under the Covenant."
57,"4"
58,"often ignore, or explicitly exclude domestic work and workers in ways that contribute to exploitative labour practices and limit avenues for legal redress in cases of violations."
59,"19. Labour law. In many countries, domestic workers are not legally recognized as “workers” entitled to labour protection. A number of premises and special definitions are used to exclude domestic workers from the protection of labour laws, including the consideration that they work for private persons, who are not considered to be “employers”. Equally, traditional perceptions of domestic work as tasks associated with unpaid work in the home performed by women and girls as well as traditional perceptions of domestic workers as either being “family helpers” often militate against the extension of national labour law to effectively cover domestic work. Because of their de facto and/or de jure, “unrecognized” status as “workers”, domestic workers are unable to exercise the rights and freedoms granted by labour law to other workers."
60,"20. Some national labour laws include protections for domestic work and workers, but exclude migrant domestic workers from some or all of these protections. For example, migrant domestic workers are often restricted in their ability to organize for their labour rights. In other cases where labour or other standards and protections apply both to domestic work and to migrant domestic workers, laws can bar monitoring and labour inspections in home settings."
61,"21. Immigration law. Laws regulating the conditions of entry and stay in countries of employment are often a source of specific vulnerabilities for migrant domestic workers. Overly restrictive immigration laws may lead to higher numbers of migrant domestic workers who are non-documented or in an irregular situation, and thus particularly vulnerable to human rights violations. Even for workers with a documented or regular migration status, similar vulnerabilities arise where immigration laws tie their status to the continued sponsorship of specific employers. Consequently, migrant domestic workers may risk deportation if they try to escape an abusive employment relationship or seek legal remedies against their employers."
62,"22. Under some countries’ laws regarding work permit and security bond conditions, women migrants, including domestic workers, who get pregnant or who are found to be HIV positive lose their permit. It is not uncommon for women migrant workers to be subjected to mandatory health testing related to sexual and reproductive health without consent or counselling."
63,"23. Contract law. National laws and regulations pertaining to contracts are often inapplicable to domestic work and/or domestic workers, either categorically or as a practical matter because domestic work is performed in the informal labour market."
64,"24. Social security laws. Domestic workers, especially those who are migrants, are often excluded from rights under national law related to social security. The lack of social security benefits and of gender-sensitive health care coverage further increases the vulnerability of migrant domestic workers and their dependence on their employers."
65,"Protection gap: practical"
66,"25. Even if certain protections for migrant domestic workers are provided under national laws, there is often a gap between protections enjoyed by such workers in law and in practice. Some of the practical obstacles faced relate to the “hidden” nature of domestic work and factors preventing or deterring migrant domestic workers from claiming their rights."
67,"26. A range of factors constitutive of domestic work itself, and even more so, of domestic work performed by migrants, hides abuses from view, and makes detection of protection needs difficult."
68,"CMW/C/GC/1"
69,"5"
70,"CMW/C/GC/1"
71,"6"
72,"(a)  Workplaces are unseen, behind closed doors and out of the public eye;"
73,"(b)  Domestic work is commonly part of the informal labour market, where work"
74,"and workers are unregistered;"
75,"(c) The physical and social isolation of workers blocks individual and collective action;"
76,"(d) The large number of workplaces, their geographical spread and national privacy laws complicates effective inspections and monitoring by labour departments."
77,"27. A number of factors make it difficult for migrant domestic workers to claim their rights and seek redress in case of violations, including the fact that:"
78,"(a) Specific mechanisms available to receive and address complaints from domestic workers are often not available;"
79,"(b) Migrant domestic workers often do not know to whom to address their labour problems or may be reluctant to contact the police or labour authorities out of fear of deportation. Language barriers and the costs of administrative and legal processes may be additional deterrents."
80,"(c) Migrant domestic workers who depend on their employers for their immigration status may not report abuse for fear of arrest, detention or deportation. In some countries, if the victim brings a formal complaint against the employer, he or she can neither seek alternative employment while the case is in court, nor leave the country for the duration of the case. These restrictions, and the long periods it may take for cases to be resolved, often lead to domestic workers choosing not to report complaints or withdrawing their cases in order to return home more quickly."
81,"C. Recommendations to States parties Pre-departure awareness-raising and training"
82,"28. For nationals considering whether to migrate for domestic work, States parties should take appropriate measures to disseminate information on their rights under the Convention as well as the conditions of their admission and employment and their rights and obligations under the law and practice of other States (article 33). Such awareness- raising could include:"
83,"(a)  Information on different types and arrangements of domestic work;"
84,"(b)  Basic knowledge of applicable national and transnational legal frameworks;"
85,"(c)  Essential information and perspectives on:"
86,"(i)  Migration-related fees and debt;"
87,"(ii)  Family aspects and effects on family life, such as separation, right to family"
88,"visits or return, pregnancy during employment, etc.; and"
89,"(iii) Other risks of domestic work outside the country of origin."
90,"29. For workers who have made the decision to migrate for domestic work, States parties are encouraged to develop more specific pre-departure training and awareness- raising programmes. Such training may be developed in consultation with relevant non- governmental organizations, migrant domestic workers and their families, and recognized and reliable recruitment agencies, and could cover:"
91,"(a) A comprehensive “know your rights” curriculum, covering both international and national frameworks, using the Convention as a reference;"
92,"(b) “Know your obligations” orientation to essential aspects of the law and culture of the country of employment;"
93,"(c) “Awareness-raising” training, including issues of migration, working conditions, social security, debt, finance and work-related fees and basic knowledge on methods of conflict resolution, and avenues for redress;"
94,"(d)  Financial literacy, including information on remittances and saving schemes;"
95,"(e)  Contact information for emergency assistance, including embassies and"
96,"consulates and relevant civil society organizations in countries of employment; and"
97,"(f) Other information needed on logistics, safety, health, human rights issues and points of assistance during the entire migratory process."
98,"30. Where appropriate, States parties could also support pre-departure training offering:"
99,"(a)  Basic language preparation;"
100,"(b)  Training for specific types of work, including key job skills where"
101,"appropriate; and"
102,"(c) Cross-cultural destination-specific orientation."
103,"Cooperation among States"
104,"31. States of origin, States of transit and States of employment share the responsibility for regulating and monitoring recruitment and placement processes."
105,"32. In line with articles 64 and 65, States of origin and employment are encouraged to cooperate on:"
106,"(a) Protection-sensitive and transparent frameworks and agreements, including bilateral, multilateral and regional agreements between States;"
107,"(b) The use of standard, unified and binding employment contracts, with fair, full and clear conditions and labour standards that are enforceable – and enforced – by systems of law in countries both of origin and employment. Such standard contracts, as well as services where migrant domestic workers can receive counselling and guidance or submit complaints, could also usefully be included in bilateral and multilateral agreements between countries of origin and employment;"
108,"(c) Regular and public reporting of migrant domestic worker flows, employment, rights issues, training and other programmes, and issues of justice administration."
109,"Recruitment agencies"
110,"33. In accordance with article 66, States parties have an obligation to effectively regulate and monitor labour brokers, recruitment agencies and other intermediaries to ensure that they respect the rights of domestic workers."
111,"34. Agencies engaged in the movement of migrant domestic workers, whether in countries of origin, transit or employment, must be subject to authorization, approval and supervision by public authorities. This may take the form of formal, regular, transparent and State-regulated:"
112,"(a) Licensing, possibly involving processes of accreditation and periodic renewal;"
113,"(b)  Monitoring, inspection and evaluation;"
114,"(c)  Sanctions and penalties;"
115,"CMW/C/GC/1"
116,"7"
117,"CMW/C/GC/1"
118,"8"
119,"8"
120,"(d) Systems of recording and reporting, including web-based formats that are widely and easily accessible to the public, with particular attention to instances of complaints and conflicts involving workers."
121,"35. States parties should establish specific criteria relating to migrant domestic workers’ rights and ensure that only those agencies observing these criteria and codes can continue to operate. Such criteria could usefully be established in consultations with migrant workers’ organizations themselves, non-governmental organizations working with migrant workers and with workers’ and employers’ organizations."
122,"36. Additionally, States parties are encouraged to adopt codes of conduct on the recruitment of migrant domestic workers, including specific rules governing fees and salary deductions, and to provide for appropriate penalties and sanctions to enforce them. States parties should ban recruitment fees charged to domestic workers, including through salary deductions."
123,"Conditions of work"
124,"37. The rights of migrant domestic workers should be dealt with within the larger framework of decent work for domestic workers. In this regard, the Committee considers that domestic work should be properly regulated by national legislation to ensure that domestic workers enjoy the same level of protection as other workers.8"
125,"38. Accordingly, labour protections in national law should be extended to domestic workers to ensure equal protection under the law, including provisions related to minimum wages, hours of work, days of rest, freedom of association, social security protection, including with respect to maternity, pension rights and health insurance, as well as additional provisions specific to the circumstances of domestic work. In this regard, migrant domestic workers should enjoy treatment not less favourable than that which applies to nationals of the State of employment (article 25)."
