643,"component of the administration of justice in both non-Indigenous and"
644,"Indigenous systems, including consideration for spiritual and collective harm."
645,"V. Obligations of States parties in relation to specific"
646,"dimensions of the rights of Indigenous women and girls"
647,"A. Prevention of and protection from gender-based violence against"
648,"Indigenous women and girls (arts. 3, 5, 6, 10 (c), 11, 12, 14 and 16)"
649,"34. Gender-based violence against Indigenous women and girls is a form of"
650,"discrimination under article 1 of the Convention and, therefore, engages all"
651,"obligations under the Convention. Under article 2 of the Convention, States parties"
652,"must adopt measures without delay to prevent and eliminate all forms of gender-based"
653,"violence against Indigenous women and girls."
654,"35 Similarly, article 22 of the Declaration"
655,"requires States to pay particular attention to the full protection of the rights of"
656,"Indigenous women and to ensure their right to live free from violence and"
657,"discrimination. The prohibition of gender-based violence against women is a principle"
658,"of customary international law and applies to Indigenous women and girls.36"
659,"35. Gender-based violence disproportionately affects Indigenous women and girls."
660,"Available statistics indicate that Indigenous women are more likely to experience rape"
661,"than non-Indigenous women.37 It is estimated that one in three Indigenous women is"
662,"raped during her lifetime. 38 While there is a growing body of evidence of the"
663,"magnitude, nature and consequences of gender-based violence globally, knowledge"
664,"of its incidence against Indigenous women is limited and tends to vary considerably"
665,"by issue and region.39 The Committee highlights the need for States to engage in data"
666,"collection efforts, in collaboration with Indigenous organizations and communities,"
667,"__________________"
668,"35 General recommendation No. 35 (2017) on gender-based violence against women, updating"
669,"general recommendation No. 19, para. 21."
670,"36 Ibid., para. 2."
671,"37 A/HRC/30/41, para. 47."
672,"38 Ibid."
673,"39 UN-Women and others, Breaking the Silence on Violence against Indigenous Girls, Adolescents"
674,"and Young Women (New York, 2013), p. 4. See also Inter-Agency Support Group on Indigenous"
675,"Peoples’ Issues, “Elimination and responses to violence, exploitation and abuse of indigenous"
676,"girls, adolescents and young women”"
677,", thematic paper towards the preparation on of the World"
678,"Conference on Indigenous Peoples, pp. 1–2 and 4–10.CEDAW/C/GC/39"
679,"22-24375"
680,"14/25"
681,"to understand the scope of the problem of gender-based violence against Indigenous"
682,"women and girls. It also highlights the need for discrimination, stereotypes and social"
683,"legitimization of gender-based violence against them to be addressed by States."
684,"36. The Committee is alarmed at the many forms of gender-based violence"
685,"committed against Indigenous women and girls, 40 which occurs in all spaces and"
686,"spheres of human interaction, including the family,41 community, public spaces, the"
687,"workplace, educational settings and the digital space.42 Violence can be psychological,"
688,"physical, sexual, economic, political or a form of torture. Spiritual violence is"
689,"frequently perpetrated against Indigenous women and girls, harming the collective"
690,"identity of their communities and their connection to their spiritual life, culture,"
691,"territories, environment and natural resources. Violence against Indigenous women"
692,"and girls with disabilities and older Indigenous women often occurs in institutions, in"
693,"particular those that are closed and segregated. Indigenous women and girls are"
694,"frequently victims of rape, harassment, disappearances, killings and femicide."
695,"37. Forced displacement is a major form of violence that affects Indigenous women"
696,"and girls, severing their connection to their lands, territories and natural resources"
697,"and permanently harming their life plans and communities. They are also adversely"
698,"affected by environmental violence, which can take the form of environmental harm,"
699,"degradation, pollution or State failures to prevent foreseeable harm connected to"
700,"climate change. Other forms of violence affecting them include the exploitation of"
701,"prostitution; contemporary forms of slavery, such as domestic servitude; forced"
702,"surrogacy; the targeting of older unmarried women as witches or carriers of bad spirits;"
703,"the stigmatization of married women who cannot bear children; and female genital"
704,"mutilation. The Committee underscores, in particular, the problem of trafficking in"
705,"persons affecting Indigenous women and girls, resulting from the militarization of"
706,"Indigenous territories by national armies, organized crime, mining and logging"
707,"operations and drug cartels, as well as the expansion of military bases on Indigenous"
708,"lands and territories."
709,"38. Gender-based violence against Indigenous women and girls is drastically"
710,"underreported, and perpetrators regularly enjoy impunity, owing to Indigenous"
711,"women’s and girls’ extremely limited access to justice, as well as biased or flawed"
712,"criminal justice systems 43 Racism, marginalization, poverty, and alcohol and"
713,"substance abuse increase the risk of gender-based violence against them.44 They suffer"
714,"gender-based violence perpetrated or tolerated by both State and non-State actors."
715,"State actors include members of governments, armed forces, law enforcement"
716,"authorities and public institutions, including in the health and education sectors and"
717,"in prisons. 45 Non-State actors include private individuals, businesses, private"
718,"companies, paramilitary and rebel groups, illegal actors, and religious institutions. 46"
719,"39. States parties have a due diligence obligation to prevent, investigate and punish"
720,"perpetrators and to provide reparations to Indigenous women and girls who are"
721,"victims of gender-based violence. This obligation is applicable to both"
722,"non-Indigenous and Indigenous justice systems. 47 Due diligence should be"
723,"implemented with gender, intersectional, Indigenous women, intercultural and"
724,"__________________"
725,"40 A/HRC/50/26, paras. 7–10 and 24–34."
726,"41 A/HRC/30/41, paras. 113–117."
727,"42 General recommendation No. 35, para. 20."
728,"43 CEDAW/C/OP.8/CAN/1, paras. 132–172."
729,"44 Inter-American Commission on Human Rights, Indigenous Women and their Rights in the"
730,"Americas, paras. 85 and 86."
731,"45 UN-Women and others, Breaking the Silence, pp. 13–16, 19 and 20."
732,"46 Ibid."
733,"47 Inter-American Commission on Human Rights, Indigenous Women, para. 230. See also general"
734,"recommendation No. 33, para. 64.CEDAW/C/GC/39"
735,"15/25"
736,"22-24375"
737,"multidisciplinary perspectives, as defined in paragraphs 4 and 5, and bearing in mind"
738,"the gendered causes and impacts of the violence experienced by Indigenous women."
739,"40. Gender-based violence against Indigenous women and girls undermines the"
740,"collective spiritual, cultural and social fabric of Indigenous Peoples and their"
741,"communities and causes collective and sometimes intergenerational harm. Sexual"
742,"violence against Indigenous women and girls has been used by a plurality of actors"
743,"during armed conflicts and times of unrest as a weapon of war and as a strategy to"
744,"control and harm Indigenous communities."
745,"41. States should have an effective legal framework and adequate support services"
746,"in place to address such gender-based violence. Such frameworks must include"
747,"measures to prevent, investigate, punish perpetrators, and provide assistance and"
748,"reparations to Indigenous women and girls who are victims, as well as services to"
749,"address and mitigate the harmful effects of gender-based violence. This general"
750,"obligation extends to all areas of State action, including legislative, executive and"
751,"judicial branches, at the regional, national and local levels, as well as privatized"
752,"services. It requires the formulation of legal norms, including at the constitutional"
753,"level, and the design of public policies, programmes, institutional frameworks and"
754,"monitoring mechanisms aimed at eliminating all forms of gender-based violence"
755,"against Indigenous women and girls, whether committed by State or non-State"
756,"actors.48"
757,"42. The Committee recommends that States parties:"
758,"(a) Adopt and effectively implement legislation that prevents, prohibits"
759,"and responds to gender-based violence against Indigenous women and girls,"
760,"incorporating gender, intersectional, Indigenous women and girls, intercultural,"
761,"and multidisciplinary perspectives, as defined in paragraphs 4 and 5. Legislation"
762,"and its implementation should also adequately consider the life cycle of all"
763,"Indigenous women and girls, including those with disabilities;"
764,"(b) Recognize, prevent, address, sanction and eradicate all forms of"
765,"gender-based violence against Indigenous women and girls, including"
766,"environmental, spiritual, political, structural, institutional and cultural violence,"
767,"as well as violence attributable to extractive industries;"
768,"(c) Ensure that Indigenous women and girls have timely and effective"
769,"access to both non-Indigenous and Indigenous justice systems, including"
770,"protection orders and prevention mechanisms, when needed, and the effective"
771,"investigation of cases of missing and murdered Indigenous women and girls, free"
772,"from all forms of discrimination and bias;"
773,"(d) Repeal all laws that prevent or deter Indigenous women and girls from"
774,"reporting gender-based violence, such as guardianship laws that deprive women"
775,"of legal capacity or restrict the ability of women with disabilities to testify in"
776,"court; the practice of so-called “protective custody”; restrictive immigration"
777,"laws that discourage women, including migrant and non-migrant domestic"
778,"workers, from reporting such violence; and laws allowing for dual arrests in"
779,"cases of domestic violence or for the prosecution of women when the perpetrator"
780,"is acquitted;49"
781,"(e) Ensure that support services, including medical treatment,"
782,"psychosocial counselling and professional training, and reintegration services"
783,"and shelters are available, accessible and culturally appropriate for Indigenous"
784,"women and girls who are victims of gender-based violence. All services should be"
785,"__________________"
786,"48 General recommendation No. 35, para. 24 (b)."
787,"49 Ibid., para. 29 (c) (iii).CEDAW/C/GC/39"
788,"22-24375"
789,"16/25"
790,"designed with intercultural and multidisciplinary perspectives, as defined in"
791,"paragraph 5, and be vested with sufficient financial resources;"
792,"(f) Provide resources for Indigenous women and girl survivors of gender-"
793,"based violence to have access to the legal system to report cases of such violence."
794,"Resources can include transportation, legal aid and representation, and access"
795,"to information in Indigenous languages;"
796,"(g) States should act with due diligence to prevent all forms of violence,"
797,"inhumane treatment and torture against Indigenous women and girls who are"
798,"deprived of liberty. States must ensure that when these acts do occur, they are"
799,"appropriately investigated and sanctioned. States should also adopt measures to"
800,"ensure that Indigenous women and girls who are deprived of liberty know where"
801,"and how to report these acts. States should further prioritize policies and"
802,"programmes to promote the social reintegration of Indigenous women and girls"
803,"who have been deprived of liberty, with respect for their culture, views and"
804,"languages;"
805,"(h) States must adhere to their obligations under international human"
806,"rights law and international humanitarian law in situations of armed conflict,"
807,"including the prohibition of all forms of discrimination and gender-based"
808,"violence against civilians and enemy combatants, as well as of harm to land,"
809,"natural resources and the environment;"
810,"(i) Systematically collect disaggregated data and undertake studies, in"
811,"collaboration with Indigenous communities and organizations, to assess the"
812,"magnitude, gravity and root causes of gender-based violence against Indigenous"
813,"women and girls, in particular sexual violence and exploitation, to inform"
814,"measures to prevent and respond to such violence."
815,"B. Right to effective participation in political and public life (arts. 7,"
816,"8 and 14)"
817,"43. Indigenous women and girls tend to be excluded from decision-making in local,"
818,"national and international processes, as well as in their own communities and"
819,"Indigenous systems."
820,"50 Under article 7 of the Convention, they have the right to effective"
821,"participation at all levels in political, public and community life. This right includes"
822,"participation in decision-making within their communities, as well as with ancestral"
823,"and other authorities; consent and consultation processes over economic activities"
824,"carried out by State and private actors in Indigenous territories; public service and"
825,"decision-making positions at the local, national regional and international levels; and"
826,"their work as human rights defenders.51"
827,"44. Indigenous women and girls face multiple and intersecting barriers to effective,"
828,"meaningful and real participation. Such barriers include political violence; lack of or"
829,"unequal educational opportunities; illiteracy; racism; sexism; discrimination based on"
830,"class and economic status; language constraints; the need to travel long distances to"
831,"gain access to any form of participation; the denial of access to health-care services,"
832,"including sexual and reproductive health care and rights; and the lack of access to,"
833,"economic support for and information on legal, political, institutional, community"
834,"and civil society processes to vote, run for political office, organize campaigns and"
835,"secure funding. The barriers to participation can be particularly high in armed conflict"
836,"contexts, including in transitional justice processes, in which Indigenous women and"
837,"__________________"
838,"50 A/HRC/30/41, paras. 38 and 39."
839,"51 See United Nations High Commissioner for Human Rights, guidelines for States on the effective"
840,"implementation of the right to participate in public affairs, pp. 10–19.CEDAW/C/GC/39"
841,"17/25"
842,"22-24375"
843,"girls and their organizations are often excluded from peace negotiations or attacked"
844,"and threatened when they do try to participate. States parties should act promptly to"
845,"ensure that all Indigenous women and girls have access to computers, the Internet and"
846,"other forms of technology to facilitate their full inclusion in the digital world."
847,"45. The Committee acknowledges the threats faced by Indigenous women human"
848,"rights defenders, whose work is protected by the right to participate in political and"
849,"public life. At particular risk are Indigenous women and girls who are environmental"
850,"human rights defenders in the course of advancing their land and territorial rights,"
851,"and those opposing the implementation of development projects without the free,"
852,"prior and informed consent of the Indigenous Peoples concerned. In many cases,"
853,"Indigenous women and girl human rights defenders face killings; threats and"
854,"harassment; arbitrary detentions; forms of torture; and the criminalization,"
855,"stigmatization and discrediting of their work. Many Indigenous women and girls’"
856,"organizations face obstacles to their recognition as legal entities at the national level,"
857,"the lack of which challenges their access to funding and their ability to work freely"
858,"and independently. The Committee considers that States parties should adopt"
859,"immediate gender-responsive measures to publicly recognize, support and protect the"
860,"life, liberty, security and self-determination of Indigenous women and girl human"
861,"rights defenders, and to ensure safe conditions and an enabling environment for their"
862,"advocacy work, free from discrimination, racism, killings, harassment and violence."
863,"46. The Committee recommends that States parties:"
864,"(a) In accordance with the general recommendations No. 23 (1997) on"
865,"women in political and public life and No. 25 (2004) on temporary special"
866,"measures, and articles 18, 19, 32.1 and 44 of the Declaration, promote the"
867,"meaningful, real and informed participation of Indigenous women and girls in"
868,"political and public life and at all levels, including in decision-making positions,"
869,"which may include temporary special measures, such as quotas, targets,"
870,"incentives and efforts to ensure parity in representation;52"
871,"(b) Establish accountability mechanisms to prevent political parties and"
872,"trade unions from discriminating against Indigenous women and girls, and"
873,"ensure that they have effective access to gender-responsive judicial remedies to"
874,"report such violations when they occur. It is also critical to train public servants"
875,"on the right of Indigenous women and girls to effectively participate in public"
876,"life;"
877,"(c) Disseminate accessible information among Indigenous women and"
878,"girls, as well as in society in general, on opportunities to exercise their right to"
879,"vote, participate in public life and stand for election, and promote their"
880,"recruitment into public service, including at the decision-making level. Measures"
881,"to facilitate accessibility for women and girls with disabilities can include the use"
882,"of sign language, easy read and Braille;"
883,"(d) Act with due diligence to prevent, investigate and punish all forms of"
884,"political violence against Indigenous women politicians, candidates, human"
885,"rights defenders and activists at the national, local and community levels, and"
886,"recognize and respect ancestral forms of organization and the election of"
887,"representatives;"
888,"(e) Create, promote and ensure the access of Indigenous women to"
889,"political office through campaign financing; skills training; incentives;"
890,"awareness-raising activities for political parties to nominate them as candidates;"
891,"and adequate health-care and childcare facilities, as well as support services for"
892,"__________________"
893,"52 General recommendation No. 34, para. 54.CEDAW/C/GC/39"
894,"22-24375"
895,"18/25"
896,"caring for older persons, adopt the necessary legislative measures and reforms"
897,"to ensure the right of political participation of Indigenous women and girls, and"
898,"create incentives and monitoring mechanisms, as well as penalties for failure by"
899,"political parties to implement temporary special measures to increase the"
900,"political participation of Indigenous women and girls;"
901,"(f) Ensure that economic activities, including those related to logging,"
902,"development, investment, tourism, extraction, mining, climate mitigation and"
903,"adaptation programmes, and conservation projects are only implemented in"
904,"Indigenous territories and protected areas with the effective participation of"
905,"Indigenous women, including full respect for their right to free, prior and"
906,"informed consent and the adequate consultation processes. It is key that these"
907,"economic activities do not adversely impact human rights, including those of"
908,"Indigenous women and girls;53"
909,"(g) In line with general recommendation No. 30 (2013) on women in"
910,"conflict prevention, conflict and post-conflict situations and Security Council"
911,"resolution 1325 (2000) and subsequent resolutions, ensure and create spaces for"
912,"Indigenous women and girls to participate as decision makers and actors in"
913,"peacebuilding efforts and transitional justice processes;"
914,"(h) Take proactive and effective steps to recognize, support and protect the"
915,"life, integrity and work of Indigenous women human rights defenders, and ensure"
916,"that they conduct their activities in safe, enabling and inclusive environments. State"
917,"measures should include the creation of specialized government mechanisms to"
918,"protect women human rights defenders with their genuine and meaningful"
919,"participation and in collaboration with Indigenous Peoples."
920,"C. Right to education (arts. 5 and 10)"
921,"47. Indigenous women and girls face multiple barriers to enrolment, retention, and"
922,"completion at all levels of education and in non-traditional fields.54 Some of the most"
923,"important educational barriers for them include: the lack of education facilities"
924,"designed, established or controlled by Indigenous Peoples; poverty; discriminatory"
925,"gender stereotypes and marginalization;55 limited cultural relevance of educational"
926,"curricula; instruction solely in the dominant language; and the scarcity of sexuality"
927,"education. Indigenous women and girls frequently must travel long distances to"
928,"schools and are at risk of gender-based violence en route and upon arrival. While at"
929,"school, they may experience sexual violence, corporal punishment or bullying."
930,"Gender-based violence and discrimination in education is particularly acute when"
931,"forced assimilation policies are implemented in schools. Indigenous girls with"
932,"disabilities face particular barriers to access and retention, including lack of physical"
933,"accessibility; school officials’ refusal to enrol them; and reliance on segregated"
934,"schools for children with disabilities. Forced and/or child marriages, sexual violence"
935,"and adolescent pregnancies, the disproportionate burden of family responsibilities,"
936,"child work, natural disasters and armed conflicts can also hamper Indigenous girls ’"
937,"access to school."
938,"__________________"
939,"53 Ibid."
940,"54 General recommendation No. 36 (2017) on the right of girls and women to education, para. 41;"
941,"and general recommendation No. 34, para. 42."
942,"55 Ibid.CEDAW/C/GC/39"
943,"19/25"
944,"22-24375"
945,"48. The Committee recommends that States parties:"
946,"(a) Ensure that Indigenous women and girls fully enjoy the right to"
947,"education by:"
948,"(i) Guaranteeing their equal access to quality education at all levels of"
949,"education, including by supporting Indigenous Peoples to realize the rights"
950,"guaranteed in articles 14 and 15 of the Declaration;"
951,"(ii) Addressing discriminatory stereotypes related to Indigenous origin,"
952,"history, culture and the experiences of Indigenous women and girls;"
953,"(iii) Creating scholarship and financial aid programmes to promote"
954,"Indigenous women’s and girls’ enrolment, including in non-traditional"
955,"fields such as science, technology, engineering and mathematics and"
956,"information and communication technology (ICT), and recognize and"
957,"protect Indigenous knowledge and the contributions of Indigenous Peoples,"
958,"including women, to science and technology;"
959,"(iv) Creating interdisciplinary support systems for Indigenous women and"
960,"girls to reduce their unequal share of unpaid care work and combat child"
961,"marriage and to assist victims in reporting acts of gender-based violence"
962,"and labour exploitation. Social support systems should be operationally"
963,"effective, accessible and culturally responsive;"
964,"(b) Ensure quality education that is inclusive, accessible and affordable"
965,"for all Indigenous women and girls, including those with disabilities. States"
966,"should remove barriers and provide adequate resources and facilities to ensure"
967,"that Indigenous women and girls with disabilities have access to an education."
968,"States should guarantee the availability of age-appropriate sexual education"
969,"based on scientific research;56"
970,"(c) Promote the adoption of curricula that reflect Indigenous education,"
971,"languages, cultures, history, knowledge systems and epistemologies."
972,"57 These efforts"
973,"should extend to all schools, including those in the mainstream. The adoption of"
974,"curricula should be done with the participation of Indigenous women and girls."
975,"D. Right to work (arts. 11 and 14)"
976,"49. Indigenous women have limited access to decent, safe and adequately"
977,"remunerated employment, which undermines their economic autonomy. They"
978,"contribute significantly to the agricultural sector but are overrepresented in"
979,"subsistence agriculture; low-skilled, part-time, seasonal, low-paid or unpaid jobs; and"
980,"home-based activities. A significant number of Indigenous women and girls also"
981,"engage in domestic work with low remuneration and unsafe working conditions. Their"
982,"overrepresentation in informal employment translates into weak income, benefits and"
983,"social protection. They also face discriminatory gender stereotypes and racial"
984,"prejudice in the workplace, including frequent prohibition from wearing their attire"
