"1","Human Rights Committee"
2,"102nd session"
3,"Geneva, 11-29 July 2011"
4,"General comment No. 34"
5,"Article 19: Freedoms of opinion and expression"
6,"General remarks"
7,"1. This general comment replaces general comment No. 10 (nineteenth session)."
8,"2. Freedom of opinion and freedom of expression are indispensable conditions for the full development of the person. They are essential for any society.1 They constitute the foundation stone for every free and democratic society. The two freedoms are closely related, with freedom of expression providing the vehicle for the exchange and development of opinions."
9,"3. Freedom of expression is a necessary condition for the realization of the principles of transparency and accountability that are, in turn, essential for the promotion and protection of human rights."
10,"4. Among the other articles that contain guarantees for freedom of opinion and/or expression, are articles 18, 17, 25 and 27. The freedoms of opinion and expression form a basis for the full enjoyment of a wide range of other human rights. For instance, freedom of expression is integral to the enjoyment of the rights to freedom of assembly and association, and the exercise of the right to vote."
11,"5. Taking account of the specific terms of article 19, paragraph 1, as well as the relationship of opinion and thought (article 18), a reservation to paragraph 1 would be incompatible with the object and purpose of the Covenant.2 Furthermore, although freedom of opinion is not listed among those rights that may not be derogated from pursuant to the provisions of article 4 of the Covenant, it is recalled that, “in those provisions of the Covenant that are not listed in article 4, paragraph 2, there are elements that in theCommittee’s opinion cannot be made subject to lawful derogation under article 4”.3 Freedom of opinion is one such element, since it can never become necessary to derogate from it during a state of emergency.4"
12,"6. Taking account of the relationship of freedom of expression to the other rights in the Covenant, while reservations to particular elements of article 19, paragraph 2, may be acceptable, a general reservation to the rights set out in paragraph 2 would be incompatible with the object and purpose of the Covenant.5"
13,"7. The obligation to respect freedoms of opinion and expression is binding on every State party as a whole. All branches of the State (executive, legislative and judicial) and other public or governmental authorities, at whatever level – national, regional or local – are in a position to engage the responsibility of the State party.6 Such responsibility may also be incurred by a State party under some circumstances in respect of acts of semi-State entities.7 The obligation also requires States parties to ensure that persons are protected from any acts by private persons or entities that would impair the enjoyment of the freedoms of opinion and expression to the extent that these Covenant rights are amenable to application between private persons or entities.8"
14,"8. States parties are required to ensure that the rights contained in article 19 of the Covenant are given effect to in the domestic law of the State, in a manner consistent with the guidance provided by the Committee in its general comment No. 31 on the nature of the general legal obligation imposed on States parties to the Covenant. It is recalled that States parties should provide the Committee, in accordance with reports submitted pursuant to article 40, with the relevant domestic legal rules, administrative practices and judicial decisions, as well as relevant policy level and other sectorial practices relating to the rights protected by article 19, taking into account the issues discussed in the present general comment. They should also include information on remedies available if those rights are violated."
15,"Freedom of opinion"
16,"9. Paragraph 1 of article 19 requires protection of the right to hold opinions without interference. This is a right to which the Covenant permits no exception or restriction. Freedom of opinion extends to the right to change an opinion whenever and for whatever reason a person so freely chooses. No person may be subject to the impairment of any rights under the Covenant on the basis of his or her actual, perceived or supposed opinions. All forms of opinion are protected, including opinions of a political, scientific, historic, moral or religious nature. It is incompatible with paragraph 1 to criminalize the holding of an opinion.9 The harassment, intimidation or stigmatization of a person, including arrest,detention, trial or imprisonment for reasons of the opinions they may hold, constitutes a violation of article 19, paragraph 1.10"
17,"10. Any form of effort to coerce the holding or not holding of any opinion is prohibited.11 Freedom to express one’s opinion necessarily includes freedom not to express one’s opinion."
18,"Freedom of expression"
19,"11. Paragraph 2 requires States parties to guarantee the right to freedom of expression, including the right to seek, receive and impart information and ideas of all kinds regardless of frontiers. This right includes the expression and receipt of communications of every form of idea and opinion capable of transmission to others, subject to the provisions in article 19, paragraph 3, and article 20.12 It includes political discourse,13 commentary on one’s own14 and on public affairs,15 canvassing,16 discussion of human rights,17 journalism,18 cultural and artistic expression,19 teaching,20 and religious discourse.21 It may also include commercial advertising. The scope of paragraph 2 embraces even expression that may be regarded as deeply offensive,22 although such expression may be restricted in accordance with the provisions of article 19, paragraph 3 and article 20."
20,"12. Paragraph 2 protects all forms of expression and the means of their dissemination. Such forms include spoken, written and sign language and such non-verbal expression as images and objects of art.23 Means of expression include books, newspapers,24 pamphlets,25 posters, banners,26 dress and legal submissions. 27 They include all forms of audio-visual as well as electronic and internet-based modes of expression."
21,"Freedom of expression and the media"
22,"13. A free, uncensored and unhindered press or other media is essential in any society to ensure freedom of opinion and expression and the enjoyment of other Covenant rights. It constitutes one of the cornerstones of a democratic society.28 The Covenant embraces a right whereby the media may receive information on the basis of which it can carry out its function.29 The free communication of information and ideas about public and political issues between citizens, candidates and elected representatives is essential. This implies a free press and other media able to comment on public issues without censorship or restraint and to inform public opinion. 30 The public also has a corresponding right to receive media output.31"
23,"14. As a means to protect the rights of media users, including members of ethnic and linguistic minorities, to receive a wide range of information and ideas, States parties should take particular care to encourage an independent and diverse media."
24,"15. States parties should take account of the extent to which developments in information and communication technologies, such as internet and mobile based electronic information dissemination systems, have substantially changed communication practices around the world. There is now a global network for exchanging ideas and opinions that does not necessarily rely on the traditional mass media intermediaries. States parties should take all necessary steps to foster the independence of these new media and to ensure access of individuals thereto."
25,"16. States parties should ensure that public broadcasting services operate in an independent manner.32 In this regard, States parties should guarantee their independence and editorial freedom. They should provide funding in a manner that does not undermine their independence."
26,"17. Issues concerning the media are discussed further in the section of this general comment that addresses restrictions on freedom of expression."
27,"Right of access to information"
28,"18. Article 19, paragraph 2 embraces a right of access to information held by public bodies. Such information includes records held by a public body, regardless of the form in which the information is stored, its source and the date of production. Public bodies are as indicated in paragraph 7 of this general comment. The designation of such bodies may also include other entities when such entities are carrying out public functions. As has already been noted, taken together with article 25 of the Covenant, the right of access to information includes a right whereby the media has access to information on public affairs33 and the right of the general public to receive media output.34 Elements of the right of access to information are also addressed elsewhere in the Covenant. As the Committee observed in its general comment No. 16, regarding article 17 of the Covenant, every individual should have the right to ascertain in an intelligible form, whether, and if so, what personal data is stored in automatic data files, and for what purposes. Every individual should also be able to ascertain which public authorities or private individuals or bodies control or may control his or her files. If such files contain incorrect personal data or have been collected or processed contrary to the provisions of the law, every individual should have the right to have his or her records rectified. Pursuant to article 10 of the Covenant, a prisoner does not lose the entitlement to access to his medical records.35 The Committee, in general comment No. 32 on article 14, set out the various entitlements to information that are held by those accused of a criminal offence.36 Pursuant to the provisions of article 2, persons should be in receipt of information regarding their Covenant rights in general.37 Under article 27, a State party’s decision-making that may substantively compromise the way of life and culture of a minority group should be undertaken in a process of information-sharing and consultation with affected communities.38"
29,"19. To give effect to the right of access to information, States parties should proactively put in the public domain Government information of public interest. States parties should make every effort to ensure easy, prompt, effective and practical access to such information. States parties should also enact the necessary procedures, whereby one may gain access to information, such as by means of freedom of information legislation.39 The procedures should provide for the timely processing of requests for information according to clear rules that are compatible with the Covenant. Fees for requests for information should not be such as to constitute an unreasonable impediment to access to information. Authorities should provide reasons for any refusal to provide access to information. Arrangements should be put in place for appeals from refusals to provide access to information as well as in cases of failure to respond to requests."
30,"Freedom of expression and political rights"
31,"20. The Committee, in general comment No. 25 on participation in public affairs and the right to vote, elaborated on the importance of freedom of expression for the conduct of public affairs and the effective exercise of the right to vote. The free communication of information and ideas about public and political issues between citizens, candidates and elected representatives is essential. This implies a free press and other media able to comment on public issues and to inform public opinion without censorship or restraint.40 The attention of States parties is drawn to the guidance that general comment No. 25 provides with regard to the promotion and the protection of freedom of expression in that context."
32,"The application of article 19 (3)"
33,"21. Paragraph 3 expressly states that the exercise of the right to freedom of expression carries with it special duties and responsibilities. For this reason two limitative areas of restrictions on the right are permitted, which may relate either to respect of the rights or reputations of others or to the protection of national security or of public order (ordre public) or of public health or morals. However, when a State party imposes restrictions on the exercise of freedom of expression, these may not put in jeopardy the right itself. The Committee recalls that the relation between right and restriction and between norm and exception must not be reversed.41 The Committee also recalls the provisions of article 5,paragraph 1, of the Covenant according to which “nothing in the present Covenant may be interpreted as implying for any State, group or person any right to engage in any activity or perform any act aimed at the destruction of any of the rights and freedoms recognized herein or at their limitation to a greater extent than is provided for in the present Covenant”."
34,"22. Paragraph 3 lays down specific conditions and it is only subject to these conditions that restrictions may be imposed: the restrictions must be “provided by law”; they may only be imposed for one of the grounds set out in subparagraphs (a) and (b) of paragraph 3; and they must conform to the strict tests of necessity and proportionality.42 Restrictions are not allowed on grounds not specified in paragraph 3, even if such grounds would justify restrictions to other rights protected in the Covenant. Restrictions must be applied only for those purposes for which they were prescribed and must be directly related to the specific need on which they are predicated.43"
35,"23. States parties should put in place effective measures to protect against attacks aimed at silencing those exercising their right to freedom of expression. Paragraph 3 may never be invoked as a justification for the muzzling of any advocacy of multi-party democracy, democratic tenets and human rights.44 Nor, under any circumstance, can an attack on a person, because of the exercise of his or her freedom of opinion or expression, including such forms of attack as arbitrary arrest, torture, threats to life and killing, be compatible with article 19.45 Journalists are frequently subjected to such threats, intimidation and attacks because of their activities.46 So too are persons who engage in the gathering and analysis of information on the human rights situation and who publish human rights-related reports, including judges and lawyers.47 All such attacks should be vigorously investigated in a timely fashion, and the perpetrators prosecuted,48 and the victims, or, in the case of killings, their representatives, be in receipt of appropriate forms of redress.49"
36,"24. Restrictions must be provided by law. Law may include laws of parliamentary privilege50 and laws of contempt of court.51 Since any restriction on freedom of expression constitutes a serious curtailment of human rights, it is not compatible with the Covenant for a restriction to be enshrined in traditional, religious or other such customary law.52"
37,"25. For the purposes of paragraph 3, a norm, to be characterized as a “law”, must be formulated with sufficient precision to enable an individual to regulate his or her conduct accordingly53 and it must be made accessible to the public. A law may not confer unfettered discretion for the restriction of freedom of expression on those charged with its execution.54 Laws must provide sufficient guidance to those charged with their execution to enable them to ascertain what sorts of expression are properly restricted and what sorts are not."
38,"26. Laws restricting the rights enumerated in article 19, paragraph 2, including the laws referred to in paragraph 24, must not only comply with the strict requirements of article 19, paragraph 3 of the Covenant but must also themselves be compatible with the provisions, aims and objectives of the Covenant.55 Laws must not violate the non-discrimination provisions of the Covenant. Laws must not provide for penalties that are incompatible with the Covenant, such as corporal punishment.56"
39,"27. It is for the State party to demonstrate the legal basis for any restrictions imposed on freedom of expression.57 If, with regard to a particular State party, the Committee has to consider whether a particular restriction is imposed by law, the State party should provide details of the law and of actions that fall within the scope of the law.58"
40,"28. The first of the legitimate grounds for restriction listed in paragraph 3 is that of respect for the rights or reputations of others. The term “rights” includes human rights as recognized in the Covenant and more generally in international human rights law. For example, it may be legitimate to restrict freedom of expression in order to protect the right to vote under article 25, as well as rights article under 17 (see para. 37).59 Such restrictions must be constructed with care: while it may be permissible to protect voters from forms of expression that constitute intimidation or coercion, such restrictions must not impede political debate, including, for example, calls for the boycotting of a non-compulsory vote.60 The term “others” relates to other persons individually or as members of a community.61 Thus, it may, for instance, refer to individual members of a community defined by its religious faith62 or ethnicity.63"
41,"29. The second legitimate ground is that of protection of national security or of public order (ordre public), or of public health or morals."
42,"30. Extreme care must be taken by States parties to ensure that treason laws64 and similar provisions relating to national security, whether described as official secrets or sedition laws or otherwise, are crafted and applied in a manner that conforms to the strict requirements of paragraph 3. It is not compatible with paragraph 3, for instance, to invoke such laws to suppress or withhold from the public information of legitimate public interest that does not harm national security or to prosecute journalists, researchers, environmental activists, human rights defenders, or others, for having disseminated such information.65 Nor is it generally appropriate to include in the remit of such laws such categories of information as those relating to the commercial sector, banking and scientific progress.66 The Committee has found in one case that a restriction on the issuing of a statement in support of a labour dispute, including for the convening of a national strike, was not permissible on the grounds of national security.67"
43,"31. On the basis of maintenance of public order (ordre public) it may, for instance, be permissible in certain circumstances to regulate speech-making in a particular public place.68 Contempt of court proceedings relating to forms of expression may be tested against the public order (ordre public) ground. In order to comply with paragraph 3, such proceedings and the penalty imposed must be shown to be warranted in the exercise of a court’s power to maintain orderly proceedings.69 Such proceedings should not in any way be used to restrict the legitimate exercise of defence rights."
44,"32. The Committee observed in general comment No. 22, that “the concept of morals derives from many social, philosophical and religious traditions; consequently, limitations... for the purpose of protecting morals must be based on principles not deriving exclusively from a single tradition”. Any such limitations must be understood in the light of universality of human rights and the principle of non-discrimination"
45,"33. Restrictions must be “necessary” for a legitimate purpose. Thus, for instance, a prohibition on commercial advertising in one language, with a view to protecting the language of a particular community, violates the test of necessity if the protection could be achieved in other ways that do not restrict freedom of expression.70 On the other hand, the Committee has considered that a State party complied with the test of necessity when it transferred a teacher who had published materials that expressed hostility toward a religious community to a non-teaching position in order to protect the right and freedom of children of that faith in a school district.71"
46,"34. Restrictions must not be overbroad. The Committee observed in general comment No. 27 that “restrictive measures must conform to the principle of proportionality; they must be appropriate to achieve their protective function; they must be the least intrusive instrument amongst those which might achieve their protective function; they must be proportionate to the interest to be protected...The principle of proportionality has to be respected not only in the law that frames the restrictions but also by the administrative and judicial authorities in applying the law”.72 The principle of proportionality must also take account of the form of expression at issue as well as the means of its dissemination. For instance, the value placed by the Covenant upon uninhibited expression is particularly high in the circumstances of public debate in a democratic society concerning figures in the public and political domain.73"
47,"35. When a State party invokes a legitimate ground for restriction of freedom of expression, it must demonstrate in specific and individualized fashion the precise nature of the threat, and the necessity and proportionality of the specific action taken, in particular by establishing a direct and immediate connection between the expression and the threat.74"
48,"36. The Committee reserves to itself an assessment of whether, in a given situation, there may have been circumstances which made a restriction of freedom of expression necessary.75 In this regard, the Committee recalls that the scope of this freedom is not to be assessed by reference to a “margin of appreciation”76 and in order for the Committee to carry out this function, a State party, in any given case, must demonstrate in specific fashion the precise nature of the threat to any of the enumerated grounds listed in paragraph 3 that has caused it to restrict freedom of expression.77"
49,"Limitative scope of restrictions on freedom of expression in certain specific areas"
50,"37. Among restrictions on political discourse that have given the Committee cause for concern are the prohibition of door-to-door canvassing,78 restrictions on the number and type of written materials that may be distributed during election campaigns,79 blocking access during election periods to sources, including local and international media, of political commentary,80 and limiting access of opposition parties and politicians to media outlets.81 Every restriction should be compatible with paragraph 3. However, it may be legitimate for a State party to restrict political polling imminently preceding an election in order to maintain the integrity of the electoral process.82"
51,"38. As noted earlier in paragraphs 13 and 20, concerning the content of political discourse, the Committee has observed that in circumstances of public debate concerning public figures in the political domain and public institutions, the value placed by the Covenant upon uninhibited expression is particularly high.83 Thus, the mere fact that forms of expression are considered to be insulting to a public figure is not sufficient to justify the imposition of penalties, albeit public figures may also benefit from the provisions of the Covenant.84 Moreover, all public figures, including those exercising the highest political authority such as heads of state and government, are legitimately subject to criticism and political opposition.85 Accordingly, the Committee expresses concern regarding laws on such matters as, lese majesty,86 desacato,87 disrespect for authority,88 disrespect for flags and symbols, defamation of the head of state89 and the protection of the honour of public officials,90 and laws should not provide for more severe penalties solely on the basis of the identity of the person that may have been impugned. States parties should not prohibit criticism of institutions, such as the army or the administration.91"
