"1","Human Rights Committee"
52,"39. States parties should ensure that legislative and administrative frameworks for the regulation of the mass media are consistent with the provisions of paragraph 3.92 Regulatory systems should take into account the differences between the print and broadcast sectors and the internet, while also noting the manner in which various media converge. It is incompatible with article 19 to refuse to permit the publication of newspapers and other print media other than in the specific circumstances of the application of paragraph 3. Such circumstances may never include a ban on a particular publication unless specific content, that is not severable, can be legitimately prohibited under paragraph 3. States parties must avoid imposing onerous licensing conditions and fees on the broadcast media, including on community and commercial stations.93 The criteria for the application of such conditions and licence fees should be reasonable and objective, 94 clear, 95 transparent, 96 non- discriminatory and otherwise in compliance with the Covenant.97 Licensing regimes for broadcasting via media with limited capacity, such as audiovisual terrestrial and satellite services should provide for an equitable allocation of access and frequencies between public, commercial and community broadcasters. It is recommended that States parties that have not already done so should establish an independent and public broadcasting licensing authority, with the power to examine broadcasting applications and to grant licenses.98"
53,"40. The Committee reiterates its observation in general comment No. 10 that “because of the development of modern mass media, effective measures are necessary to prevent such control of the media as would interfere with the right of everyone to freedom of expression”. The State should not have monopoly control over the media and should promote plurality of the media.99 Consequently, States parties should take appropriate action, consistent with the Covenant, to prevent undue media dominance or concentration by privately controlled media groups in monopolistic situations that may be harmful to a diversity of sources and views."
54,"41. Care must be taken to ensure that systems of government subsidy to media outlets and the placing of government advertisements100 are not employed to the effect of impeding freedom of expression.101 Furthermore, private media must not be put at a disadvantage compared to public media in such matters as access to means of dissemination/distribution and access to news.102"
55,"42. The penalization of a media outlet, publishers or journalist solely for being critical of the government or the political social system espoused by the government103can never be considered to be a necessary restriction of freedom of expression."
56,"43. Any restrictions on the operation of websites, blogs or any other internet-based, electronic or other such information dissemination system, including systems to support such communication, such as internet service providers or search engines, are only permissible to the extent that they are compatible with paragraph 3. Permissible restrictions generally should be content-specific; generic bans on the operation of certain sites and systems are not compatible with paragraph 3. It is also inconsistent with paragraph 3 to prohibit a site or an information dissemination system from publishing material solely on the basis that it may be critical of the government or the political social system espoused by the government.104"
57,"44. Journalism is a function shared by a wide range of actors, including professional full-time reporters and analysts, as well as bloggers and others who engage in forms of self- publication in print, on the internet or elsewhere, and general State systems of registration or licensing of journalists are incompatible with paragraph 3. Limited accreditation schemes are permissible only where necessary to provide journalists with privileged access to certain places and/or events. Such schemes should be applied in a manner that is non- discriminatory and compatible with article 19 and other provisions of the Covenant, based on objective criteria and taking into account that journalism is a function shared by a wide range of actors."
58,"45. It is normally incompatible with paragraph 3 to restrict the freedom of journalists and others who seek to exercise their freedom of expression (such as persons who wish to travel to human rights-related meetings)105 to travel outside the State party, to restrict the entry into the State party of foreign journalists to those from specified countries106 or to restrict freedom of movement of journalists and human rights investigators within the State party (including to conflict-affected locations, the sites of natural disasters and locations where there are allegations of human rights abuses). States parties should recognize and respect that element of the right of freedom of expression that embraces the limited journalistic privilege not to disclose information sources.107"
59,"46. States parties should ensure that counter-terrorism measures are compatible with paragraph 3. Such offences as “encouragement of terrorism”108 and “extremist activity”109 as well as offences of “praising”, “glorifying”, or “justifying” terrorism, should be clearly defined to ensure that they do not lead to unnecessary or disproportionate interference with freedom of expression. Excessive restrictions on access to information must also be avoided. The media plays a crucial role in informing the public about acts of terrorism and its capacity to operate should not be unduly restricted. In this regard, journalists should not be penalized for carrying out their legitimate activities."
60,"47. Defamation laws must be crafted with care to ensure that they comply with paragraph 3, and that they do not serve, in practice, to stifle freedom of expression.110 All such laws, in particular penal defamation laws, should include such defences as the defence of truth and they should not be applied with regard to those forms of expression that are not, of their nature, subject to verification. At least with regard to comments about public figures, consideration should be given to avoiding penalizing or otherwise rendering unlawful untrue statements that have been published in error but without malice.111 In any event, a public interest in the subject matter of the criticism should be recognized as a defence. Care should be taken by States parties to avoid excessively punitive measures and penalties. Where relevant, States parties should place reasonable limits on the requirement for a defendant to reimburse the expenses of the successful party.112 States parties should consider the decriminalization of defamation113 and, in any case, the application of the criminal law should only be countenanced in the most serious of cases and imprisonment is never an appropriate penalty. It is impermissible for a State party to indict a person for criminal defamation but then not to proceed to trial expeditiously – such a practice has a chilling effect that may unduly restrict the exercise of freedom of expression of the person concerned and others.114"
61,"48. Prohibitions of displays of lack of respect for a religion or other belief system, including blasphemy laws, are incompatible with the Covenant, except in the specific circumstances envisaged in article 20, paragraph 2, of the Covenant. Such prohibitions must also comply with the strict requirements of article 19, paragraph 3, as well as such articles as 2, 5, 17, 18 and 26. Thus, for instance, it would be impermissible for any such laws to discriminate in favour of or against one or certain religions or belief systems, or their adherents over another, or religious believers over non-believers. Nor would it be permissible for such prohibitions to be used to prevent or punish criticism of religious leaders or commentary on religious doctrine and tenets of faith.115"
62,"49. Laws that penalize the expression of opinions about historical facts are incompatible with the obligations that the Covenant imposes on States parties in relation to the respect for freedom of opinion and expression.116 The Covenant does not permit general prohibition of expressions of an erroneous opinion or an incorrect interpretation of past events. Restrictions on the right of freedom of opinion should never be imposed and, with regard to freedom of expression, they should not go beyond what is permitted in paragraph 3 or required under article 20."
63,"The relationship between articles 19 and 20"
64,"50. Articles 19 and 20 are compatible with and complement each other. The acts that are addressed in article 20 are all subject to restriction pursuant to article 19, paragraph 3. As such, a limitation that is justified on the basis of article 20 must also comply with article 19, paragraph 3.117"
65,"51. What distinguishes the acts addressed in article 20 from other acts that may be subject to restriction under article 19, paragraph 3, is that for the acts addressed in article 20, the Covenant indicates the specific response required from the State: their prohibition by law. It is only to this extent that article 20 may be considered as lex specialis with regard to article 19."
66,"52. It is only with regard to the specific forms of expression indicated in article 20 that States parties are obliged to have legal prohibitions. In every case in which the State restricts freedom of expression it is necessary to justify the prohibitions and their provisions in strict conformity with article 19."
67,"Footnotes"
68,"1 See communication No. 1173/2003, Benhadj v. Algeria, Views adopted on 20 July 2007; No. 628/1995, Park v. Republic of Korea, Views adopted on 5 July 1996."
69,"2 See the Committee’s general comment No. 24 (1994) on issues relating to reservations made upon ratification or accession to the Covenant or the Optional Protocols thereto, or in relation to the declarations under article 41 of the Covenant, Official Records of the General Assembly, Fiftieth Session, Supplement No. 40, vol. I (A/50/40 (Vol. I)), annex V."
70,"3 See the Committee’s general comment No. 29 (2001) on derogation during a state of emergency, para. 13, Official Records of the General Assembly, Fifty-sixth Session, Supplement No. 40, vol. I (A/56/40 (Vol. I)), annex VI."
71,"4 General comment No. 29, para. 11."
72,"5 General comment No. 24."
73,"6 See the Committee’s general comment No. 31 (2004) on the nature of the general legal obligation imposed on States parties to the Covenant, para. 4, Official Records of the General Assembly, Fifty-ninth Session, Supplement No. 40, vol. I (A/59/40 (Vol. I)), annex III"
74,"7 See communication No. 61/1979, Hertzberg et al. v. Finland, Views adopted on 2 April 1982."
75,"8 General comment No. 31, para. 8; See communication No. 633/1995, Gauthier v. Canada, Views adopted on 7 April 1999."
76,"9 See communication No. 550/93, Faurisson v. France, Views adopted on 8 November 1996."
77,"10 See communication No. 157/1983, Mpaka-Nsusu v. Zaire, Views adopted on 26 March 1986; No. 414/1990, Mika Miha v. Equatorial Guinea, Views adopted on 8 July 1994."
78,"11 See communication No. 878/1999, Kang v. Republic of Korea, Views adopted on 15 July 2003."
79,"12 See communications Nos. 359/1989 and 385/1989, Ballantyne, Davidson and McIntyre v. Canada, Views adopted on 18 October 1990."
80,"13 See communication No. 414/1990, Mika Miha v. Equatorial Guinea."
81,"14 See communication No. 1189/2003, Fernando v. Sri Lanka, Views adopted on 31 March 2005."
82,"15 See communication No. 1157/2003, Coleman v. Australia, Views adopted on 17 July 2006."
83,"16 Concluding observations on Japan (CCPR/C/JPN/CO/5)."
84,"17 See communication No. 1022/2001, Velichkin v. Belarus, Views adopted on 20 October 2005."
85,"18 See communication No. 1334/2004, Mavlonov and Sa’di v. Uzbekistan, Views adopted on 19 March 2009."
86,"19 See communication No. 926/2000, Shin v. Republic of Korea, Views adopted on 16 March 2004."
87,"20 See communication No. 736/97, Ross v. Canada, Views adopted on 18 October 2000."
88,"21 Ibid."
89,"22 Ibid."
90,"23 See communication No. 926/2000, Shin v. Republic of Korea."
91,"24 See communication No. 1341/2005, Zundel v. Canada, Views adopted on 20 March 2007."
92,"25 See communication No. 1009/2001, Shchetoko et al. v. Belarus, Views adopted on 11 July 2006."
93,"26 See communication No. 412/1990, Kivenmaa v. Finland, Views adopted on 31 March 1994."
94,"27 See communication No. 1189/2003, Fernando v. Sri Lanka."
95,"28 See communication No. 1128/2002, Marques v. Angola, Views adopted on 29 March 2005."
96,"29 See communication No. 633/95, Gauthier v. Canada."
97,"30 See the Committee’s general comment No. 25 (1996) on article 25 (Participation in public affairs and the right to vote), para. 25, Official Records of the General Assembly, Fifty-first Session, Supplement No. 40, vol. I (A/51/40 (Vol. I)), annex V."
98,"31 See communication No. 1334/2004, Mavlonov and Sa’di v. Uzbekistan."
99,"32 Concluding observations on Republic of Moldova (CCPR/CO/75/MDA)."
100,"33 See communication No. 633/95, Gauthier v. Canada."
101,"34 See communication No. 1334/2004, Mavlonov and Sa’di v. Uzbekistan."
102,"35 See communication No. 726/1996, Zheludkov v. Ukraine, Views adopted on 29 October 2002."
103,"36 See the Committee’s general comment No. 32 (2007) on the right to equality before courts and tribunals and to a fair trial, para. 33, Official Records of the General Assembly, Sixty-second Session, Supplement No. 40, vol. I (A/62/40 (Vol. I)), annex VI"
104,"37 General comment No. 31."
105,"38 See communication No. 1457/2006, Poma v. Peru, Views adopted on 27 March 2009."
106,"39 Concluding observations on Azerbaijan (CCPR/C/79/Add.38 (1994))."
107,"40 See General comment No. 25 on article 25 of the Covenant, para. 25."
108,"41 See the Committee’s general comment No. 27 on article 12, Official Records of the General Assembly, Fifty-fifth Session, Supplement No. 40, vol. I (A/55/40 (Vol. I)), annex VI, sect. A"
109,"42 See communication No. 1022/2001, Velichkin v. Belarus, Views adopted on 20 October 2005."
110,"43 See the Committee’s general comment No. 22, Official Records of the General Assembly, Forty-eighth Session, Supplement No. 40 (A/48/40), annex VI"
111,"44 See communication No. 458/91, Mukong v. Cameroon, Views adopted on 21 July 1994."
112,"45 See communication No. 1353/2005, Njaru v. Cameroon, Views adopted on 19 March 2007."
113,"46 See, for instance, concluding observations on Algeria (CCPR/C/DZA/CO/3); concluding observations on Costa Rica (CCPR/C/CRI/CO/5); concluding observations on Sudan (CCPR/C/SDN/CO/3)."
114,"47 See communication No. 1353/2005, Njaru v. Cameroon ; concluding observations on Nicaragua (CCPR/C/NIC/CO/3); concluding observations on Tunisia (CCPR/C/TUN/CO/5); concluding observations on the Syrian Arab Republic (CCPR/CO/84/SYR); concluding observations on Colombia (CCPR/CO/80/COL)."
115,"48 Ibid. and concluding observations on Georgia (CCPR/C/GEO/CO/3)."
116,"49 Concluding observations on Guyana (CCPR/C/79/Add.121)."
117,"50 See communication No. 633/95, Gauthier v. Canada."
118,"51 See communication No. 1373/2005, Dissanayake v. Sri Lanka, Views adopted on 22 July 2008."
119,"52 See general comment No. 32."
120,"53 See communication No. 578/1994, de Groot v. The Netherlands, Views adopted on 14 July 1995."
121,"54 See general comment No. 27."
122,"55 See communication No. 488/1992, Toonen v. Australia, Views adopted on 30 March 1994."
123,"56 General comment No. 20, Official Records of the General Assembly, Forty-seventh Session, Supplement No. 40 (A/47/40), annex VI, sect. A."
124,"57 See communication No. 1553/2007, Korneenko et al. v. Belarus, Views adopted on 31 October 2006."
125,"58 See communication No. 132/1982, Jaona v. Madagascar, Views adopted on 1 April 1985."
126,"59 See communication No. 927/2000, Svetik v. Belarus, Views adopted on 8 July 2004."
127,"60 Ibid."
128,"61 See communication No. 736/97, Ross v. Canada, Views adopted on 18 October 2000."
129,"62 See communication No. 550/93, Faurisson v. France; concluding observations on Austria (CCPR/C/AUT/CO/4)."
130,"63 Concluding observations on Slovakia (CCPR/CO/78/SVK); concluding observations on Israel (CCPR/CO/78/ISR)."
131,"64 Concluding observations on Hong Kong (CCPR/C/HKG/CO/2)."
132,"65 Concluding observations on the Russian Federation (CCPR/CO/79/RUS)."
133,"66 Concluding observations on Uzbekistan (CCPR/CO/71/UZB)."
134,"67 See communication No. 518/1992, Sohn v. Republic of Korea, Views adopted on 18 March 1994."
135,"68 See communication No. 1157/2003, Coleman v. Australia."
136,"69 See communication No. 1373/2005, Dissanayake v. Sri Lanka."
137,"70 See communication No. 359, 385/89, Ballantyne , Davidson and McIntyre v. Canada."
138,"71 See communication No. 736/97, Ross v. Canada, Views adopted on 17 July 2006."
139,"72 General comment No. 27, para. 14. See also Communications No. 1128/2002, Marques v. Angola; No. 1157/2003, Coleman v. Australia."
140,"73 See communication No. 1180/2003, Bodrozic v. Serbia and Montenegro, Views adopted on 31 October 2005."
141,"74 See communication No. 926/2000, Shin v. Republic of Korea ."
142,"75 See communication No. 518/1992, Sohn v. Republic of Korea ."
143,"76 See communication No. 511/1992, Ilmari Länsman, et al. v. Finland, Views adopted on 14 October 1993."
144,"77 See communications Nos. 518/92, Sohn v. Republic of Korea; No. 926/2000, Shin v. Republic of Korea,."
145,"78 Concluding observations on Japan (CCPR/C/JPN/CO/5)."
146,"79 Ibid."
147,"80 Concluding observations on Tunisia (CCPR/C/TUN/CO/5)."
148,"81 Concluding observations on Togo (CCPR/CO/76/TGO); concluding observations on Moldova (CCPR/CO/75/MDA)."
149,"82 See communication No. 968/2001, Kim v. Republic of Korea, Views adopted on 14 March 1996."
150,"83 See communication No. 1180/2003, Bodrozic v. Serbia and Montenegro, Views adopted on 31 October 2005."
151,"84 Ibid."
152,"85 See communication No. 1128/2002, Marques v. Angola."
153,"86 See communications Nos. 422-424/1990, Aduayom et al. v. Togo, Views adopted on 30 June 1994."
154,"87 Concluding observations on the Dominican Republic (CCPR/CO/71/DOM)."
155,"88 Concluding observations on Honduras (CCPR/C/HND/CO/1)."
156,"89 See concluding observations on Zambia (CCPR/ZMB/CO/3), para.25."
157,"90 See concluding observations on Costa Rica (CCPR/C/CRI/CO/5), para. 11."
158,"91 Ibid., and see concluding observations on Tunisia (CCPR/C/TUN/CO/5), para. 91.."
159,"92 See concluding observations on Viet Nam (CCPR/CO/75/VNM), para. 18, and concluding observations on Lesotho (CCPR/CO/79/Add.106), para. 23."
160,"93 Concluding observations on Gambia (CCPR/CO/75/GMB)."
161,"94 See concluding observations on Lebanon (CCPR/CO/79/Add.78), para. 25."
162,"95 Concluding observations on Kuwait (CCPR/CO/69/KWT); concluding observations on Ukraine (CCPR/CO/73/UKR)."
163,"96 Concluding observations on Kyrgyzstan (CCPR/CO/69/KGZ)."
164,"97 Concluding observations on Ukraine (CCPR/CO/73/UKR)."
165,"98 Concluding observations on Lebanon (CCPR/CO/79/Add.78)."
166,"99 See concluding observations on Guyana (CCPR/CO/79/Add.121), para. 19; concluding observations on the Russian Federation (CCPR/CO/79/RUS); concluding observations on Viet Nam (CCPR/CO/75/VNM); concluding observations on Italy (CCPR/C/79/Add. 37)."
167,"100 See concluding observations on Lesotho (CCPR/CO/79/Add.106), para. 22."
168,"101 Concluding observations on Ukraine (CCPR/CO/73/UKR)."
169,"102 Concluding observations on Sri Lanka (CCPR/CO/79/LKA); and see concluding observations on Togo (CCPR/CO/76/TGO), para. 17."
170,"103 Concluding observations on Peru (CCPR/CO/70/PER)."
171,"104 Concluding observations on the Syrian Arab Republic (CCPR/CO/84/SYR)."
172,"105 Concluding observations on Uzbekistan (CCPR/CO/83/UZB); concluding observations on Morocco (CCPR/CO/82/MAR)."
173,"106 Concluding observations on Democratic People’s Republic of Korea (CCPR/CO/72/PRK)."
174,"107 Concluding observations on Kuwait (CCPR/CO/69/KWT)."
175,"108 Concluding observations on the United Kingdom of Great Britain and Northern Ireland (CCPR/C/GBR/CO/6)."
176,"109 Concluding observations on the Russian Federation (CCPR/CO/79/RUS)."
177,"110 Concluding observations on the United Kingdom of Great Britain and Northern Ireland (CCPR/C/GBR/CO/6)."
178,"111 Ibid."
179,"112 Ibid."
180,"113 Concluding observations on Italy (CCPR/C/ITA/CO/5); concluding observations on the Former Yugoslav Republic of Macedonia (CCPR/C/MKD/CO/2)."
181,"114 See communication No. 909/2000, Kankanamge v. Sri Lanka, Views adopted on 27 July 2004."
182,"115 Concluding observations on the United Kingdom of Great Britain and Northern Ireland-the Crown Dependencies of Jersey, Guernsey and the Isle of Man (CCPR/C/79/Add.119). See also concluding observations on Kuwait (CCPR/CO/69/KWT)."
183,"116 So called “memory-laws”, see communication No. , No. 550/93, Faurisson v. France. See also concluding observations on Hungary (CCPR/C/HUN/CO/5) paragraph 19."
184,"117 See communication No. 736/1997, Ross v. Canada, Views adopted on 18 October 2000."
