1009,"Vulnerability–Part A: Global and Sectoral Aspects, Working Group II Contribution to the Fifth"
1010,"Assessment Report of the Intergovernmental Panel on Climate Change (New York, Cambridge"
1011,"University Press, 2014), p. 733.CEDAW/C/GC/37"
1012,"21/24"
1013,"18-03824"
1014,"care that responds to the specific health needs of diverse groups of women, in the"
1015,"context of disasters and climate change;"
1016,"(f) Require that all health services operating in situations of disaster"
1017,"function to promote the human rights of women, including the rights to"
1018,"autonomy, privacy, confidentiality, informed consent, non-discrimination and"
1019,"choice. Specific measures to ensure the promotion and protection of the rights of"
1020,"women and girls with disabilities, women and girls belonging to indigenous and"
1021,"minority groups, lesbian, bisexual and transgender women and girls, intersex"
1022,"persons, older women and women and girls belonging to other marginalized"
1023,"groups should be explicitly included in health-care policies and standards"
1024,"relating to situations of disaster;"
1025,"(g) Ensure that training curricula for health workers, including in"
1026,"emergency services, incorporate comprehensive, mandatory, gender-responsive"
1027,"courses on women’s health and human rights, in particular gender-based"
1028,"violence. Health-care providers should be made aware of the linkages between"
1029,"increased disaster risk, climate change and the growing potential for public"
1030,"health emergencies as a result of shifting disease patterns. The training should"
1031,"also include information on the rights of women with disabilities and women"
1032,"belonging to indigenous, minority and other marginalized groups;"
1033,"(h) Collect and share data on gender-based differences in vulnerability to"
1034,"infectious and non-infectious diseases occurring in situations of disaster and as"
1035,"a result of climate change. That information should be used to develop integrated"
1036,"rights-based disaster and climate change action plans and strategies."
1037,"E. Right to an adequate standard of living"
1038,"Food, land, housing, water and sanitation"
1039,"69. The impacts of climate change are already being experienced in many areas, in"
1040,"connection with decreased food security, land degradation and more limited"
1041,"availability of water and other natural resources. There is evidence that the effects of"
1042,"food, land and water insecurity are not gender-neutral and that women are more likely"
1043,"to suffer from undernourishment and malnutrition in times of food scarcity.27 It has"
1044,"also been shown that women and girls, who are those with the primary responsibility"
1045,"for growing, gathering and preparing food and collecting fuel and water in many"
1046,"societies, are disproportionately affected by a lack of available, affordable, safe and"
1047,"accessible drinking water and fuel sources. The additional burden placed on women"
1048,"and girls by such climate-related resource scarcity drains time, causes physical"
1049,"hardship, increases exposure to the risk of violence and increases stress.28"
1050,"70. Women, in particular rural and indigenous women, are directly affected by"
1051,"disasters and climate change, as food producers and as agricultural workers because"
1052,"they make up the majority of the world’s smallholder and subsistence farmers and a"
1053,"significant proportion of farmworkers. As a result of discriminatory laws and social"
1054,"norms, women have limited access to secure land tenure, and the farmland that they"
1055,"are allotted tends to be of inferior quality and more prone to flooding, erosion or other"
1056,"adverse climatic events. Owing to the increasing rate of out-migration among men in"
1057,"climate change-affected areas, women are left with the sole responsibility for farming,"
1058,"yet they do not possess the legal and socially recognized land ownership necessary to"
1059,"__________________"
1060,"27 See, for example, CEDAW/C/NPL/CO/4–5."
1061,"28 WHO, “Gender, climate change and health”.CEDAW/C/GC/37"
1062,"18-03824"
1063,"22/24"
1064,"adapt to the changing climatic conditions effectively. Women are also indirectly"
1065,"affected by the impacts of weather-related events on the price of foodstuffs."
1066,"71. Articles 12 and 14 of the Convention contain specific guarantees on nutrition"
1067,"and the equal participation of women in decision-making about food production and"
1068,"consumption. In addition, the core obligations of States parties to eliminate"
1069,"discrimination, outlined in article 2, to modify cultural patterns of behavi our based"
1070,"on discriminatory stereotypes, in article 5 (a), to ensure equality before the law, in"
1071,"article 15, and to guarantee equality within marriage and family relations, in article"
1072,"16, are of central importance to addressing women’s rights to land and productive"
1073,"resources, which are vital to ensuring the right to food and sustainable livelihoods."
1074,"72. States parties should:"
1075,"(a) Promote and protect women’s equal rights to food, housing,"
1076,"sanitation, land and natural resources, including adequate drinking water, water"
1077,"for domestic use and for food production, and take positive measures to"
1078,"guarantee the availability and accessibility of those rights, even during times of"
1079,"scarcity. Particular attention should be paid to ensuring that women living in"
1080,"poverty, in particular those in informal settlements in both urban and rural"
1081,"areas, have access to adequate housing, drinking water, sanitation and food,"
1082,"especially in the context of disasters and climate change;"
1083,"(b) Increase resilience to the impacts of disasters and climate change"
1084,"among women by identifying and supporting livelihoods that are sustainable and"
1085,"empowering, and develop gender-responsive services, including extension"
1086,"services to assist women farmers, that enable women to gain access to and benefit"
1087,"from those livelihoods;"
1088,"(c) Develop participatory, gender-responsive development plans and"
1089,"policies that integrate a human rights-based approach, in order to guarantee"
1090,"sustainable access to adequate housing, food, water and sanitation. Priority"
1091,"should be given to ensuring the accessibility of services for all women;"
1092,"(d) Adopt legislation, programmes and policies and allocate budgets to"
1093,"eliminate homelessness and to ensure that adequate and disaster resilient"
1094,"housing is available and accessible to all women, including those with disabilities."
1095,"Measures must be taken to protect women against forced eviction and to ensure"
1096,"that public housing and rental assistance schemes accord priority and respond"
1097,"to the specific needs of groups of women."
1098,"F. Right to freedom of movement"
1099,"73. The increasing frequency and intensity of extreme weather events and"
1100,"environmental degradation resulting from climate change are likely to lead to"
1101,"significant population displacement both within countries and across borders. 29"
1102,"74. The Committee and many other international human rights bodies, including the"
1103,"Committee on the Protection of the Rights of All Migrant Workers and Members of"
1104,"Their Families, have recognized that disasters and climate change are among the push"
1105,"__________________"
1106,"29 United Nations Entity for Gender Equality and the Empowerment of Women, “Addressing gender"
1107,"dimensions in large-scale movements of refugees and migrants”, joint statement by the"
1108,"Committee on the Protection of the Rights of All Migrant Workers and Members of Their"
1109,"Families, the Committee on the Elimination of Discrimination against Women, the United"
1110,"Nations Entity for Gender Equality and the Empowerment of Women and the Office of the"
1111,"United Nations High Commissioner for Human Rights, 19 September 2016.CEDAW/C/GC/37"
1112,"23/24"
1113,"18-03824"
1114,"factors for migration, in particular among women. 30 In several regions, climate"
1115,"change and disasters are contributing to an increase in the migration o f women, on"
1116,"their own, into sectors of work done predominantly by women, for the purposes of"
1117,"supporting family members who no longer have local livelihood opportunities."
1118,"75. Women migrants face a heightened risk of gender-based violence, including"
1119,"trafficking in persons, and other forms of discrimination in transit, in camps, at"
1120,"borders and in destination countries. Women may also face specific human rights"
1121,"violations during migration and at their destination, owing to a lack of adequate"
1122,"sexual, reproductive and mental health services and discrimination in gaining access"
1123,"to employment, social security, education, housing, legal documents such as birth or"
1124,"marriage certificates, and justice. Migrant women and girls are frequently subject to"
1125,"intersecting forms of discrimination. Women who migrate may also be vulnerable to"
1126,"the impacts of climate change in destination areas, in particular in urban centres in"
1127,"developing countries."
1128,"76. In many contexts, however, women are impeded from leaving regions that are"
1129,"at high risk of disaster or migrating to re-establish their lives in the wake of extreme"
1130,"climatic events. 31 Gender-based stereotypes, household responsibilities,"
1131,"discriminatory laws, lack of economic resources and limited access to social capital"
1132,"frequently restrict the ability of women to migrate."
1133,"77. Women who are left behind when male family members migrate may also find"
1134,"themselves having to take on non-traditional economic and community leadership"
1135,"tasks for which they have had little preparation or training, such as when disasters"
1136,"occur and women must assume primary responsibility for coordinating mitigation,"
1137,"recovery and adaptation efforts."
1138,"78. In accordance with the Convention and general recommendation No. 26"
1139,"(2008) on women migrant workers and general recommendation No. 32, States"
1140,"parties should:"
1141,"(a) Ensure that migration and development policies are gender responsive"
1142,"and that they include sound disaster risk considerations and recognize disasters"
1143,"and climate change as important push factors for internal displacement and"
1144,"migration. That information should be incorporated into national and local plans"
1145,"for monitoring and supporting the rights of women and girls during migration"
1146,"and displacement;"
1147,"(b) Facilitate the participation of migrant women, including those who"
1148,"have been displaced as a result of disasters and climate change, in the"
1149,"development, implementation and monitoring of policies designed to protect and"
1150,"promote their human rights at all phases of migration. Particular efforts must"
1151,"be made to involve migrant women in designing appropriate services in areas"
1152,"including mental health and psychosocial support, sexual and reproductive"
1153,"health, education and training, employment, housing and access to justice;"
1154,"(c) Ensure gender balance among the border police, military personnel"
1155,"and government officials responsible for the reception of migrants and train"
1156,"those groups on the gender-specific harm that migrant women may face,"
1157,"including the increased risk of violence;"
1158,"(d) Integrate human mobility-related considerations into disaster risk"
1159,"reduction and climate change mitigation and adaptation policies, taking into"
1160,"__________________"
1161,"30 Ibid. See also general recommendation No. 26 (2008) on women migrant workers."
1162,"31 Asian Development Bank, Gender Equality and Food Security: Women"
1163,"’"
1164,"s Empowerment as a Tool"
1165,"against Hunger (Mandaluyong City, Philippines, 2013), p. 12.CEDAW/C/GC/37"
1166,"18-03824"
1167,"24/24"
1168,"account the specific rights and needs of women and girls, including unmarried"
1169,"women and women heads of household, before, during and after disasters."
1170,"VII. Dissemination and reporting"
1171,"79. To effectively prevent and mitigate the impacts of disasters and climate change,"
1172,"States parties and other stakeholders should take measurable and targeted steps to"
1173,"collect, analyse and disseminate information and data concerning the development of"
1174,"strategies, policies and programmes designed to address gender inequalities, reduce"
1175,"disaster risk and increase resilience to the adverse effects of climate change."
1176,"80. Cooperative networks between civil society organizations working in the field"
1177,"of gender equality and those working in humanitarian assistance, disaster risk"
1178,"reduction and climate change should be established and should include national"
1179,"human rights institutions, government agencies at all levels and international"
1180,"organizations."
1181,"81. To ensure that effective monitoring and reporting systems are established,"
1182,"States parties should:"
1183,"(a) Design and institutionalize reliable mechanisms to collect and analyse"
1184,"data and monitor and disseminate findings across all areas relevant to disaster"
1185,"risk reduction, climate change and gender equality;"
1186,"(b) Ensure the participation of women at the subnational, national,"
1187,"regional and international levels in data collection and analysis and the"
1188,"monitoring and dissemination of findings;"
1189,"(c) Include information in their periodic reports to the Committee on the"
1190,"legal frameworks, strategies, budgets and programmes that they have"
1191,"implemented to ensure that the human rights of women are promoted and"
1192,"protected within policies relating to climate change and disaster risk reduction;"
1193,"(d) Translate the present general recommendation into national and local"
1194,"languages, including indigenous and minority languages, and disseminate it"
1195,"widely to all branches of government, civil society, the media, academic"
1196,"institutions and women’s organizations."
