321,"24. Participants in the World Humanitarian Summit, in 2016, called for gender"
322,"equality, the empowerment of women and women’s rights to become pillars of"
323,"humanitarian action, including in disaster preparedness and response. Also in 2016,"
324,"in the New Urban Agenda, the participants in the United Nations Conference on"
325,"Housing and Sustainable Urban Development (Habitat III) recognized the need for"
326,"gender-responsive measures to ensure that urban development was sustainable,"
327,"resilient and contributed to climate change mitigation and adaptation."
328,"IV. General principles of the Convention applicable to disaster"
329,"risk reduction and climate change"
330,"25. Several cross-cutting principles and provisions of the Convention are of crucial"
331,"importance and should serve as guidance in the drafting of legislation, policies, plans"
332,"of action, programmes, budgets and other measures relating to disaster risk reduction"
333,"and climate change."
334,"26. States parties should ensure that all policies, legislation, plans,"
335,"programmes, budgets and other activities relating to disaster risk reduction and"
336,"climate change are gender responsive and grounded in human rights-based"
337,"principles, including the following:"
338,"(a) Equality and non-discrimination, with priority being accorded to the"
339,"most marginalized groups of women and girls, such as those from indigenous,"
340,"racial, ethnic and sexual minority groups, women and girls with disabilities,"
341,"adolescents, older women, unmarried women, women heads of household,"
342,"widows, women and girls living in poverty in both rural and urban settings,"
343,"women in prostitution and internally displaced, stateless, refugee, asylum-"
344,"seeking and migrant women;"
345,"(b) Participation and empowerment, through the adoption of effective"
346,"processes and the allocation of the resources necessary to ensure that diverse"
347,"groups of women have opportunities to participate in every stage of policy"
348,"development, implementation and monitoring at each level of government, at the"
349,"local, national, regional and international levels;"
350,"(c) Accountability and access to justice, which require the provision of"
351,"appropriate and accurate information and mechanisms in order to ensure that"
352,"all women and girls whose rights have been directly and indirectly affected by"
353,"disasters and climate change are provided with adequate and timely remedies."
354,"27. Those three general principles — equality and non-discrimination, participation"
355,"and empowerment, accountability and access to justice — are fundamental toCEDAW/C/GC/37"
356,"18-03824"
357,"8/24"
358,"ensuring that all interventions relating to disaster risk reduction in the context of"
359,"climate change are implemented in accordance with the Convention."
360,"A. Substantive equality and non-discrimination"
361,"28. States parties have obligations under article 2 of the Convention to take targeted"
362,"and specific measures to guarantee equality between women and men, including the"
363,"adoption of participatory and gender-responsive policies, strategies and programmes"
364,"relating to disaster risk reduction and climate change, across all sectors. Article 2"
365,"identifies the specific, core obligations of States parties to ensure substantive equality"
366,"between women and men in all areas covered by the Convention and to take"
367,"legislative, policy-based and other measures to that effect.15 The obligation to take all"
368,"appropriate measures, including with regard to legislation, in all fields, to guarantee"
369,"the full development and advancement of women on a basis of equality with men, is"
370,"further expanded in articles 3 and 24 of the Convention."
371,"29. Intersecting forms of discrimination may limit the access of particular groups"
372,"of women to the information, political power, resources and assets that would help"
373,"them to mitigate the adverse effects of disasters and climate change. In its general"
374,"recommendation No. 28 (2010) on the core obligations of States parties under article"
375,"2 of the Convention, as well as in general recommendation No. 32 (2014) on the"
376,"gender-related dimensions of refugee status, asylum, nationality and statelessness of"
377,"women, general recommendation No. 33 (2015) on women’s access to justice, general"
378,"recommendation No. 34 (2016) on the rights of rural women, general"
379,"recommendation No. 35 (2017) on gender-based violence against women, updating"
380,"general recommendation No. 19, and general recommendation No. 36 (2017) on the"
381,"right of girls and women to education, the Committee reiterated that discrimination"
382,"against women was inextricably linked to other factors that affected their lives."
383,"30. The present general recommendation does not contain an exhaustive list of"
384,"every group of right holders for which respect of their rights must be integrated into"
385,"laws, policies, programmes and strategies on disaster risk reduction and climate"
386,"change. The principles of non-discrimination and substantive equality, which form"
387,"the foundation of the Convention, require that States parties take all measures"
388,"necessary to ensure that direct and indirect discrimination, as well as intersecting"
389,"forms of discrimination, are redressed. Specific measures, including temporary"
390,"special measures, legislation that prohibits intersecting forms of discrimination and"
391,"resource allocation, are necessary to ensure that all women and girls are able to"
392,"participate in the development, implementation and monitoring of policies and plans"
393,"relating to climate change and disasters."
394,"31. As outlined in general recommendation No. 28, States parties have"
395,"obligations to respect, protect and fulfil the principle of non-discrimination"
396,"towards all women, against all forms of discrimination, in all areas, even those"
397,"not explicitly mentioned in the Convention, and to ensure the equal development"
398,"and advancement of women in all areas. To ensure substantive equality between"
399,"women and men in the context of disaster risk reduction and climate change,"
400,"States parties should take specific, targeted and measurable steps:"
401,"(a) To identify and eliminate all forms of discrimination, including"
402,"intersecting forms of discrimination, against women in legislation, policies,"
403,"programmes, plans and other activities relating to disaster risk reduction and"
404,"climate change. Priority should be accorded to addressing discrimination in"
405,"__________________"
406,"15 See general recommendation No. 28 (2010) on the core obligations of States parties under article"
407,"2 of the Convention.CEDAW/C/GC/37"
408,"9/24"
409,"18-03824"
410,"relation to the ownership, access, use, disposal, control, governance and"
411,"inheritance of property, land and natural resources, as well as barriers that"
412,"impede the exercise by women of their full legal capacity and autonomy in areas"
413,"such as freedom of movement and equal access to economic, social and cultural"
414,"rights, including to food, health, work and social protection. Women and girls"
415,"should be empowered through specific policies, programmes and strategies so"
416,"that they are able to exercise their right to seek, receive and impart information"
417,"relating to climate change and disaster risk reduction;"
418,"(b) To create effective mechanisms to guarantee that the rights of women"
419,"and girls are a primary consideration in devising measures relating to disaster"
420,"risk reduction and climate change at the local, national, regional and"
421,"international levels. Measures must be taken to ensure that high-quality"
422,"infrastructure and critical services are available, accessible and culturally"
423,"acceptable for all women and girls on a basis of equality."
424,"B. Participation and empowerment"
425,"32. The participation of diverse groups of women and girls, and the develop ment of"
426,"their leadership capacity, at various levels of government and within local"
427,"communities is essential to ensuring that the prevention of and response to disasters"
428,"and the adverse effects of climate change are effective and incorporate perspectives"
429,"from all sectors of society. Promoting the participation of girls and young women in"
430,"the creation, development, implementation and monitoring of policies and plans"
431,"relating to climate change and disaster risk reduction is essential, because those"
432,"groups are often overlooked, even though they will experience the impacts of those"
433,"phenomena throughout their lifetimes."
434,"33. Women make significant contributions to household, local, national, regional"
435,"and international economies and to environmental management, disaster risk"
436,"reduction and climate change resilience at various levels. At the local level, the"
437,"traditional knowledge held by women in agricultural regions is particularly important"
438,"in that respect, because those women are well positioned to observe changes in the"
439,"environment and respond to them through adaptive practices in crop selection,"
440,"planting, harvesting, land conservation techniques and careful management of water"
441,"resources."
442,"34. The Intergovernmental Panel on Climate Change has noted that most local"
443,"communities develop adaptation practices that could and should be identified and"
444,"followed, in order to tailor effective adaptation and response strategies relating to"
445,"disaster risk reduction and climate change.16 In the Paris Agreement, the Conference"
446,"of the Parties acknowledged that climate change adaptation should be guided by the"
447,"best available science and, as appropriate, by traditional, indigenous and local"
448,"knowledge systems, a view that aligns with the many provisions in the Convention,"
449,"including articles 7, 8 and 14, that provide that States parties should ensure that all"
450,"women are provided with meaningful opportunities to participate in political"
451,"decision-making and development planning."
452,"35. Articles 7 and 8 of the Convention provide that women should have equality in"
453,"political and public life at the local, national and international levels, and article 14"
454,"reiterates that rural women have the right to participate in development planning and"
455,"agricultural reform activities. That guarantee of political equality encompasses"
456,"__________________"
457,"16 Intergovernmental Panel on Climate Change, Climate Change 2007: Synthesis Report–"
458,"Contribution of Working Groups I, II and III to the Fourth Assessment Report of the"
459,"Intergovernmental Panel on Climate Change (Geneva, 2007).CEDAW/C/GC/37"
460,"18-03824"
461,"10/24"
462,"leadership by women and the representation and participation of women, which are"
463,"components that are essential to the development and implementation of effective"
464,"programmes and policies relating to disaster risk reduction and climate chan ge that"
465,"take into account the needs of the population, in particular those of women."
466,"36. To ensure that women and girls are provided with equal opportunities to"
467,"lead and to participate and engage in decision-making in activities relating to"
468,"disaster risk reduction and climate change, the Committee recommends that"
469,"States parties:"
470,"(a) Adopt targeted policies, such as temporary special measures,"
471,"including quotas, as provided for in article 4 of the Convention and in general"
472,"recommendation No. 25 (2004) on temporary special measures, as one element of"
473,"a coordinated and regularly monitored strategy to achieve the equal"
474,"participation of women in all decision-making and development planning"
475,"relating to disaster risk reduction and climate change;17"
476,"(b) Develop programmes to ensure the participation of and leadership by"
477,"women in political life, including through civil society organizations, in"
478,"particular women’s organizations, at various levels, in particular in the context"
479,"of local and community planning and climate change and disaster preparedness,"
480,"response and recovery;"
481,"(c) Ensure the equal representation of women in forums and mechanisms"
482,"on disaster risk reduction and climate change, at the community, local, national,"
483,"regional and international levels, in order to enable them to participate in and"
484,"influence the development of policies, legislation and plans relating to disaster"
485,"risk reduction and climate change and their implementation. States parties"
486,"should also take positive measures to ensure that girls, young women and women"
487,"belonging to indigenous and other marginalized groups are provided with"
488,"opportunities to be represented in those mechanisms;"
489,"(d) Strengthen national institutions concerned with gender-related issues"
490,"and women’s rights, civil society and women’s organizations and provide them"
491,"with adequate resources, skills and authority to lead, advise, monitor and carry"
492,"out strategies to prevent and respond to disasters and mitigate the adverse effects"
493,"of climate change;"
494,"(e) Allocate adequate resources to building the leadership capacity of"
495,"women and creating an enabling environment for strengthening their active role"
496,"in disaster risk reduction and response and climate change mitigation, at all"
497,"levels and across all relevant sectors."
498,"C. Accountability and access to justice"
499,"37. In line with article 15 (1) of the Convention, women should be accorded equality"
500,"before the law, which is extremely important in situations of disaster and in the"
501,"context of climate change, given that women, who often face barriers to gaining"
502,"access to justice, may encounter significant difficulties in claiming compensation and"
503,"other forms of reparation to mitigate their losses and to adapt to climate change. The"
504,"recognition of the legal capacity of women as identical to that of men and equal"
505,"between groups of women, including women with disabilities and indigenous women,"
506,"as well as their equal access to justice, are essential elements of disaster and climate"
507,"change policies and strategies.18"
508,"__________________"
509,"17 See CEDAW/C/TUV/CO/2, paras. 55–56."
510,"18 See also general recommendation No. 33 (2015) on women’s access to justice.CEDAW/C/GC/37"
511,"11/24"
512,"18-03824"
513,"38. States parties should ensure that legal frameworks are non-discriminatory"
514,"and that all women have effective access to justice, in line with general"
515,"recommendation No. 33, including by:"
516,"(a) Conducting a gender impact analysis of current laws, incorporating"
517,"those that are applied in plural legal systems, including customary, traditional"
518,"and religious norms and practices, to assess their effect on women with regard"
519,"to their vulnerability to disaster risk and climate change, and adopt, repeal or"
520,"amend laws, norms and practices accordingly;"
521,"(b) Increasing awareness among women of the available legal remedies"
522,"and dispute resolution mechanisms and their legal literacy, by providing them"
523,"with information on their rights and on policies and programmes relating to"
524,"disaster risk reduction and climate change and empowering them to exercise"
525,"their right to information in that context;"
526,"(c) Ensuring affordable or, if necessary, free access to legal services,"
527,"including legal aid, as well as to official documents such as birth, death and"
528,"marriage certificates and land registration documents and deeds. Reliable and"
529,"low-cost administrative systems should be implemented to make such"
530,"documentation accessible and available to women in situations of disaster so that"
531,"they are able to benefit from such services as relief payments and compensation;"
532,"(d) Dismantling barriers to women’s access to justice by ensuring that"
533,"formal and informal justice mechanisms, including alternative dispute resolution"
534,"mechanisms, are in conformity with the Convention and made available and"
535,"accessible, in order to enable women to claim their rights. Measures to protect"
536,"women from reprisals when claiming their rights should also be developed;"
537,"(e) Minimizing disruptions to legal and justice systems that may result"
538,"from disasters and climate change, by developing response plans that provide for"
539,"the deployment of mobile or specialized reporting mechanisms, investigative"
540,"teams and courts. Flexible and accessible legal and judicial mechanisms are of"
541,"particular importance for women and girls wishing to report incidents of gender-"
542,"based violence."
543,"V. Specific principles of the Convention relevant to disaster"
544,"risk reduction and climate change"
545,"A. Assessment and data collection"
546,"39. The gender-related dimensions of disaster risk reduction and the impacts of"
547,"climate change are often not well understood. Limited technical capacity at the"
548,"national and local levels has resulted in a lack of data disaggregated by sex, age,"
549,"disability, ethnicity and geographical location, which continues to impede the"
550,"development of appropriate and targeted strategies for disaster risk reduction and"
551,"climate change response."
552,"40. States parties should:"
553,"(a) Establish or identify existing national and local mechanisms to collect,"
554,"analyse and manage, and for the application of, data disaggregated by sex, age,"
555,"disability, ethnicity and region. Such data should be made publicly available and"
556,"used to inform gender-responsive national and regional disaster risk reduction"
557,"and climate resilience legislation, policies, programmes and budgets;"
558,"(b) Develop, on the basis of disaggregated data, specific and gender-"
559,"responsive indicators and monitoring mechanisms to enable States parties toCEDAW/C/GC/37"
560,"18-03824"
561,"12/24"
562,"establish baselines and measure progress in areas such as the participation of"
563,"women in initiatives relating to disaster risk reduction and climate change and"
564,"in political, economic and social institutions. Integration with and coordination"
565,"in the implementation of other existing frameworks, such as the United Nations"
566,"Framework Convention on Climate Change, the 2030 Agenda for Sustainable"
567,"Development and the Sendai Framework, are essential to ensuring a consistent"
568,"and effective approach;"
569,"(c) Empower, build the capacity of and provide resources to, if necessary"
570,"through donor support, the national institutions responsible for collecting,"
571,"consolidating and analysing disaggregated data, across all relevant sectors, such"
572,"as economic planning, disaster risk management, planning and monitoring of"
573,"implementation of the Sustainable Development Goals, including at the local"
574,"level;"
575,"(d) Incorporate climate information into disaster planning and decision-"
576,"making at the subnational and national levels by ensuring that diverse groups of"
577,"women are consulted as valuable sources of community knowledge on climate"
578,"change."
579,"B. Policy coherence"
580,"41. It is only recently that concerted efforts have been made to coordinate policies"
581,"on gender equality, disaster risk reduction, climate change and sustainable"
582,"development. While certain policy documents, such as the 2030 Agenda and the"
583,"Sustainable Development Goals, integrate those objectives into their frameworks for"
584,"implementation, much remains to be done at the national, regional and international"
585,"levels to align policies. Programmes of action, budgets and strategies should be"
586,"coordinated across sectors, including trade, development, energy, environment, water,"
587,"climate science, agriculture, education, health and planning, and at levels of"
588,"government, including local and subnational, national, regional and international, in"
589,"order to ensure an effective and human rights-based approach to disaster risk"
590,"reduction and climate change mitigation and adaptation."
591,"42. States parties should:"
592,"(a) Engage in a comprehensive audit of policies and programmes across"
593,"sectors and areas, including climate, trade and investment, environment and"
594,"planning, water, food, agriculture, technology, social protection, education and"
595,"employment, in order to identify the degree of integration of a gender equality"
596,"perspective and any inconsistencies, with a view to reinforcing efforts aimed at"
597,"disaster risk reduction and climate change mitigation and adaptation;"
598,"(b) Improve coordination between sectors, including those involved in"
599,"disaster risk management, climate change, gender equality, health care,"
600,"education, social protection, agriculture, environmental protection and urban"
601,"planning, through such measures as the adoption of integrated national"
602,"strategies and plans relating to disaster risk reduction and climate change that"
603,"explicitly integrate a gender equality perspective into their approaches;"
604,"(c) Undertake gender impact assessments during the design,"
605,"implementation and monitoring phases of plans and policies relating to disaster"
606,"risk reduction and climate change;"
607,"(d) Develop, compile and share practical tools, information and best"
608,"practices and methodologies for the effective integration of a gender equality"
609,"perspective into legislation, policies and programmes in all sectors relevant to"
610,"disaster risk reduction and climate change;CEDAW/C/GC/37"
611,"13/24"
612,"18-03824"
613,"(e) Promote and strengthen the vital role played by subnational"
614,"governments in disaster risk reduction, service provision, emergency response,"
615,"land-use planning and climate change. To that end, adequate budgets should be"
616,"allocated and mechanisms developed to monitor the implementation of"
617,"legislation and policies at the subnational level."
618,"C. Extraterritorial obligations, international cooperation and"
619,"resource allocation"
620,"43. States parties have obligations both within and outside their territories to ensure"
621,"the full implementation of the Convention, including in the areas of disaster risk"
622,"reduction and climate change mitigation and adaptation. Measures such as limiting"
623,"fossil fuel use, reducing transboundary pollution and greenhouse gas emissions and"
624,"promoting the transition to renewable energy sources are regarded as crucial steps in"
625,"mitigating climate change and the negative human rights impacts of the adverse"
626,"effects of climate change and disasters globally. In its resolutions 26/27 and 29/15,"
627,"the Human Rights Council noted that the global nature of climate change called for"
628,"the widest possible cooperation by all countries and their participation in an effective"
629,"and appropriate international response.19"
630,"44. There is currently an insufficient level of resources being dedicated to"
631,"addressing the underlying structural causes of gender inequality that increase the"
632,"exposure of women to disaster risk and the effects of climate change and to"
633,"developing gender-responsive programmes in those areas. Low-income, climate-"
634,"vulnerable countries face particular challenges in developing, implementing and"
635,"monitoring gender-responsive disaster risk reduction and climate change prevention,"
636,"mitigation and adaptation policies and programmes, as well as in promoting access to"
637,"affordable technology, owing to the limited availability of national public financing"
638,"and development assistance."
639,"45. In accordance with the Convention and other international human rights"
640,"instruments, an adequate and effective allocation of financial and technical resources"
641,"for gender-responsive disaster and climate change prevention, mitigation and"
642,"adaptation must be ensured through both national budgets and international"
643,"cooperation. Any steps taken by States parties to prevent, mitigate and respond to"
644,"climate change and disasters within their own jurisdictions or extraterritorially must"
645,"be firmly grounded in the human rights principles of substantive equality and"
646,"non-discrimination, participation and empowerment, accountability and access to"
647,"justice, transparency and the rule of law."
648,"46. States parties, separately and in cooperation with others, should:"
649,"(a) Take effective steps to equitably manage shared natural resources, in"
650,"particular water, and limit carbon emissions, fossil fuel use, deforestation, near-"
651,"surface permafrost degradation, soil degradation and transboundary pollution,"
652,"including the dumping of toxic waste, and all other environmental, technological"
653,"and biological hazards and risks that contribute to climate change and disasters,"
654,"which tend to disproportionately negatively affect women and girls;"
655,"(b) Increase dedicated budget allocations, at the international, regional,"
656,"national and local levels, to respond to gender-specific disaster and climate"
657,"__________________"
