318,"Indigenous women, including those with disabilities, often face the arbitrary removal"
319,"and abduction of their children. They also face discriminatory and gender-biased"
320,"decisions concerning the custody of their children – whether married or unmarried –"
321,"or alimony following divorce. Indigenous women and girls as individuals have the"
322,"right to be free from discrimination and human rights violations throughout their life"
323,"cycle and to choose their own paths and life plans."
324,"18. In its collective dimension, discrimination, together with gender-based violence,"
325,"against Indigenous women and girls threatens and disrupts the spiritual life,"
326,"connection with Mother Earth, cultural integrity and survival, and social fabric of"
327,"Indigenous Peoples and communities. Discrimination and gender-based violence have"
328,"a harmful effect on the continuance and preservation of the knowledge, cultures,"
329,"views, identities and traditions of Indigenous Peoples. The failure to protect the rights"
330,"to self-determination, collective security of tenure over ancestral lands and resources,"
331,"and effective participation and consent of Indigenous women in all matters affecting"
332,"them constitutes discrimination against them and their communities."
333,"19. As indicated in the preamble to the Declaration, collective rights are"
334,"indispensable for the existence, well-being and integral development of Indigenous"
335,"Peoples, including Indigenous women and girls. The individual rights of Indigenous"
336,"women and girls should never be neglected or violated in the pursuit of collective or"
337,"group interests, as respect for both dimensions of their human rights is essential. 17"
338,"20. Discrimination against Indigenous women and girls is perpetuated by gender"
339,"stereotypes but also by forms of racism fuelled by colonialism and militarization."
340,"These underlying causes of discrimination are reflected directly and indirectly in laws"
341,"and policies that impede the access of Indigenous women and girls to land use and"
342,"ownership, the exercise of their rights over their territories, natural and economic"
343,"resources, and their access to credit, financial services and income-generating"
344,"opportunities. The underlying causes also impede the recognition and protection of"
345,"and support for collective and cooperative forms of land ownership and use. Legal"
346,"protections for the land rights of Indigenous women remain weak, which frequently"
347,"exposes them to dispossession, displacement, confinement, expropriation and"
348,"exploitation.18 The lack of legal title to the territories of Indigenous Peoples increases"
349,"their vulnerability to illegal incursions and to the implementation of development"
350,"projects without their free, prior and informed consent by both State and non -State"
351,"actors. Indigenous women and girls – in particular those who are widows, heads of"
352,"households or orphans – disproportionately face barriers in gaining access to land,"
353,"resulting in the loss of their livelihoods and threatening their culture, their intrinsic"
354,"link to their environment, their food and water security and their health."
355,"__________________"
356,"17 Committee on the Rights of the Child, general comment No. 11 (2009) on indigenous children"
357,"and their rights under the Convention, para. 30."
358,"18 A/HRC/30/41, paras. 15–17.CEDAW/C/GC/39"
359,"22-24375"
360,"8/25"
361,"21. Indigenous women and girls worldwide still do not enjoy equality before the"
362,"law under article 15 of the Convention. In many parts of the world, Indigenous women"
363,"lack the capacity to conclude contracts and administer property independent of their"
364,"husband or a male guardian. They also experience challenges in owning, holding,"
365,"controlling, inheriting and administering land, in particular when they are widowed"
366,"and have to care for their families on their own. Inheritance laws – in both the State"
367,"and Indigenous legal systems – frequently discriminate against Indigenous women."
368,"Indigenous women with disabilities commonly experience the denial of legal capacity,"
369,"which leads to further human rights violations, including in the areas of acce ss to"
370,"justice, institutionalized violence and forced sterilization. Contrary to article 9 of the"
371,"Convention, many laws still discriminate against Indigenous women and girls in"
372,"relation to the transmission of their nationality and Indigenous status to their children"
373,"when they marry non-Indigenous persons. These laws can result in transgenerational"
374,"discrimination and forced assimilation, which fall within the scope and meaning of"
375,"discrimination against women as defined in article 1 of the Convention.19 Therefore,"
376,"States must ensure that Indigenous women and girls can acquire, change, retain or"
377,"renounce their nationality and/or Indigenous status, transfer it to their children and"
378,"spouse and have access to information on these rights, as part of ensuring their rights"
379,"to self-determination and self-identification."
380,"22. The Committee, in its general recommendation No. 34 (2016) on the rights of"
381,"rural women, underscored the importance of the rights of Indigenous women to land"
382,"and collective ownership, natural resources, water, seeds, forests and fisheries under"
383,"article 14 of the Convention.20 These rights are also guaranteed to Indigenous women"
384,"as members of their peoples and communities by the Declaration and related"
385,"international legal norms. The key barriers to these rights are the incompatibility of"
386,"national laws with international law; the ineffective implementation of laws at the"
387,"national and local levels; discriminatory gender stereotypes and practices, in"
388,"particular in rural areas; lack of political will; and the commercialization,"
389,"commodification and financialization of land and natural resources. Indigenous"
390,"customary laws, misogyny and existing institutions may also be barriers. Indigenous"
391,"women with disabilities often face intersecting forms of discrimination on the basis"
392,"of their sex; gender; disability; and Indigenous origin, status or identity, reflected in"
393,"the denial of their full legal capacity, which further increases their risk exposure to"
394,"exploitation, violence and abuse and undermines their rights to land, territories and"
395,"resources.21 Moreover, lesbian, bisexual, transgender and intersex Indigenous women"
396,"and girls regularly face intersecting forms of discrimination. The Committee is"
397,"concerned about the forms of inequality, discrimination and gender-based violence"
398,"that affect Indigenous women and girls in the digital space, including the Internet,"
399,"social media and all technology platforms."
400,"23. The Committee recommends that States parties:"
401,"(a) Develop comprehensive policies to eliminate discrimination against"
402,"Indigenous women and girls, centred around the effective participation of those"
403,"living inside and outside Indigenous territories, and pursue collaboration with"
404,"Indigenous Peoples more broadly. The policies should include measures to"
405,"address intersectional discrimination faced by Indigenous women and girls,"
406,"including persons with disabilities and those with albinism; older women; lesbian,"
407,"bisexual, transgender and intersex women; women and girls in situations of"
408,"poverty; women living in rural and urban areas; forcibly displaced, refugee and"
409,"migrant women inside and outside their countries; and women and girls who are"
410,"__________________"
411,"19 See, for example, CEDAW/C/81/D/68/2014, para. 18.3."
412,"20 Para. 56."
413,"21 Department of Economic and Social Affairs, State of the World’s Indigenous Peoples, vol. 5,"
414,"p. 121.CEDAW/C/GC/39"
415,"9/25"
416,"22-24375"
417,"widows, heads of households or orphaned owing to national and international"
418,"armed conflicts. States parties should collect data, disaggregated by age and"
419,"disability status, on the forms of gender-based discrimination and violence faced"
420,"by Indigenous women and girls, and undertake these efforts in ways that respect"
421,"the languages and cultures of Indigenous Peoples;"
422,"(b) Provide, in their periodic reports to the Committee, information on"
423,"legislative, judicial, administrative, budgetary, and monitoring and evaluation"
424,"measures, as well as other measures, specific to Indigenous women and girls;"
425,"(c) Repeal and amend all legislative and policy instruments, such as laws,"
426,"policies, regulations, programmes, administrative procedures, institutional"
427,"structures, budgetary allocations and practices, that directly or indirectly"
428,"discriminate against Indigenous women and girls;"
429,"(d) Ensure that Indigenous women are equal before the law and have"
430,"equal capacity to conclude contracts and administer and inherit property, and"
431,"also ensure the recognition of the legal capacity of Indigenous women with"
432,"disabilities and support mechanisms for the exercise of legal capacity;"
433,"(e) Adopt legislation to fully ensure the rights of Indigenous women and"
434,"girls to land, water and other natural resources, including their right to a clean,"
435,"healthy and sustainable environment, and that their equality before the law is"
436,"recognized and respected, as well as ensuring that Indigenous women in rural"
437,"and urban areas have equal access to ownership, title, possession and control of"
438,"land, water, forests, fisheries, aquaculture and other resources that they have"
439,"owned, occupied or otherwise used or acquired, including by protecting them"
440,"against discrimination and dispossession;22"
441,"(f) Ensure that Indigenous women and girls have adequate access to"
442,"information on existing laws and remedies to claim their rights under the"
443,"Convention. Information should be accessible in their own languages and in"
444,"culturally appropriate formats of communication, such as community radio."
445,"Information should also be made available for Indigenous women and girls with"
446,"disabilities in Braille, easy to read, sign language and other modes;"
447,"(g) Guarantee that Indigenous women and girls are protected from"
448,"discrimination by both State and non-State actors, including businesses and"
449,"companies, inside and outside their territories, especially in the areas of political"
450,"participation, representation, education, employment, health, social protection,"
451,"decent work, justice and security;"
452,"(h) Adopt effective measures to legally recognize and protect the lands,"
453,"territories, natural resources, intellectual property, scientific, technical and"
454,"Indigenous knowledge, genetic information and cultural heritage of Indigenous"
455,"Peoples, and take steps to fully ensure respect for their rights to free, prior and"
456,"informed consent; to self-determination of their own life plan; and to effective"
457,"participation, in particular marginalized groups of Indigenous women and girls,"
458,"such as those with disabilities, in decision-making on matters affecting them;"
459,"(i) Adopt effective measures to eliminate and prevent all forced"
460,"assimilation policies and other patterns of denials of cultural and other rights"
461,"vested in Indigenous Peoples, including the prompt investigation, accountability,"
462,"justice and reparations for past and present assimilation policies and practices"
463,"that significantly compromise Indigenous cultural identity, and establish and"
464,"__________________"
465,"22 General recommendation No. 34, para. 59.CEDAW/C/GC/39"
466,"22-24375"
467,"10/25"
468,"ensure that truth, justice and reconciliation bodies are vested with adequate and"
469,"sufficient resources."
470,"B. Access to justice and plural legal systems"
471,"24. Access to justice for Indigenous women requires a multidisciplinary and holistic"
472,"approach that reflects an understanding that their access is linked to other human"
473,"rights challenges that they face, including racism, racial discrimination and the effects"
474,"of colonialism; sex- and gender-based discrimination; discrimination on the basis of"
475,"socioeconomic status; disability-based discrimination; barriers in gaining access to"
476,"their lands, territories and natural resources; the lack of adequate and culturally"
477,"pertinent health and education services; and disruptions and threats to their spiritual"
478,"lives.23 As indicated by other global human rights mechanisms, Indigenous Peoples"
479,"must have access to justice that is guaranteed both by States and through their"
480,"Indigenous customary and legal systems.24"
481,"25. The Committee reiterates that the right of Indigenous Peoples to maintain their"
482,"own judicial structures and systems is a fundamental component of their rights to"
483,"autonomy and self-determination.25 At the same time, Indigenous justice systems and"
484,"their practices should be consistent with international human rights standards, as"
485,"indicated in the Declaration.26 Accordingly, the Committee considers the Convention"
486,"an important reference for both non-Indigenous and Indigenous justice systems in"
487,"addressing cases related to discrimination against Indigenous women and girls."
488,"26. In its general recommendation No. 33 (2015) on women’s access to justice, the"
489,"Committee recognized six essential components of access. 27 These interrelated"
490,"components – justiciability, availability, accessibility, good quality, provision of"
491,"remedies for victims, and accountability of justice systems – are also applicable in"
492,"the case of Indigenous women and girls, who should be provided with access to justice"
493,"and remedies with a gender perspective, an intersectional perspective, an Indigenous"
494,"women and girls perspective, an intercultural perspective and a multidisciplinary"
495,"perspective, as defined in paragraphs 4 and 5 of the present general recommendation."
496,"27. According to the six essential components, States must ensure that all justice"
497,"systems, both Indigenous and non-Indigenous, act in a timely fashion to offer"
498,"appropriate and effective remedies for Indigenous women and girls who are victims"
499,"and survivors of discrimination and gender-based violence. Doing so entails having"
500,"available interpreters, translators, anthropologists, psychologists, health-care"
501,"professionals, lawyers, cultural mediators with experience, and Indigenous spiritual"
502,"and medicinal authorities, as well as training, incorporating a gender perspective, on"
503,"the realities, cultures and views of Indigenous women and girls. Justice systems"
504,"should also have in place methods to collect evidence that are appropriate and"
505,"compatible with their culture and views. Justice officials should be consistently"
506,"trained on the rights of Indigenous women and girls and the individual and collective"
507,"dimensions of their identity, with the goal of instilling in the officials a substantial"
508,"__________________"
509,"23 See A/HRC/EMRIP/2014/3/Rev.1, paras. 35–42; and Inter-American Commission on Human"
510,"Rights, Indigenous Women and their Human Rights in the Americas (OEA/Ser.L/V/II."
511,"Doc. 44/17, para. 138)."
512,"24 A/HRC/24/50, para. 5."
513,"25 United Nations Declaration on the Rights of Indigenous Peoples, art. 34; and general"
514,"recommendation No. 33 (2015) on women’s access to justice, para. 5."
515,"26 Article 34 of the Declaration provides that Indigenous Peoples have the right to promote,"
516,"develop and maintain their institutional structures and their distinctive customs, spirituality,"
517,"traditions, procedures, practices and, in the cases where they exist, juridical systems or customs,"
518,"in accordance with international human rights standards."
519,"27 Para. 14.CEDAW/C/GC/39"
520,"11/25"
521,"22-24375"
522,"degree of Indigenous cultural competence. In that regard, it is key to respect the"
523,"different conceptions of justice and processes that non-Indigenous and Indigenous"
524,"systems have, and to actively listen to and collaborate with Indigenous Peoples."
525,"Justice can be a process of reconciliation and healing for them, with the go al of"
526,"restoring harmony to their territories and communities. 28 States should also"
527,"proactively recruit and appoint Indigenous women justices."
528,"28. States parties should ensure the establishment, maintenance and funding of"
529,"courts and judicial and other bodies throughout their territories in urban, rural and"
530,"remote areas. Indigenous justice systems should also be easily available, adequate"
531,"and effective. Information on how to avail themselves of judicial avenues in both the"
532,"non-Indigenous and Indigenous justice systems should be available to and"
533,"disseminated among Indigenous women and girls. Basic judicial services and free"
534,"legal aid services should be available in close proximity to Indigenous women and"
535,"communities. States must adopt measures to ensure that Indigenous women know"
536,"where to seek justice and that justice systems are accessible, fair and affordable."
537,"29. Indigenous women face obstacles in their access to both non-Indigenous and"
538,"Indigenous justice systems which can be particularly acute in the case of Indigenous"
539,"women and girls with disabilities. They are routinely denied their right to a legal"
540,"remedy. As a result, many cases of discrimination and gender-based violence against"
541,"Indigenous women and girls end in impunity. The barriers that they encounter in"
542,"gaining access to justice and reparations include a lack of information in Indigenous"
543,"languages on the legal remedies available in both non-Indigenous and Indigenous"
544,"justice systems. Other barriers include the costs of legal assistance and the lack of"
545,"free legal aid; disrespect of due process guarantees; absence of interpreters, including"
546,"for sign language; court fees; long distances to courts; reprisals and retribution against"
547,"those who report crimes; lack of identity cards and forms of identification; and lack"
548,"of training for justice officials on the rights and specific needs of Indigenous women"
549,"and girls. Indigenous women and girls with disabilities frequently face barriers with"
550,"regard to the physical accessibility of buildings that house law enforcement agencies"
551,"and the judiciary, and to the accessibility of critical information, transportation,"
552,"communications, procedures and support services."
553,"30. In non-Indigenous justice systems, Indigenous women and girls frequently face"
554,"racism, structural and systemic racial discrimination, and forms of marginalization,"
555,"and often have to participate in procedures that are not culturally appropriate and do"
556,"not take into account Indigenous traditions and practices. Judicial structures tend to"
557,"reflect ongoing colonialism. Obstacles include the remoteness of Indigenous"
558,"territories, which force Indigenous women and girls to travel long distances to file"
559,"complaints; illiteracy; and lack of knowledge of existing laws and judicial avenues."
560,"Indigenous women are often not provided with the interpretation services that are"
561,"necessary for them to fully participate in legal proceedings, and there is a lack of"
562,"culturally appropriate methods of evidence collection. Among justice officials, there"
563,"is a dearth of training on the rights of Indigenous women and girls in their individual"
564,"and collective dimensions. Indigenous women and girls also have limited access to"
565,"specialized medical care when they suffer acts of rape and sexual violence."
566,"31. Often, Indigenous justice systems are male dominated, and they discriminate"
567,"against women and girls, providing limited space for them to participate, voice their"
568,"concerns and hold decision-making positions.29 The Committee has expressed its"
569,"concern in the past about the influence of gender stereotypes on the activity of"
570,"Indigenous legal systems.30 In general, the Committee has recommended that both"
571,"__________________"
572,"28 A/HRC/42/37, para. 25."
573,"29 A/HRC/30/41, para. 42."
574,"30 CEDAW/C/MEX/CO/7-8, para. 34.CEDAW/C/GC/39"
575,"22-24375"
576,"12/25"
577,"Indigenous and non-Indigenous justice systems adopt measures to comply with"
578,"international human rights standards.31"
579,"32. Indigenous women also tend to be overrepresented in prisons, affected by"
580,"arbitrary pretrial detention and face discrimination, gender-based violence, inhumane"
581,"treatment and forms of torture when they are in conflict with the law. These problems"
582,"are aggravated by deficiencies in the legal support provided by legal aid counsel. The"
583,"Committee highlights the right of every Indigenous girl who is in conflict with the"
584,"law to a fair trial, equality before the law and the equal protection of the law.32"
585,"33. The Committee recommends that States parties:"
586,"(a) Ensure that Indigenous women and girls have effective access to"
587,"adequate non-Indigenous and Indigenous justice systems, free from racial and/or"
588,"gender-based discrimination, bias, stereotypes, retribution and reprisals;"
589,"(b) Adopt measures to ensure that Indigenous women and girls with"
590,"disabilities have physical access to law enforcement and judiciary buildings,"
591,"information, transportation, support services, and procedures critical to their"
592,"access to justice;33"
593,"(c) Provide continuous training to judges and all law enforcement"
594,"officials in both the non-Indigenous and Indigenous justice systems on the rights"
595,"of Indigenous women and girls and the need for an approach to justice that is"
596,"guided by gender, intersectional, Indigenous women and girls, intercultural and"
597,"multidisciplinary perspectives, as defined in paragraphs 4 and 5. Training on"
598,"Indigenous justice should be part of training for all legal professionals;"
599,"(d) Recruit, train and appoint Indigenous women justices and other court"
600,"personnel in both non-Indigenous and Indigenous justice systems;"
601,"(e) Ensure equal access to justice for all Indigenous women and girls,"
602,"including through the provision of procedural accommodations and adjustments"
603,"for those who need them owing to age, disability or illness, which may include"
604,"sign language interpretation and other communication support, as well as longer"
605,"time frames for submissions;"
606,"(f) Ensure that justice systems include interpreters, translators,"
607,"anthropologists, psychologists and health-care professionals specialized and"
608,"trained in the needs of Indigenous women and girls, giving priority to qualified"
609,"Indigenous women,34 and provide information on legal remedies in both the non-"
610,"Indigenous and Indigenous justice systems in Indigenous languages and in"
611,"accessible formats. Awareness-raising campaigns should be undertaken to make"
612,"known these legal remedies and avenues, as well as the means to report cases of"
613,"structural and systemic violence. Follow-up mechanisms are critical in cases of"
614,"gender-based violence and discrimination against Indigenous women and girls;"
615,"(g) Ensure that Indigenous women and girls without sufficient means and"
616,"whose legal capacity has been removed have access to free and quality legal aid,"
617,"including in cases of gender-based violence against women. States parties should"
618,"__________________"
619,"31 General recommendation No. 33, para. 62."
620,"32 Committee on the Rights of the Child, general comment No. 24 (2019) on children’s rights in the"
621,"child justice system, paras. 40, 49 and 103."
622,"33 Committee on the Rights of Persons with Disabilities, general comment No. 2 (2014) on"
623,"accessibility, para. 37."
624,"34 Inter-American Commission on Human Rights, Indigenous Women and their Rights in the"
625,"Americas, para. 156.CEDAW/C/GC/39"
626,"13/25"
627,"22-24375"
628,"financially support non-governmental organizations that provide free and"
629,"specialized legal assistance to Indigenous women and girls;"
630,"(h) Guarantee that judicial institutions, remedies and services are"
631,"available in urban areas and in proximity to Indigenous territories;"
632,"(i) Adopt criminal justice, civil and administrative measures and policies"
633,"that consider the historical conditions of poverty, racism and gender-based"
634,"violence, which have affected and continue to affect Indigenous women and girls;"
635,"(j) Adopt measures to ensure that all Indigenous women and girls have"
636,"access to information and education on existing laws, the legal system and how"
637,"to gain access to both non-Indigenous and Indigenous justice systems. These"
638,"measures can take the form of awareness-raising campaigns, community"
639,"trainings, and legal and mobile clinics that offer this information;"
640,"(k) Ensure that Indigenous women and girls effectively enjoy the rights to"
641,"a fair trial, equality before the law and equal protection of the law;"
642,"(l) Ensure that integral reparations for human rights violations are a key"
