658,"19 In his 2016 report (A/HRC/31/52, footnote 27), the Special Rapporteur on human rights and the"
659,"environment noted that “the failure of States to effectively address climate change through"
660,"international cooperation would prevent individual States from meeting their duties under human"
661,"rights law to protect and fulfil the human rights of those within their own jurisdiction”.CEDAW/C/GC/37"
662,"18-03824"
663,"14/24"
664,"change prevention, preparedness, mitigation, recovery and adaptation needs in"
665,"the infrastructure and service sectors;"
666,"(c) Invest in adaptability by identifying and supporting livelihoods that"
667,"are resilient to disasters and climate change, sustainable and empowering for"
668,"women, and in gender-responsive services that enable women to gain access to"
669,"and benefit from those livelihoods;"
670,"(d) Increase access for women to appropriate risk reduction schemes,"
671,"such as social protection, livelihood diversification and insurance;"
672,"(e) Integrate a gender equality perspective into relevant international,"
673,"regional, national, sectoral and local programmes and projects, including those"
674,"financed with international climate and sustainable development funds;"
675,"(f) Share resources, knowledge and technology to build disaster risk"
676,"reduction and climate change adaptation capacity among women and girls,"
677,"including by providing adequate, effective and transparent financing"
678,"administered through participatory, accountable and non-discriminatory"
679,"processes;"
680,"(g) Ensure that States, international organizations and other entities that"
681,"provide technical and financial resources for disaster risk reduction, sustainable"
682,"development and climate change incorporate a gender equality and women’s"
683,"rights perspective into the design, implementation and monitoring of all"
684,"programmes and establish appropriate and effective human rights"
685,"accountability mechanisms."
686,"D. Non-State actors and extraterritorial obligations"
687,"47. The private sector and civil society organizations can play an important role in"
688,"disaster risk reduction, climate resilience and the promotion of gender equality, at the"
689,"national level and when operating transnationally. The development of public-private"
690,"partnerships is promoted through a number of mechanisms, including in the context"
691,"of the 2030 Agenda. Such partnerships may provide the financial and technical"
692,"resources necessary to enable the creation of new infrastructure for disaster risk"
693,"reduction and climate-resilient livelihoods."
694,"48. In the United Nations Guiding Principles on Business and Human Rights, it is"
695,"stipulated that businesses have a direct responsibility to respect and protect human"
696,"rights, to act with due diligence to prevent human rights violations and to provide"
697,"effective remedies for human rights violations connected to their operations. To"
698,"ensure that private sector activities in the fields of disaster risk reduction and climate"
699,"change respect and protect women’s human rights, they must guarantee accountability"
700,"and be participatory, gender-responsive and subject to regular human rights-based"
701,"monitoring and evaluation."
702,"49. States parties should regulate the activities of non-State actors within their"
703,"jurisdiction, including when they operate extraterritorially. General recommendation"
704,"No. 28 reaffirms the requirement under article 2 (e) to eliminate discrimination by"
705,"any public or private actor, which extends to acts of national corporations operating"
706,"extraterritorially."
707,"50. Civil society organizations operating locally and internationally, sometimes in"
708,"partnership with government authorities and the private sector, also have"
709,"responsibilities to ensure that their activities in the fields of climate change and"
710,"disaster risk reduction and management do no harm to local populations, and thoseCEDAW/C/GC/37"
711,"15/24"
712,"18-03824"
713,"organizations should take steps to minimize the harm that they may inadvertently be"
714,"causing simply by being present and providing assistance.20"
715,"51. In relation to non-State actors, States parties should:"
716,"(a) Create environments conducive to gender-responsive investment in"
717,"disaster and climate change prevention, mitigation and adaptation, including"
718,"through sustainable urban and rural development, the promotion of renewable"
719,"energy and social insurance schemes;"
720,"(b) Encourage entrepreneurship among women and create incentives for"
721,"women to engage in businesses involved in sustainable development and climate-"
722,"resilient livelihood activities in areas such as the clean energy sector and"
723,"agroecological food systems. Businesses working in those areas should also be"
724,"encouraged to increase the number of women whom they employ, in particular"
725,"in leadership positions;"
726,"(c) Conduct gender impact analyses of any proposed public-private"
727,"partnerships in the areas of disaster risk reduction and climate change and"
728,"ensure that diverse groups of women are involved in their design,"
729,"implementation and monitoring. Particular attention should be paid to"
730,"guaranteeing that all groups of women have physical and economic access to any"
731,"infrastructure and services provided through public-private partnerships;"
732,"(d) Adopt regulatory measures to protect women from human rights"
733,"violations by private business actors and ensure that their own activities,"
734,"including those conducted in partnership with the private sector and civil society,"
735,"respect and protect human rights and that effective remedies are available in the"
736,"event of human rights violations relating to the activities of non-State actors."
737,"Such measures should be applied to activities occurring both within and outside"
738,"of the territory the State party concerned."
739,"E. Capacity development and access to technology"
740,"52. A lack of active participation by women in programmes relating to disaster risk"
741,"reduction and climate change, in particular at the local level, impedes progress"
742,"towards the implementation of gender equality commitments and the development of"
743,"coordinated and effective policies and strategies for disaster risk reduction and"
744,"climate resilience. Measures should be taken to build the capacity and capabilities of"
745,"women, women’s rights organizations and State entities to participate in gender-"
746,"responsive disaster risk and climate assessments at the local, national, regional and"
747,"international levels."
748,"53. In its statement on gender and climate change, the Committee noted that policies"
749,"that supported gender equality in access to and use and control of science and"
750,"technology and formal and informal education and training would enhance a nation’s"
751,"capability in the areas of disaster reduction, mitigation and adaptation to climate"
752,"change (A/65/38, part one, annex II). Too often, however, women have been unable"
753,"to gain access to technology, training opportunities and information, owing to gender-"
754,"based inequalities."
755,"54. States parties should:"
756,"(a) Increase the participation of women in the development of plans"
757,"relating to disaster risk reduction and climate change, by supporting their"
758,"technical capacity and providing adequate resources for that purpose;"
759,"__________________"
760,"20 See A/HRC/28/76, paras. 40 (g), 99 and 104.CEDAW/C/GC/37"
761,"18-03824"
762,"16/24"
763,"(b) Institutionalize leadership by women at all levels in disaster"
764,"prevention, preparedness, including the development and dissemination of early"
765,"warning systems, response and recovery and climate change mitigation and"
766,"adaptation;"
767,"(c) Ensure that early warning information is provided using technology"
768,"that is modern, culturally appropriate, accessible and inclusive, taking into"
769,"account the needs of diverse groups of women. In particular, the extension of"
770,"Internet and mobile telephone coverage, as well as other reliable and cost-"
771,"effective communications technology such as radios, and the accessibility of that"
772,"technology for all women, including women belonging to indigenous and"
773,"minority groups, older women and women with disabilities, should be actively"
774,"promoted within the context of programmes relating to disaster risk reduction"
775,"and climate change;"
776,"(d) Ensure that women have access to technology for preventing and"
777,"mitigating the adverse effects of disasters and climate change on crops, livestock,"
778,"homes and businesses and that they can use and economically benefit from"
779,"climate change adaptation and mitigation technology, including that relating to"
780,"renewable energy and sustainable agricultural production;"
781,"(e) Promote the understanding, application and use of the traditional"
782,"knowledge and skills of women in disaster risk reduction and response and"
783,"climate change mitigation and adaptation;"
784,"(f) Promote and facilitate contributions by women to the"
785,"conceptualization, development and use of disaster risk reduction and climate"
786,"science technology."
787,"VI. Specific areas of concern"
788,"A. Right to live free from gender-based violence against women"
789,"and girls"
790,"55. In its general recommendation No. 35, the Committee noted that gender-based"
791,"violence against women was one of the fundamental social, political and economic"
792,"means by which the subordinate position of women with respect to men and their"
793,"stereotyped roles were perpetuated. It also highlighted situations of disaster and the"
794,"degradation and destruction of natural resources as factors that affected and"
795,"exacerbated gender-based violence against women and girls."
796,"56. The Committee has also observed that sexual violence is common in"
797,"humanitarian crises and may become acute in the wake of a national disaster. In a"
798,"time of heightened stress, lawlessness and homelessness, women face an increased"
799,"threat of violence (A/65/38, part two, annex II, para. 6).21"
800,"57. In accordance with the Convention and general recommendation No. 35,"
801,"States parties should:"
802,"(a) Develop policies and programmes to address existing and new risk"
803,"factors for gender-based violence against women, including domestic violence,"
804,"sexual violence, economic violence, trafficking in persons and forced marriage,"
805,"__________________"
806,"21 See also general commendation No. 19 (1992) on violence against women and general"
807,"recommendation No. 35 (2017) on gender-based violence against women, updating general"
808,"commendation No. 19, para. 14.CEDAW/C/GC/37"
809,"17/24"
810,"18-03824"
811,"in the context of disaster risk reduction and climate change, and promote the"
812,"participation and leadership of women in their development;"
813,"(b) Ensure that the minimum legal age of marriage is 18 years for both"
814,"women and men. States parties should include training on the prevalence of early"
815,"and forced marriage for all personnel involved in disaster response activities. In"
816,"partnership with women’s associations and other stakeholders, mechanisms"
817,"should be established, within local and regional disaster management plans, to"
818,"prevent, monitor and address early and forced marriages;"
819,"(c) Provide accessible, confidential, supportive and effective mechanisms"
820,"for all women wishing to report gender-based violence;"
821,"(d) Develop, in partnership with a wide range of stakeholders, including"
822,"women’s associations, a system for the regular monitoring and evaluation of"
823,"interventions designed to prevent and respond to gender-based violence against"
824,"women, within programmes relating to disaster risk reduction and climate"
825,"change;"
826,"(e) Provide training, sensitization and awareness-raising for the"
827,"authorities, emergency services workers and other groups on the various forms"
828,"of gender-based violence that are prevalent in situations of disaster and how to"
829,"prevent and address them. The training should include information on the rights"
830,"and needs of women and girls, including those from indigenous and minority"
831,"groups, women and girls with disabilities, lesbian, bisexual and transgender"
832,"women and girls and intersex persons, and the ways in which they may be"
833,"exposed to and affected by gender-based violence;"
834,"(f) Adopt long-term policies and strategies to address the root causes of"
835,"gender-based violence against women in situations of disaster, including by"
836,"engaging with men and boys, the media, traditional and religious leaders and"
837,"educational institutions, in order to identify and eliminate social and cultural"
838,"stereotypes concerning the status of women."
839,"B. Rights to education and to information"
840,"58. Article 10 of the Convention concerns the elimination of discrimination in"
841,"education.22 Education improves the capacity of women to participate within their"
842,"households, families, communities and businesses and to identify the means to reduce"
843,"disaster risk, mitigate climate change, develop more effective recovery strategies and"
844,"thus build more resilient communities. Education also increases access to"
845,"opportunities, resources, technology and information that aids in disaster risk"
846,"reduction and the development of effective policies relating to climate change. The"
847,"prevention and mitigation of disasters and climate change require well-trained women"
848,"and men in disciplines including economics, agriculture, water resources"
849,"management, climatology, engineering, law, telecommunications and emergency"
850,"services."
851,"59. In the aftermath of disasters, girls and women, whose access to education is"
852,"often already limited as a result of social, cultural and economic barriers, may face"
853,"even greater obstacles to participation in education, owing to the destruction of"
854,"infrastructure, lack of teachers and other resources, economic hardship and security"
855,"concerns."
856,"__________________"
857,"22 See general recommendation No. 36 (2017) on the right of girls and women to education.CEDAW/C/GC/37"
858,"18-03824"
859,"18/24"
860,"60. In accordance with article 10 of the Convention and general"
861,"recommendation No. 36, States parties should:"
862,"(a) Ensure, through regular inspections, that educational infrastructure"
863,"is safe and resilient enough to withstand disasters and that adequate resources"
864,"are dedicated to the protection of students and educators from the impacts of"
865,"climate change and disasters;"
866,"(b) Allocate adequate resources and budgets so that schools and other"
867,"educational facilities are built to withstand hazards, reconstructed on the basis"
868,"of sound disaster risk assessment and building codes and rendered operational"
869,"as expeditiously as possible following disasters. The reintegration of girls and"
870,"other groups for which education has not traditionally been valued should be"
871,"prioritized through specific outreach programmes, with a view to ensuring that"
872,"girls and women are not excluded from education in the wake of disasters;"
873,"(c) Ensure that women and girls have equal access to information,"
874,"including scientific research, and education regarding disasters and climate"
875,"change. That information should form part of the core educational curricula at"
876,"each level of instruction;"
877,"(d) Prioritize innovative and flexible gender-responsive educational"
878,"programmes, including at the community level, to enable women to develop the"
879,"skills required to adapt to the changing climate and engage in sustainable"
880,"development initiatives. Specific programmes and scholarships should be"
881,"established to support girls and women in undertaking education and training"
882,"in all areas relating to disaster risk reduction and management and"
883,"environmental and climate science."
884,"C. Rights to work and to social protection"
885,"61. Disasters and climate change directly affect women, in particular those living in"
886,"poverty, by having an impact on their livelihoods. Economic inequalities between"
887,"women and men are entrenched and reinforced through discrimination, including"
888,"restrictions on ownership and control of land and property, unequal remuneration, the"
889,"concentration of women in precarious, informal and unstable employment, sexual"
890,"harassment and other forms of workplace violence, pregnancy-related discrimination"
891,"in employment, gendered divisions of household labour and the undervaluing of the"
892,"contributions of women in domestic, community and care work, as well as workplace"
893,"discrimination including labour and sexual exploitation, land grabs and"
894,"environmental destruction by abusive extractive industries and due to unregulated"
895,"industrial and/or agro-industrial activities. All such gender-based discrimination"
896,"limits the capacity of women to prevent and adapt to the harm generated by disasters"
897,"and climate change."
898,"62. The burden of caregiving and domestic work often increases for women"
899,"following disasters. The destruction of food stocks, housing and infrastructure such"
900,"as water and energy supplies and an absence of social protection systems and health-"
901,"care services all have specific consequences for women and girls. The result of such"
902,"gendered inequalities is the increased vulnerability and mortality levels among"
903,"women and girls, and they are frequently left with less time to engage in economic"
904,"activities or to gain access to the resources, including information and education,"
905,"necessary for recovery and adaptation.23"
906,"__________________"
907,"23 See, for example, A/55/38, para. 339.CEDAW/C/GC/37"
908,"19/24"
909,"18-03824"
910,"63. Social and legal inequalities further restrict the ability of women to mo ve to"
911,"safer, less disaster-prone areas and may limit women’s rights to access to financial"
912,"services, credit, social security benefits and secure tenure of land and other productive"
913,"resources.24"
914,"64. States parties should:"
915,"(a) Invest in gender-responsive social protection systems and social"
916,"services that reduce economic inequalities between women and men and enable"
917,"women to mitigate disaster risk and adapt to the adverse effects of climate"
918,"change. Eligibility criteria for social protection schemes should be closely"
919,"monitored to ensure that they are accessible to all groups of women, including"
920,"women heads of household, unmarried women, internally displaced, migrant and"
921,"refugee women and women with disabilities;"
922,"(b) Ensure the resilience to disasters of workplaces and critical"
923,"infrastructure, including nuclear reactors and plants, through regular"
924,"inspections and the adoption of building safety codes and other systems to"
925,"guarantee that such infrastructure, in particular that which is necessary for"
926,"income-generating and domestic activities, is rendered operational as"
927,"expeditiously as possible following disasters;"
928,"(c) Guarantee women’s equal right to decent and sustainable employment"
929,"opportunities, as provided for in article 11 of the Convention, and apply that"
930,"right in the context of disaster prevention, management and recovery and in"
931,"connection with climate change adaptation in both urban and rural areas;"
932,"(d) Facilitate equal access for women to markets, financial services, credit"
933,"and insurance schemes and regulate the informal economy to ensure that women"
934,"are able to claim pensions and other employment-related social security"
935,"entitlements;"
936,"(e) Acknowledge and address the unequal burden of the unpaid and care"
937,"work performed by women, including within disaster and climate policies."
938,"Policies and programmes should be developed to assess, reduce and redistribute"
939,"the gendered burden of care tasks, such as awareness-raising programmes on the"
940,"equal sharing of domestic work and unpaid care work, the introduction of time-"
941,"saving measures and the inclusion of appropriate technology, services and"
942,"infrastructure;"
943,"(f) Protect and promote women’s right to access to training in non-"
944,"traditional areas of work, including within the green economy, and sustainable"
945,"livelihoods, which would enable them to design, participate in, manage and"
946,"monitor disaster and climate change prevention, preparedness, mitigation and"
947,"adaptation initiatives and better equip them to benefit from such interventions."
948,"D. Right to health"
949,"65. Under article 12 of the Convention, States parties are to guarantee substantive"
950,"equality between women and men in the provision of health-care services, including"
951,"sexual and reproductive health services and mental and psychological health services."
952,"The measures that States parties must take, under article 12, in order to respect,"
953,"protect and fulfil the right to health for all women are detailed in the Committee ’s"
954,"general recommendation No. 24 (1999) on women and health. Health services and"
955,"__________________"
956,"24 See general recommendation No. 29 (2013) on the economic consequences of marriage, family"
957,"relations and their dissolution and general recommendation No. 34 (2016) on the rights of rural"
958,"women.CEDAW/C/GC/37"
959,"18-03824"
960,"20/24"
961,"systems, including sexual and reproductive health services, should be available,"
962,"accessible, acceptable and of good quality, even in the context of disasters. 25 To that"
963,"end, measures should be taken to ensure that gender-responsive climate change and"
964,"disaster resilience policies, budgets and monitoring activities are fully integrated into"
965,"health services and systems.26"
966,"66. Climate change and disasters, including pandemics, influence the prevalence,"
967,"distribution and severity of new and re-emerging diseases. The susceptibility of"
968,"women and girls to disease is heightened as a result of inequalities in access to food,"
969,"nutrition and health care and the social expectations that women will act as primary"
970,"caregivers for children, older persons and the sick."
971,"67. States parties should ensure that detailed policies and budget allocations are"
972,"made to promote, protect and fulfil women’s right to health, including sexual and"
973,"reproductive health and comprehensive, age-appropriate sexuality education, mental"
974,"and psychological health, hygiene and sanitation. Provisions for antenatal and"
975,"postnatal care, such as emergency obstetric care and support for breastfeeding, should"
976,"form part of strategies, plans and programmes relating to climate change and"
977,"disasters."
978,"68. In particular, States parties should:"
979,"(a) Ensure participation, including in decision-making positions, by"
980,"diverse groups of women and girls in the planning, implementation and"
981,"monitoring of health policies and programmes and in the design and"
982,"management of integrated health services for women in the context of disaster"
983,"risk management and climate change;"
984,"(b) Invest in climate- and disaster-resilient health systems and services"
985,"and allocate the maximum of their available resources to the underlying"
986,"determinants of health, such as clean water, adequate nutrition and sanitation"
987,"facilities and menstrual hygiene management. Those investments should be"
988,"geared towards transforming health systems so that they are responsive to the"
989,"changing health-care needs arising from climate change and disasters and"
990,"sufficiently resilient to cope with those new demands;"
991,"(c) Ensure the removal of all barriers to access for women and girls to"
992,"health services, education and information, including in the areas of mental and"
993,"psychological health, oncological treatment and sexual and reproductive health,"
994,"and, in particular, allocate resources for cancer screening, mental health and"
995,"counselling programmes and programmes for the prevention and treatment of"
996,"sexually transmitted infections, including HIV, and treatment for AIDS, before,"
997,"during and after disasters;"
998,"(d) Accord priority to the provision of family-planning and sexual and"
999,"reproductive health information and services, within disaster preparedness and"
1000,"response programmes, including access to emergency contraception, post-"
1001,"exposure prophylaxis for HIV, treatment for AIDS and safe abortion, and reduce"
1002,"maternal mortality rates through safe motherhood services, the provision of"
1003,"qualified midwives and prenatal assistance;"
1004,"(e) Monitor the provision of health services to women by public, non-"
1005,"governmental and private organizations, to ensure equal access to and quality of"
1006,"__________________"
1007,"25 WHO, “Gender inequities in environmental health”, EUR/5067874/151 (2008)."
1008,"26 Intergovernmental Panel on Climate Change, Climate Change 2014: Impacts, Adaptation, and"
