597,"52. The Committee recommends that the States parties set and implement time limits for the"
598,"period between the commission of the offence and the completion of the police investigation, the"
599,"decision of the prosecutor (or other competent body) to bring charges against the child, and the"
600,"final adjudication and decision by the court or other competent judicial body. These time limits"
601,"should be much shorter than those set for adults. But at the same time, decisions without delay"
602,"should be the result of a process in which the human rights of the child and legal safeguards are"
603,"fully respected. In this decision-making process without delay, the legal or other appropriate"
604,"assistance must be present. This presence should not be limited to the trial before the court or"
605,"other judicial body, but also applies to all other stages of the process, beginning with the"
606,"interviewing (interrogation) of the child by the police."
607,"53. Parents or legal guardians should also be present at the proceedings because they can"
608,"provide general psychological and emotional assistance to the child. The presence of parents"
609,"does not mean that parents can act in defence of the child or be involved in the decision-making"
610,"process. However, the judge or competent authority may decide, at the request of the child or of"
611,"his/her legal or other appropriate assistance or because it is not in the best interests of the child"
612,"(art. 3 of CRC), to limit, restrict or exclude the presence of the parents from the proceedings."
613,"54. The Committee recommends that States parties explicitly provide by law for the maximum"
614,"possible involvement of parents or legal guardians in the proceedings against the child. This"
615,"involvement shall in general contribute to an effective response to the child’s infringement of the"
616,"penal law. To promote parental involvement, parents must be notified of the apprehension of"
617,"their child as soon as possible."
618,"55. At the same time, the Committee regrets the trend in some countries to introduce the"
619,"punishment of parents for the offences committed by their children. Civil liability for the damage"
620,"caused by the child’s act can, in some limited cases, be appropriate, in particular for the younger"
621,"children (e.g. below 16 years of age). But criminalizing parents of children in conflict with the"
622,"law will most likely not contribute to their becoming active partners in the social reintegration of"
623,"their child."
624,"Freedom from compulsory self-incrimination (art. 40 (2) (b) (iii))"
625,"56. In line with article 14 (3) (g) of ICCPR, CRC requires that a child be not compelled to give"
626,"testimony or to confess or acknowledge guilt. This means in the first place - and self-evidently -"
627,"that torture, cruel, inhuman or degrading treatment in order to extract an admission or a"
628,"confession constitutes a grave violation of the rights of the child (art. 37 (a) of CRC) and is"
629,"wholly unacceptable. No such admission or confession can be admissible as evidence (article 15"
630,"of the Convention against Torture and Other Cruel, Inhuman or Degrading Treatment or"
631,"Punishment)."
632,"CRC/C/GC/10"
633,"page 17"
634,"57. There are many other less violent ways to coerce or to lead the child to a confession or a"
635,"self-incriminatory testimony. The term “compelled” should be interpreted in a broad manner and"
636,"not be limited to physical force or other clear violations of human rights. The age of the child,"
637,"the child’s development, the length of the interrogation, the child’s lack of understanding, the"
638,"fear of unknown consequences or of a suggested possibility of imprisonment may lead him/her"
639,"to a confession that is not true. That may become even more likely if rewards are promised such"
640,"as: “You can go home as soon as you have given us the true story”, or lighter sanctions or release"
641,"are promised."
642,"58. The child being questioned must have access to a legal or other appropriate representative,"
643,"and must be able to request the presence of his/her parent(s) during questioning. There must be"
644,"independent scrutiny of the methods of interrogation to ensure that the evidence is voluntary and"
645,"not coerced, given the totality of the circumstances, and is reliable. The court or other judicial"
646,"body, when considering the voluntary nature and reliability of an admission or confession by a"
647,"child, must take into account the age of the child, the length of custody and interrogation, and the"
648,"presence of legal or other counsel, parent(s), or independent representatives of the child. Police"
649,"officers and other investigating authorities should be well trained to avoid interrogation"
650,"techniques and practices that result in coerced or unreliable confessions or testimonies."
651,"Presence and examination of witnesses (art. 40 (2) (b) (iv))"
652,"59. The guarantee in article 40 (2) (b) (iv) of CRC underscores that the principle of equality of"
653,"arms (i.e. under conditions of equality or parity between defence and prosecution) should be"
654,"observed in the administration of juvenile justice. The term “to examine or to have examined”"
655,"refers to the fact that there are distinctions in the legal systems, particularly between the"
656,"accusatorial and inquisitorial trials. In the latter, the defendant is often allowed to examine"
657,"witnesses although he/she rarely uses this right, leaving examination of the witnesses to the"
658,"lawyer or, in the case of children, to another appropriate body. However, it remains important"
659,"that the lawyer or other representative informs the child of the possibility to examine witnesses"
660,"and to allow him/her to express his/her views in that regard, views which should be given due"
661,"weight in accordance with the age and maturity of the child (art. 12)."
662,"The right to appeal (art. 40 (2) (b) (v))"
663,"60. The child has the right to appeal against the decision by which he is found guilty of the"
664,"charge(s) brought against him/her and against the measures imposed as a consequence of this"
665,"guilty verdict. This appeal should be decided by a higher, competent, independent and impartial"
666,"authority or judicial body, in other words, a body that meets the same standards and requirements"
667,"as the one that dealt with the case in the first instance. This guarantee is similar to the one"
668,"expressed in article 14 (5) of ICCPR. This right of appeal is not limited to the most serious"
669,"offences."
670,"61. This seems to be the reason why quite a few States parties have made reservations"
671,"regarding this provision in order to limit this right of appeal by the child to the more serious"
672,"offences and/or imprisonment sentences. The Committee reminds States parties to the ICCPR"
673,"CRC/C/GC/10"
674,"page 18"
675,"that a similar provision is made in article 14 (5) of the Covenant. In the light of article 41 of"
676,"CRC, it means that this article should provide every adjudicated child with the right to appeal."
677,"The Committee recommends that the States parties withdraw their reservations to the provision"
678,"in article 40 (2) (b) (v)."
679,"Free assistance of an interpreter (art. 40 (2) (vi))"
680,"62. If a child cannot understand or speak the language used by the juvenile justice system,"
681,"he/she has the right to get free assistance of an interpreter. This assistance should not be limited"
682,"to the court trial but should also be available at all stages of the juvenile justice process. It is also"
683,"important that the interpreter has been trained to work with children, because the use and"
684,"understanding of their mother tongue might be different from that of adults. Lack of knowledge"
685,"and/or experience in that regard may impede the child’s full understanding of the questions"
686,"raised, and interfere with the right to a fair trial and to effective participation. The condition"
687,"starting with “if”, “if the child cannot understand or speak the language used”, means that a child"
688,"of a foreign or ethnic origin for example, who - besides his/her mother tongue - understands and"
689,"speaks the official language, does not have to be provided with the free assistance of an"
690,"interpreter."
691,"63. The Committee also wishes to draw the attention of States parties to children with speech"
692,"impairment or other disabilities. In line with the spirit of article 40 (2) (vi), and in accordance"
693,"with the special protection measures provided to children with disabilities in article 23, the"
694,"Committee recommends that States parties ensure that children with speech impairment or other"
695,"disabilities are provided with adequate and effective assistance by well-trained professionals,"
696,"e.g. in sign language, in case they are subject to the juvenile justice process (see also in this"
697,"regard general comment No. 9 (The rights of children with disabilities) of the Committee on the"
698,"Rights of the Child."
699,"Full respect of privacy (arts. 16 and 40 (2) (b) (vii))"
700,"64. The right of a child to have his/her privacy fully respected during all stages of the"
701,"proceedings reflects the right to protection of privacy enshrined in article 16 of CRC. “All stages"
702,"of the proceedings” includes from the initial contact with law enforcement (e.g. a request for"
703,"information and identification) up until the final decision by a competent authority, or release"
704,"from supervision, custody or deprivation of liberty. In this particular context, it is meant to avoid"
705,"harm caused by undue publicity or by the process of labelling. No information shall be published"
706,"that may lead to the identification of a child offender because of its effect of stigmatization, and"
707,"possible impact on his/her ability to have access to education, work, housing or to be safe. It"
708,"means that a public authority should be very reluctant with press releases related to offences"
709,"allegedly committed by children and limit them to very exceptional cases. They must take"
710,"measures to guarantee that children are not identifiable via these press releases. Journalists who"
711,"violate the right to privacy of a child in conflict with the law should be sanctioned with"
712,"disciplinary and when necessary (e.g. in case of recidivism) with penal law sanctions."
713,"65. In order to protect the privacy of the child, most States parties have as a rule - sometimes"
714,"with the possibility of exceptions - that the court or other hearings of a child accused of an"
715,"CRC/C/GC/10"
716,"page 19"
717,"infringement of the penal law should take place behind closed doors. This rule allows for the"
718,"presence of experts or other professionals with a special permission of the court. Public hearings"
719,"in juvenile justice should only be possible in well-defined cases and at the written decision of the"
720,"court. Such a decision should be open for appeal by the child."
721,"66. The Committee recommends that all States parties introduce the rule that court and other"
722,"hearings of a child in conflict with the law be conducted behind closed doors. Exceptions to this"
723,"rule should be very limited and clearly stated in the law. The verdict/sentence should be"
724,"pronounced in public at a court session in such a way that the identity of the child is not"
725,"revealed. The right to privacy (art. 16) requires all professionals involved in the implementation"
726,"of the measures taken by the court or another competent authority to keep all information that"
727,"may result in the identification of the child confidential in all their external contacts."
728,"Furthermore, the right to privacy also means that the records of child offenders should be kept"
729,"strictly confidential and closed to third parties except for those directly involved in the"
730,"investigation and adjudication of, and the ruling on, the case. With a view to avoiding"
731,"stigmatization and/or prejudgements, records of child offenders should not be used in adult"
732,"proceedings in subsequent cases involving the same offender (see the Beijing Rules, rules 21.1"
733,"and 21.2), or to enhance such future sentencing."
734,"67. The Committee also recommends that the States parties introduce rules which would allow"
735,"for an automatic removal from the criminal records of the name of the child who committed an"
736,"offence upon reaching the age of 18, or for certain limited, serious offences where removal is"
737,"possible at the request of the child, if necessary under certain conditions (e.g. not having"
738,"committed an offence within two years after the last conviction)."
739,"E. Measures (see also chapter IV, section B, above)"
740,"Pretrial alternatives"
741,"68. The decision to initiate a formal criminal law procedure does not necessarily mean that this"
742,"procedure must be completed with a formal court sentence for a child. In line with the"
743,"observations made above in section B, the Committee wishes to emphasize that the competent"
744,"authorities - in most States the office of the public prosecutor - should continuously explore the"
745,"possibilities of alternatives to a court conviction. In other words, efforts to achieve an"
746,"appropriate conclusion of the case by offering measures like the ones mentioned above in"
747,"section B should continue. The nature and duration of these measures offered by the prosecution"
748,"may be more demanding, and legal or other appropriate assistance for the child is then necessary."
749,"The performance of such a measure should be presented to the child as a way to suspend the"
750,"formal criminal/juvenile law procedure, which will be terminated if the measure has been carried"
751,"out in a satisfactory manner."
752,"69. In this process of offering alternatives to a court conviction at the level of the prosecutor,"
753,"the child’s human rights and legal safeguards should be fully respected. In this regard, the"
754,"Committee refers to the recommendations set out in paragraph 27 above, which equally apply"
755,"here."
756,"CRC/C/GC/10"
757,"page 20"
758,"Dispositions by the juvenile court/judge"
759,"70. After a fair and just trial in full compliance with article 40 of CRC (see chapter IV,"
760,"section D, above), a decision is made regarding the measures which should be imposed on the"
761,"child found guilty of the alleged offence(s). The laws must provide the court/judge, or other"
762,"competent, independent and impartial authority or judicial body, with a wide variety of possible"
763,"alternatives to institutional care and deprivation of liberty, which are listed in a non-exhaustive"
764,"manner in article 40 (4) of CRC, to assure that deprivation of liberty be used only as a measure"
765,"of last resort and for the shortest possible period of time (art. 37 (b) of CRC)."
766,"71. The Committee wishes to emphasize that the reaction to an offence should always be in"
767,"proportion not only to the circumstances and the gravity of the offence, but also to the age, lesser"
768,"culpability, circumstances and needs of the child, as well as to the various and particularly"
769,"long-term needs of the society. A strictly punitive approach is not in accordance with the leading"
770,"principles for juvenile justice spelled out in article 40 (1) of CRC (see paragraphs 5-14 above)."
771,"The Committee reiterates that corporal punishment as a sanction is a violation of these principles"
772,"as well as of article 37 which prohibits all forms of cruel, inhuman and degrading treatment or"
773,"punishment (see also the Committee’s general comment No. 8 (2006) (The right of the child to"
774,"protection from corporal punishment and other cruel or degrading forms of punishment)). In"
775,"cases of severe offences by children, measures proportionate to the circumstances of the offender"
776,"and to the gravity of the offence may be considered, including considerations of the need of"
777,"public safety and sanctions. In the case of children, such considerations must always be"
778,"outweighed by the need to safeguard the well-being and the best interests of the child and to"
779,"promote his/her reintegration."
780,"72. The Committee notes that if a penal disposition is linked to the age of a child, and there is"
781,"conflicting, inconclusive or uncertain evidence of the child’s age, he/she shall have the right to"
782,"the rule of the benefit of the doubt (see also paragraphs 35 and 39 above)."
783,"73. As far as alternatives to deprivation of liberty/institutional care are concerned, there is a"
784,"wide range of experience with the use and implementation of such measures. States parties"
785,"should benefit from this experience, and develop and implement these alternatives by adjusting"
786,"them to their own culture and tradition. It goes without saying that measures amounting to forced"
787,"labour or to torture or inhuman and degrading treatment must be explicitly prohibited, and those"
788,"responsible for such illegal practices should be brought to justice."
789,"74. After these general remarks, the Committee wishes to draw attention to the measures"
790,"prohibited under article 37 (a) of CRC, and to deprivation of liberty."
791,"Prohibition of the death penalty"
792,"75. Article 37 (a) of CRC reaffirms the internationally accepted standard (see for example"
793,"article 6 (5) of ICCPR) that the death penalty cannot be imposed for a crime committed by a"
794,"person who at that time was under 18 years of age. Although the text is clear, there are States"
795,"parties that assume that the rule only prohibits the execution of persons below the age of"
796,"18 years. However, under this rule the explicit and decisive criteria is the age at the time of the"
797,"CRC/C/GC/10"
798,"page 21"
799,"commission of the offence. It means that a death penalty may not be imposed for a crime"
800,"committed by a person under 18 regardless of his/her age at the time of the trial or sentencing or"
801,"of the execution of the sanction."
802,"76. The Committee recommends the few States parties that have not done so yet to abolish the"
803,"death penalty for all offences committed by persons below the age of 18 years and to suspend the"
804,"execution of all death sentences for those persons till the necessary legislative measures"
805,"abolishing the death penalty for children have been fully enacted. The imposed death penalty"
806,"should be changed to a sanction that is in full conformity with CRC."
807,"No life imprisonment without parole"
808,"77. No child who was under the age of 18 at the time he or she committed an offence should"
809,"be sentenced to life without the possibility of release or parole. For all sentences imposed upon"
810,"children the possibility of release should be realistic and regularly considered. In this regard, the"
811,"Committee refers to article 25 of CRC providing the right to periodic review for all children"
812,"placed for the purpose of care, protection or treatment. The Committee reminds the States parties"
813,"which do sentence children to life imprisonment with the possibility of release or parole that this"
814,"sanction must fully comply with and strive for the realization of the aims of juvenile justice"
815,"enshrined in article 40 (1) of CRC. This means inter alia that the child sentenced to this"
816,"imprisonment should receive education, treatment, and care aiming at his/her release,"
817,"reintegration and ability to assume a constructive role in society. This also requires a regular"
818,"review of the child’s development and progress in order to decide on his/her possible release."
819,"Given the likelihood that a life imprisonment of a child will make it very difficult, if not"
820,"impossible, to achieve the aims of juvenile justice despite the possibility of release, the"
821,"Committee strongly recommends the States parties to abolish all forms of life imprisonment for"
822,"offences committed by persons under the age of 18."
823,"F. Deprivation of liberty, including pretrial detention and post-trial incarceration"
824,"78. Article 37 of CRC contains the leading principles for the use of deprivation of liberty, the"
825,"procedural rights of every child deprived of liberty, and provisions concerning the treatment of"
826,"and conditions for children deprived of their liberty."
827,"Basic principles"
828,"79. The leading principles for the use of deprivation of liberty are: (a) the arrest, detention or"
829,"imprisonment of a child shall be in conformity with the law and shall be used only as a measure"
830,"of last resort and for the shortest appropriate period of time; and (b) no child shall be deprived of"
831,"his/her liberty unlawfully or arbitrarily."
832,"80. The Committee notes with concern that, in many countries, children languish in pretrial"
833,"detention for months or even years, which constitutes a grave violation of article 37 (b) of CRC."
834,"An effective package of alternatives must be available (see chapter IV, section B, above), for the"
835,"States parties to realize their obligation under article 37 (b) of CRC to use deprivation of liberty"
836,"only as a measure of last resort. The use of these alternatives must be carefully structured to"
837,"reduce the use of pretrial detention as well, rather than “widening the net” of sanctioned children."
838,"In addition, the States parties should take adequate legislative and other measures to reduce the"
839,"CRC/C/GC/10"
840,"page 22"
841,"use of pretrial detention. Use of pretrial detention as a punishment violates the presumption of"
842,"innocence. The law should clearly state the conditions that are required to determine whether to"
843,"place or keep a child in pretrial detention, in particular to ensure his/her appearance at the court"
844,"proceedings, and whether he/she is an immediate danger to himself/herself or others. The"
845,"duration of pretrial detention should be limited by law and be subject to regular review."
846,"81. The Committee recommends that the State parties ensure that a child can be released from"
847,"pretrial detention as soon as possible, and if necessary under certain conditions. Decisions"
848,"regarding pretrial detention, including its duration, should be made by a competent, independent"
849,"and impartial authority or a judicial body, and the child should be provided with legal or other"
850,"appropriate assistance."
851,"Procedural rights (art. 37 (d))"
852,"82. Every child deprived of his/her liberty has the right to prompt access to legal and other"
853,"appropriate assistance, as well as the right to challenge the legality of the deprivation of his/her"
854,"liberty before a court or other competent, independent and impartial authority, and to a prompt"
855,"decision on any such action."
856,"83. Every child arrested and deprived of his/her liberty should be brought before a competent"
857,"authority to examine the legality of (the continuation of) this deprivation of liberty within"
858,"24 hours. The Committee also recommends that the States parties ensure by strict legal"
859,"provisions that the legality of a pretrial detention is reviewed regularly, preferably every two"
860,"weeks. In case a conditional release of the child, e.g. by applying alternative measures, is not"
861,"possible, the child should be formally charged with the alleged offences and be brought before a"
862,"court or other competent, independent and impartial authority or judicial body, not later than"
863,"30 days after his/her pretrial detention takes effect. The Committee, conscious of the practice of"
864,"adjourning court hearings, often more than once, urges the States parties to introduce the legal"
865,"provisions necessary to ensure that the court/juvenile judge or other competent body makes a"
866,"final decision on the charges not later than six months after they have been presented."
867,"84. The right to challenge the legality of the deprivation of liberty includes not only the right to"
868,"appeal, but also the right to access the court, or other competent, independent and impartial"
869,"authority or judicial body, in cases where the deprivation of liberty is an administrative decision"
870,"(e.g. the police, the prosecutor and other competent authority). The right to a prompt decision"
871,"means that a decision must be rendered as soon as possible, e.g. within or not later than two"
872,"weeks after the challenge is made."
873,"Treatment and conditions (art. 37 (c))"
874,"85. Every child deprived of liberty shall be separated from adults. A child deprived of his/her"
875,"liberty shall not be placed in an adult prison or other facility for adults. There is abundant"
876,"evidence that the placement of children in adult prisons or jails compromises their basic safety,"
877,"well-being, and their future ability to remain free of crime and to reintegrate. The permitted"
878,"exception to the separation of children from adults stated in article 37 (c) of CRC, “unless it is"
879,"considered in the child’s best interests not to do so”, should be interpreted narrowly; the child’s"
880,"CRC/C/GC/10"
881,"page 23"
882,"best interests does not mean for the convenience of the States parties. States parties should"
883,"establish separate facilities for children deprived of their liberty, which include distinct,"
