"1","United Nations"
126,"39. States should protect the right of migrant domestic workers to freedom of movement and residence, including by ensuring that migrant domestic workers are not required to live with their employers or stay in the house during their time off (article 39). States should also ensure that migrant domestic workers retain possession of travel and identity documents (article 21). In addition, States should take all necessary measures to promote a shift in public perceptions so that domestic work becomes widely recognized as work and domestic workers as workers with fundamental rights, including labour rights."
127,"40. States parties are encouraged to ensure that migrant domestic workers have explicit, written terms of employment, in a language they can understand, outlining their specific duties, hours, remuneration, days of rest, and other conditions of work, in contracts that are free, fair and fully consented to. In particular, States parties may wish to consider developing model or standard provisions for these purposes."
128,"41. States parties should include provisions for monitoring mechanisms of the working conditions of migrant domestic workers in national legislation and strengthen labour inspection services to carry out such monitoring and to receive, investigate and address complaints of alleged violations."
129,"This recommendation is in line with Committee on Economic, Social and Cultural Rights general comment No. 18 (2005) on the right to work, para. 10."
130,"CMW/C/GC/1"
131,"9"
132,"Social security and health services"
133,"42. States parties should ensure that migrant domestic workers are granted access to social security benefits on the basis of equal treatment with nationals (article 27)."
134,"43. States should ensure effective access of all migrant domestic workers to any medical care urgently required to avoid irreparable harm to their health (article 28). Particular attention should be given to women migrant domestic workers with irregular status, who are especially vulnerable during pregnancy, as they are often afraid to contact public health services out of fear of deportation. States should not require public health institutions providing care to report data on the regular or irregular status of a patient to immigration authorities."
135,"44. States should ensure that migrant domestic workers in a documented or regular situation enjoy equal treatment with nationals in relation to social and health services (article 43(1)(e)). Moreover, the Committee recalls the obligations assumed by States under other core international human rights treaties, notably the International Covenant on Economic, Social and Cultural Rights, to take appropriate measures towards ensuring to all persons within their jurisdiction, irrespective of their immigration status, the highest attainable standard of physical and mental health and medical care, services and attention in the event of sickness.9"
136,"Right to organize for collective bargaining and protection"
137,"45. The right to organize and to engage in collective bargaining is essential for migrant domestic workers to express their needs and defend their rights, in particular through trade unions (articles 26 and 40) and labour organizations."
138,"46. The laws of States parties, particularly countries of employment of migrant domestic workers, should recognize the right of the latter to form and join organizations, regardless of migration status (article 26) and self-organization should be encouraged."
139,"47. States parties are encouraged to provide migrant domestic workers with information about relevant associations that can provide assistance in the country/city of origin and employment."
140,"Freedom of religion or belief and freedom of expression"
141,"48. States parties should take effective measures to ensure that migrant domestic workers are free to practise the religion or belief of their choice, as well as their freedom of expression, individually or in community with others, in public and in private, in accordance with articles 12 and 13 of the Convention and other international human rights standards (articles 12 and 13)."
142,"Access to justice and remedies"
143,"49. States of employment should ensure that all migrant domestic workers have access to mechanisms for bringing complaints about violations of their rights (articles 18, paragraph 1, and 83). States parties should ensure that such complaints are investigated in"
144,"See International Covenant on Economic, Social and Cultural Rights, art. 12. As the Committee on Economic, Social and Cultural Rights underlines in its general comment No. 20 (2009) on non- discrimination in economic, social and cultural rights, “The Covenant rights apply to everyone including non-nationals, such as refugees, asylum-seekers, stateless persons, migrant workers and victims of international trafficking, regardless of legal status and documentation” (para. 30). See also Committee on the Elimination of All Forms of Racial Discrimination, general recommendation No. 30 (2004) on discrimination against non citizens."
145,"9"
146,"CMW/C/GC/1"
147,"10"
148,"an appropriate manner and within a reasonable period of time and that cases of violations are appropriately sanctioned. To facilitate access to redress mechanisms, States parties could for example designate a domestic workers’ Ombudsperson. States parties should also ensure that migrant domestic workers can obtain legal redress and remedies for violations of their rights by employers who enjoy diplomatic immunity under the Vienna Convention on Diplomatic Relations."
149,"50. In order to ensure effective access to justice and remedies for all migrant domestic workers, the Committee considers that migrant domestic workers should be able to access courts and other justice mechanisms without fear of being deported as a consequence, and that migrant domestic workers should have access to temporary shelter when needed due to the abusive circumstances of their employment. States parties are encouraged to consider time-bound or expedited legal proceedings to address complaints by migrant domestic workers. Moreover, States parties are encouraged to enter into bilateral agreements in order to ensure that migrants who return to their country of origin may have access to justice in the country of employment, including to complain about abuse and to claim unpaid wages and benefits."
150,"Access to regular migration status"
151,"51. With a view to preventing irregular migration as well as smuggling and human trafficking, States parties should ensure that migrant domestic workers have access to regular channels for migration based on actual demand (article 68)."
152,"52. States parties should take appropriate measures to address the extreme vulnerability of undocumented migrant domestic workers, especially women and children. In particular, States parties should consider policies, including regularization programmes, to avoid or resolve situations in which migrant domestic workers are undocumented or are at risk of falling into irregular status (article 69)."
153,"53. States parties should avoid making the immigration status of migrant domestic workers conditional on the sponsorship or guardianship of a specific employer, since any such arrangement may unduly restrict the liberty of movement of migrant domestic workers (article 39) and increases their vulnerability to exploitation and abuse, including in conditions of forced labour or servitude (article 11)."
154,"Respect for family unity"
155,"54. States parties shall take appropriate measures to protect the unity of the families of migrant domestic workers in a regular situation (article 44, paragraph 1). In particular, migrant domestic workers should have reasonable opportunities for family contact and family-related mobility, including opportunities to communicate with family left behind, travel to participate in essential family matters such as funerals, and, especially in the case of long-term migrants, to visit spouses and children in other countries. States parties should ensure that children separated from one or both parents are allowed to maintain direct contact with both parents on a regular basis."
156,"55. Moreover, States parties should take appropriate measures with regard to migrant domestic workers in a regular situation to facilitate their reunification with their spouses and children (article 44, paragraph 2). In the event of the death of or divorce from a migrant worker with a regular status, States parties should favourably consider granting independent residence status to family members of that migrant worker (article 50)."
157,"Special protections for children"
158,"56. In line with the Convention on the Rights of the Child and relevant International Labour Organization (ILO) instruments, States should ensure that migrant children do not"
159,"CMW/C/GC/1"
160,"10"
161,"perform any type of domestic work which is likely to be hazardous or harmful to their health or physical, mental, spiritual, moral or social development. States shall refrain from adopting policies aimed at recruiting domestic migrant children."
162,"57. States parties shall ensure that all migrant children, independently of their migration status, have access to free and compulsory primary education as well as to secondary education on the basis of equality of treatment with nationals of the State concerned (article 30), and that the domestic work carried out by children does not interfere with their education. Schools should not be required to report data on the regular or irregular status of pupils to immigration authorities."
163,"58. Children of migrant domestic workers shall be registered soon after birth, independently of the migration status of their parents, and be provided with birth certificates and other identity documents States should take all appropriate measures to ensure that children are not deprived of a nationality. (article 29)"
164,"59. States parties should eliminate discriminatory policies and practices that deny or restrict the rights of children of migrant domestic workers, notably their right to health and education (articles 28 and 30)."
165,"Gender perspective"
166,"60. As noted by the Committee on the Elimination of All Forms of Discrimination against Women, the position of female migrants is different from that of male migrants with regard to, inter alia, the migration channels used, the sectors of the labour market where they are employed, the forms of abuse they suffer and the consequences and impact thereof.10 Recognizing that most domestic workers are women and girls and taking into consideration traditional roles, the gendered labour market, the universal prevalence of gender-based violence and the worldwide feminization of poverty and labour migration, States should incorporate a gender perspective in efforts to understand their specific problems and develop remedies to the gender-based discrimination that they face throughout the migration process."
167,"61. States parties should repeal sex-specific bans and discriminatory restrictions on women’s migration on the basis of age, marital status, pregnancy or maternity status (articles 1 and 7), including restrictions that require women to get permission from their spouse or male guardian to obtain a passport or to travel (article 8) or bans on women migrant domestic workers marrying nationals or permanent residents (article 14), or securing independent housing. States parties should also repeal discriminatory laws, regulations and practices related to HIV, including those which result in the loss of work visas based on HIV status, and ensure that medical testing of migrant domestic workers, including tests for pregnancy or HIV, is only done voluntarily and subject to informed consent."
168,"Embassies and consulates"
169,"62. While the States of employment have the primary responsibility to protect the rights of migrant domestic workers, embassies and consulates of States of origin should play an active role in protecting the rights of their nationals employed as migrant domestic workers. In particular, embassies and consulates of countries of origin that are present in countries"
170,"Committee on the Elimination of Discrimination against Women, general recommendation No. 26 (2008) on women migrant workers, para. 5."
171,"11"
172,"CMW/C/GC/1"
173,"where migrant domestic workers are employed are encouraged, in coordination with the authorities in the countries of employment, to:"
174,"(a) Ensure adequately trained staff and mechanisms (including telephone hotlines) to receive and address complaints made by migrant domestic workers, including through the provision of legal aid;"
175,"(b) Provide counselling and facilitate appropriate shelter for migrant domestic workers, especially women and children, fleeing from abusive employment circumstances;"
176,"(c) Expedite the processing of temporary travel documents and return tickets to avoid migrant domestic workers in distress being trapped in shelters for lengthy periods of time;"
177,"(d) Receive, record and report information that can be useful to migrant domestic workers in the country of employment as well as to prospective migrant workers back home regarding:"
178,"(i)  Actual country and employment conditions;"
179,"(ii)  The experience of migrant domestic workers, including travel and arrival,"
180,"migration-related fees and debt, the effects on family, workplace conflicts, issues of rights and access to justice."
181,"63. Embassies and consulates of countries of origin are encouraged to cooperate with each other to identify abusive recruitment agencies and to promote appropriate protection policies for migrant domestic workers."
182,"64. In the case of detention of a migrant domestic worker or a member of his or her family, the person shall be contacted by the embassies or consulates concerned with a view to arranging visits by the relevant consular officials in consultation with the State of employment. (articles 16, paragraph 7, and 23)."
183,"Participation of migrant domestic workers and civil society"
184,"65. The Committee emphasizes the importance of genuine consultations with migrant domestic workers and civil society organizations in the development and implementation of legislative and other measures related to migrant domestic workers and the protection of their rights."
185,"Monitoring and reporting"
186,"66. States parties should include in their reports information about efforts to monitor the situation of migrant domestic workers, including through the provision of statistical data, and to protect their rights under the Convention, keeping in mind the recommendations contained in the present general comment."
187,"12"
