884,"child-centred staff, personnel, policies and practices."
885,"86. This rule does not mean that a child placed in a facility for children has to be moved to a"
886,"facility for adults immediately after he/she turns 18. Continuation of his/her stay in the facility"
887,"for children should be possible if that is in his/her best interest and not contrary to the best"
888,"interests of the younger children in the facility."
889,"87. Every child deprived of liberty has the right to maintain contact with his/her family"
890,"through correspondence and visits. In order to facilitate visits, the child should be placed in a"
891,"facility that is as close as possible to the place of residence of his/her family. Exceptional"
892,"circumstances that may limit this contact should be clearly described in the law and not be left to"
893,"the discretion of the competent authorities."
894,"88. The Committee draws the attention of States parties to the United Nations Rules for the"
895,"Protection of Juveniles Deprived of their Liberty, adopted by the General Assembly in its"
896,"resolution 45/113 of 14 December 1990. The Committee urges the States parties to fully"
897,"implement these rules, while also taking into account as far as relevant the Standard Minimum"
898,"Rules for the Treatment of Prisoners (see also rule 9 of the Beijing Rules). In this regard, the"
899,"Committee recommends that the States parties incorporate these rules into their national laws"
900,"and regulations, and make them available, in the national or regional language, to all"
901,"professionals, NGOs and volunteers involved in the administration of juvenile justice."
902,"89. The Committee wishes to emphasize that, inter alia, the following principles and rules need"
903,"to be observed in all cases of deprivation of liberty:"
904,"− Children should be provided with a physical environment and accommodations which"
905,"are in keeping with the rehabilitative aims of residential placement, and due regard must"
906,"be given to their needs for privacy, sensory stimuli, opportunities to associate with their"
907,"peers, and to participate in sports, physical exercise, in arts, and leisure time activities;"
908,"− Every child of compulsory school age has the right to education suited to his/her needs"
909,"and abilities, and designed to prepare him/her for return to society; in addition, every"
910,"child should, when appropriate, receive vocational training in occupations likely to"
911,"prepare him/her for future employment;"
912,"− Every child has the right to be examined by a physician upon admission to the"
913,"detention/correctional facility and shall receive adequate medical care throughout"
914,"his/her stay in the facility, which should be provided, where possible, by health facilities"
915,"and services of the community;"
916,"− The staff of the facility should promote and facilitate frequent contacts of the child with"
917,"the wider community, including communications with his/her family, friends and other"
918,"persons or representatives of reputable outside organizations, and the opportunity to"
919,"visit his/her home and family;"
920,"CRC/C/GC/10"
921,"page 24"
922,"− Restraint or force can be used only when the child poses an imminent threat of injury to"
923,"him or herself or others, and only when all other means of control have been exhausted."
924,"The use of restraint or force, including physical, mechanical and medical restraints,"
925,"should be under close and direct control of a medical and/or psychological professional."
926,"It must never be used as a means of punishment. Staff of the facility should receive"
927,"training on the applicable standards and members of the staff who use restraint or force"
928,"in violation of the rules and standards should be punished appropriately;"
929,"− Any disciplinary measure must be consistent with upholding the inherent dignity of the"
930,"juvenile and the fundamental objectives of institutional care; disciplinary measures in"
931,"violation of article 37 of CRC must be strictly forbidden, including corporal"
932,"punishment, placement in a dark cell, closed or solitary confinement, or any other"
933,"punishment that may compromise the physical or mental health or well-being of the"
934,"child concerned;"
935,"− Every child should have the right to make requests or complaints, without censorship as"
936,"to the substance, to the central administration, the judicial authority or other proper"
937,"independent authority, and to be informed of the response without delay; children need"
938,"to know about and have easy access to these mechanisms;"
939,"− Independent and qualified inspectors should be empowered to conduct inspections on a"
940,"regular basis and to undertake unannounced inspections on their own initiative; they"
941,"should place special emphasis on holding conversations with children in the facilities, in"
942,"a confidential setting."
943,"V. THE ORGANIZATION OF JUVENILE JUSTICE"
944,"90. In order to ensure the full implementation of the principles and rights elaborated in the"
945,"previous paragraphs, it is necessary to establish an effective organization for the administration"
946,"of juvenile justice, and a comprehensive juvenile justice system. As stated in article 40 (3) of"
947,"CRC, States parties shall seek to promote the establishment of laws, procedures, authorities and"
948,"institutions specifically applicable to children in conflict with the penal law."
949,"91. What the basic provisions of these laws and procedures are required to be, has been"
950,"presented in the present general comment. More and other provisions are left to the discretion of"
951,"States parties. This also applies to the form of these laws and procedures. They can be laid down"
952,"in special chapters of the general criminal and procedural law, or be brought together in a"
953,"separate act or law on juvenile justice."
954,"92. A comprehensive juvenile justice system further requires the establishment of specialized"
955,"units within the police, the judiciary, the court system, the prosecutor’s office, as well as"
956,"specialized defenders or other representatives who provide legal or other appropriate assistance"
957,"to the child."
958,"93. The Committee recommends that the States parties establish juvenile courts either as"
959,"separate units or as part of existing regional/district courts. Where that is not immediately"
960,"feasible for practical reasons, the States parties should ensure the appointment of specialized"
961,"judges or magistrates for dealing with cases of juvenile justice."
962,"CRC/C/GC/10"
963,"page 25"
964,"94. In addition, specialized services such as probation, counselling or supervision should be"
965,"established together with specialized facilities including for example day treatment centres and,"
966,"where necessary, facilities for residential care and treatment of child offenders. In this juvenile"
967,"justice system, an effective coordination of the activities of all these specialized units, services"
968,"and facilities should be promoted in an ongoing manner."
969,"95. It is clear from many States parties’ reports that non-governmental organizations can and"
970,"do play an important role not only in the prevention of juvenile delinquency as such, but also in"
971,"the administration of juvenile justice. The Committee therefore recommends that States parties"
972,"seek the active involvement of these organizations in the development and implementation of"
973,"their comprehensive juvenile justice policy and provide them with the necessary resources for"
974,"this involvement."
975,"VI. AWARENESS-RAISING AND TRAINING"
976,"96. Children who commit offences are often subject to negative publicity in the media, which"
977,"contributes to a discriminatory and negative stereotyping of these children and often of children"
978,"in general. This negative presentation or criminalization of child offenders is often based on"
979,"misrepresentation and/or misunderstanding of the causes of juvenile delinquency, and results"
980,"regularly in a call for a tougher approach (e.g. zero-tolerance, three strikes and you are out,"
981,"mandatory sentences, trial in adult courts and other primarily punitive measures). To create a"
982,"positive environment for a better understanding of the root causes of juvenile delinquency and a"
983,"rights-based approach to this social problem, the States parties should conduct, promote and/or"
984,"support educational and other campaigns to raise awareness of the need and the obligation to"
985,"deal with children alleged of violating the penal law in accordance with the spirit and the letter of"
986,"CRC. In this regard, the States parties should seek the active and positive involvement of"
987,"members of parliament, NGOs and the media, and support their efforts in the improvement of the"
988,"understanding of a rights-based approach to children who have been or are in conflict with the"
989,"penal law. It is crucial for children, in particular those who have experience with the juvenile"
990,"justice system, to be involved in these awareness-raising efforts."
991,"97. It is essential for the quality of the administration of juvenile justice that all the"
992,"professionals involved, inter alia, in law enforcement and the judiciary receive appropriate"
993,"training on the content and meaning of the provisions of CRC in general, particularly those"
994,"directly relevant to their daily practice. This training should be organized in a systematic and"
995,"ongoing manner and should not be limited to information on the relevant national and"
996,"international legal provisions. It should include information on, inter alia, the social and other"
997,"causes of juvenile delinquency, psychological and other aspects of the development of children,"
998,"with special attention to girls and children belonging to minorities or indigenous peoples, the"
999,"culture and the trends in the world of young people, the dynamics of group activities, and the"
1000,"available measures dealing with children in conflict with the penal law, in particular measures"
1001,"without resorting to judicial proceedings (see chapter IV, section B, above)."
1002,"VII. DATA COLLECTION, EVALUATION AND RESEARCH"
1003,"98. The Committee is deeply concerned about the lack of even basic and disaggregated data"
1004,"on, inter alia, the number and nature of offences committed by children, the use and the average"
1005,"duration of pretrial detention, the number of children dealt with by resorting to measures other"
1006,"CRC/C/GC/10"
1007,"page 26"
1008,"than judicial proceedings (diversion), the number of convicted children and the nature of the"
1009,"sanctions imposed on them. The Committee urges the States parties to systematically collect"
1010,"disaggregated data relevant to the information on the practice of the administration of juvenile"
1011,"justice, and necessary for the development, implementation and evaluation of policies and"
1012,"programmes aiming at the prevention and effective responses to juvenile delinquency in full"
1013,"accordance with the principles and provisions of CRC."
1014,"99. The Committee recommends that States parties conduct regular evaluations of their"
1015,"practice of juvenile justice, in particular of the effectiveness of the measures taken, including"
1016,"those concerning discrimination, reintegration and recidivism, preferably carried out by"
1017,"independent academic institutions. Research, as for example on the disparities in the"
1018,"administration of juvenile justice which may amount to discrimination, and developments in the"
1019,"field of juvenile delinquency, such as effective diversion programmes or newly emerging"
1020,"juvenile delinquency activities, will indicate critical points of success and concern. It is"
1021,"important that children are involved in this evaluation and research, in particular those who have"
1022,"been in contact with parts of the juvenile justice system. The privacy of these children and the"
1023,"confidentiality of their cooperation should be fully respected and protected. In this regard, the"
1024,"Committee refers the States parties to the existing international guidelines on the involvement of"
1025,"children in research."
1026,"-----"
